,number,value,datetime_start,datetime_complete,duration,params_boosting,params_feature_fraction,params_learning_rate,params_num_leaves,params_other_rate,params_top_rate,user_attrs_test_error,user_attrs_train_error,user_attrs_uuid,state
334,334,0.3535528596187175,2021-10-14 15:33:25.483023,2021-10-14 15:33:25.793022,0 days 00:00:00.309999,goss,0.5861359781122225,0.047471699940680095,276,0.1867527780230149,0.7998473875373556,0.3535528596187175,0.3414869029275809,f637a0a0-eb3f-42e7-a71e-cc7b0d40b800,COMPLETE
335,335,0.3535528596187175,2021-10-14 15:33:25.795020,2021-10-14 15:33:26.119564,0 days 00:00:00.324544,goss,0.48072201562503825,0.11150592862455856,229,0.47144207979299513,0.519064307537123,0.3535528596187175,0.3414869029275809,02e75875-1a58-46e5-97f0-85a94118418e,COMPLETE
336,336,0.3535528596187175,2021-10-14 15:33:26.124559,2021-10-14 15:33:26.523558,0 days 00:00:00.398999,goss,0.5471589798125934,0.07302134566328208,167,0.027025734597852985,0.32423604658829785,0.3535528596187175,0.3414869029275809,58bba60b-2e42-4d6e-a8de-50d91f9733f9,COMPLETE
337,337,0.3535528596187175,2021-10-14 15:33:26.526561,2021-10-14 15:33:26.860557,0 days 00:00:00.333996,goss,0.4627693940449113,0.13961042507471422,132,0.04502279048865154,0.3618836017305541,0.3535528596187175,0.3414869029275809,84d694a7-e71c-4d5f-b3fc-0b34c9b21782,COMPLETE
338,338,0.3535528596187175,2021-10-14 15:33:26.863561,2021-10-14 15:33:27.247645,0 days 00:00:00.384084,goss,0.3485703616469209,0.06115154587397326,293,0.3925616208150489,0.3162215711946142,0.3535528596187175,0.3414869029275809,6adbb53b-f940-436e-ba93-ecd80b24d3c1,COMPLETE
339,339,0.3535528596187175,2021-10-14 15:33:27.249646,2021-10-14 15:33:27.700646,0 days 00:00:00.451000,goss,0.5297892885590061,0.09215487655072768,210,0.44417902098379924,0.553386505921029,0.3535528596187175,0.3414869029275809,573a5c0a-a78c-45f1-ac1e-8a853662fddd,COMPLETE
340,340,0.3535528596187175,2021-10-14 15:33:27.702645,2021-10-14 15:33:28.090002,0 days 00:00:00.387357,goss,0.49581960533483493,0.08829702651869374,188,0.009154155494437441,0.5170383411700514,0.3535528596187175,0.3414869029275809,d8faa804-673f-4390-be0b-867a3139fb0b,COMPLETE
341,341,0.3535528596187175,2021-10-14 15:33:28.093011,2021-10-14 15:33:28.452997,0 days 00:00:00.359986,goss,0.42133925474258127,0.06715390232733649,254,0.0623099128559515,0.5705899427328055,0.3535528596187175,0.3414869029275809,7b9e451c-9173-4aac-80b0-9903d517b376,COMPLETE
342,342,0.3535528596187175,2021-10-14 15:33:28.456000,2021-10-14 15:33:28.771000,0 days 00:00:00.315000,goss,0.3665376393993224,0.03512058675905575,218,0.13530232981598497,0.5040759361524978,0.3535528596187175,0.3414869029275809,d3673ed6-c78d-4be2-9ba8-16504fbcf029,COMPLETE
343,343,0.3535528596187175,2021-10-14 15:33:28.778005,2021-10-14 15:33:29.104002,0 days 00:00:00.325997,goss,0.408426042907208,0.056978333601149796,193,0.04024673623167938,0.5396897781801437,0.3535528596187175,0.3414869029275809,fef26e6c-84f9-40c8-8be6-c27e72b97877,COMPLETE
344,344,0.3535528596187175,2021-10-14 15:33:29.106002,2021-10-14 15:33:29.431536,0 days 00:00:00.325534,goss,0.4452976654512843,0.04612370496134605,147,0.42796965909661516,0.5349694980815792,0.3535528596187175,0.3414869029275809,a6f2e7f5-57a1-44af-8e58-adbb640ae356,COMPLETE
345,345,0.3535528596187175,2021-10-14 15:33:29.435551,2021-10-14 15:33:29.774533,0 days 00:00:00.338982,goss,0.5303123186936705,0.05538183096796148,271,0.44347111543300843,0.48865090980010306,0.3535528596187175,0.3414869029275809,2b724617-d048-4cd7-8652-80e1b607b797,COMPLETE
346,346,0.3535528596187175,2021-10-14 15:33:29.777539,2021-10-14 15:33:30.080534,0 days 00:00:00.302995,goss,0.5097896493036637,0.5839845840321721,235,0.3839678391929159,0.6016786317354963,0.3535528596187175,0.3414869029275809,43683964-769f-4118-be49-a473af7a7121,COMPLETE
347,347,0.3535528596187175,2021-10-14 15:33:30.083535,2021-10-14 15:33:30.430540,0 days 00:00:00.347005,goss,0.42422699355224525,0.006519060760664759,775,0.12012641161922095,0.4733887539093447,0.3535528596187175,0.3414869029275809,7aba2480-e7ae-4cb5-a859-1d144dad566f,COMPLETE
348,348,0.3535528596187175,2021-10-14 15:33:30.433540,2021-10-14 15:33:30.735538,0 days 00:00:00.301998,goss,0.565748756258768,0.008862724187519032,63,0.30533748468647154,0.6904101962117527,0.3535528596187175,0.3414869029275809,206ba522-cbdb-486c-aa25-1b6477cee389,COMPLETE
349,349,0.3535528596187175,2021-10-14 15:33:30.737535,2021-10-14 15:33:31.042540,0 days 00:00:00.305005,goss,0.07799584394948321,0.007056019913558423,178,0.2915148668717525,0.7073543247370397,0.3535528596187175,0.3414869029275809,ad047a72-3a4d-4eb0-9ad9-95aa4ea53835,COMPLETE
350,350,0.3535528596187175,2021-10-14 15:33:31.044540,2021-10-14 15:33:31.359541,0 days 00:00:00.315001,goss,0.02334418801447597,0.006761431708332276,675,0.07745618910871649,0.45480525521215864,0.3535528596187175,0.3414869029275809,35bdf028-c481-47a4-b73b-1007cb7f226c,COMPLETE
351,351,0.3535528596187175,2021-10-14 15:33:31.362537,2021-10-14 15:33:31.669540,0 days 00:00:00.307003,goss,0.06394043749569567,0.005202466440974222,40,0.11905499745653743,0.4616784791956071,0.3535528596187175,0.3414869029275809,9dabce89-a3ce-4a81-bfdd-c4d8a7787e01,COMPLETE
352,352,0.3535528596187175,2021-10-14 15:33:31.672540,2021-10-14 15:33:32.010080,0 days 00:00:00.337540,goss,0.030581638648552657,0.004765236374578532,714,0.42870681926363663,0.5678272890789706,0.3535528596187175,0.3414869029275809,141bba81-a004-466d-ba9a-816c3b7db6a2,COMPLETE
353,353,0.3535528596187175,2021-10-14 15:33:32.012079,2021-10-14 15:33:32.342618,0 days 00:00:00.330539,goss,0.06904655674417155,0.4908130093403414,759,0.006159373305043504,0.5524051483440922,0.3535528596187175,0.3414869029275809,de394814-b3ed-4df9-bee2-dafdebaab18f,COMPLETE
354,354,0.3535528596187175,2021-10-14 15:33:32.344619,2021-10-14 15:33:32.709619,0 days 00:00:00.365000,goss,0.10298560156653623,0.00984451176286057,698,0.09322065822104955,0.39015449229778515,0.3535528596187175,0.3414869029275809,dc48e1c8-c653-4a8d-a58b-552c490264c3,COMPLETE
355,355,0.3535528596187175,2021-10-14 15:33:32.712618,2021-10-14 15:33:33.094624,0 days 00:00:00.382006,goss,0.0807665898836819,0.005499272309326585,725,0.07210177478753692,0.7839488830741438,0.3535528596187175,0.3414869029275809,0f19f1d9-95b0-4359-9b4d-7b733c3096c2,COMPLETE
356,356,0.3535528596187175,2021-10-14 15:33:33.097625,2021-10-14 15:33:33.414618,0 days 00:00:00.316993,goss,0.005143251127304887,0.004254812363180123,98,0.10001210705727466,0.6641223332904429,0.3535528596187175,0.3414869029275809,ac458dc4-0876-4da5-b5c3-02e07692b67a,COMPLETE
357,357,0.3535528596187175,2021-10-14 15:33:33.416619,2021-10-14 15:33:33.780619,0 days 00:00:00.364000,goss,0.018936244429181313,0.011145783016241351,53,0.36857993096095937,0.6173458970436646,0.3535528596187175,0.3414869029275809,ef7b7dd7-0d24-4d74-a41d-8d75669a285f,COMPLETE
358,358,0.3535528596187175,2021-10-14 15:33:33.784619,2021-10-14 15:33:34.140623,0 days 00:00:00.356004,goss,0.002715182223144908,0.014101529934670044,759,0.4058648029175923,0.59199865249265,0.3535528596187175,0.3414869029275809,d5c75cc1-d324-47cd-a821-da6dfcb0b484,COMPLETE
359,359,0.3535528596187175,2021-10-14 15:33:34.143624,2021-10-14 15:33:34.526268,0 days 00:00:00.382644,goss,0.10909348372913591,0.8575649200825065,743,0.05854703819807486,0.6499092339661974,0.3535528596187175,0.3414869029275809,8dbc2b7c-3a8a-47e0-b7b9-c21b8d2ac6c6,COMPLETE
360,360,0.3535528596187175,2021-10-14 15:33:34.530266,2021-10-14 15:33:34.877509,0 days 00:00:00.347243,goss,0.05624261515120242,0.007405548605462189,747,0.22484137247205016,0.7646857308356767,0.3535528596187175,0.3414869029275809,4b643cad-7f58-4d65-9115-47fbce6872af,COMPLETE
361,361,0.3535528596187175,2021-10-14 15:33:34.880513,2021-10-14 15:33:35.227621,0 days 00:00:00.347108,goss,0.045085869173177875,0.01480815383886464,77,0.35608354767241945,0.6405529727736343,0.3535528596187175,0.3414869029275809,4b44f685-aa9d-4027-8b51-843da1cf1354,COMPLETE
362,362,0.3535528596187175,2021-10-14 15:33:35.230621,2021-10-14 15:33:35.625623,0 days 00:00:00.395002,goss,0.06713219775489747,0.0122547225876291,710,0.11258157926454262,0.7236119350588888,0.3535528596187175,0.3414869029275809,a08cceeb-a18b-4530-9f57-fdc0888209aa,COMPLETE
363,363,0.3535528596187175,2021-10-14 15:33:35.628629,2021-10-14 15:33:35.980620,0 days 00:00:00.351991,goss,0.039205691214810615,0.02681439584706348,713,0.08986405667186444,0.6214178940494456,0.3535528596187175,0.3414869029275809,9d27c00a-9ba4-4f61-9822-0081eacfcea2,COMPLETE
364,364,0.3535528596187175,2021-10-14 15:33:35.983621,2021-10-14 15:33:36.339160,0 days 00:00:00.355539,goss,0.08388399339007631,0.003932024281081743,774,0.2362973243793529,0.7521023641584984,0.3535528596187175,0.3414869029275809,a99fe321-2f4b-49fe-8746-40a130c8db2d,COMPLETE
365,365,0.3535528596187175,2021-10-14 15:33:36.343169,2021-10-14 15:33:36.739165,0 days 00:00:00.395996,goss,0.11389649172194345,0.0029354303953755814,732,0.3173691396310913,0.6699670727765096,0.3535528596187175,0.3414869029275809,766a3bf6-422a-49c1-abd2-270a0b8bd916,COMPLETE
366,366,0.3535528596187175,2021-10-14 15:33:36.742164,2021-10-14 15:33:37.105716,0 days 00:00:00.363552,goss,0.089698427718052,0.0024459304573396013,701,0.22465882500810475,0.7014072341267454,0.3535528596187175,0.3414869029275809,83975b22-2c34-4236-a4bc-caa1eb7037dc,COMPLETE
367,367,0.3535528596187175,2021-10-14 15:33:37.108723,2021-10-14 15:33:37.464259,0 days 00:00:00.355536,goss,0.11359669845627268,0.007971587212810076,793,0.2565097932929521,0.7414129963015192,0.3535528596187175,0.3414869029275809,5e551931-c754-41d4-8cc2-b08e68a246e5,COMPLETE
368,368,0.3535528596187175,2021-10-14 15:33:37.467259,2021-10-14 15:33:37.797314,0 days 00:00:00.330055,goss,0.06178149069411726,0.0046375643852672056,10,0.17101876062270877,0.8243567018908659,0.3535528596187175,0.3414869029275809,36c4c119-dfad-41a8-8f0e-5a259f07d3df,COMPLETE
369,369,0.3535528596187175,2021-10-14 15:33:37.800315,2021-10-14 15:33:38.133476,0 days 00:00:00.333161,goss,0.03873909031415124,0.011046983473546133,766,0.09275258460855045,0.778770821515533,0.3535528596187175,0.3414869029275809,1c31efd0-49f5-4e09-b846-f25b31a6bd71,COMPLETE
370,370,0.3535528596187175,2021-10-14 15:33:38.135475,2021-10-14 15:33:38.540486,0 days 00:00:00.405011,goss,0.10326028494718081,0.005458716054276921,809,0.3659048781852268,0.6294318369389637,0.3535528596187175,0.3414869029275809,2b30e79a-7ce1-4d1a-b630-316759052cf0,COMPLETE
371,371,0.3535528596187175,2021-10-14 15:33:38.542478,2021-10-14 15:33:38.907481,0 days 00:00:00.365003,goss,0.13222007970897945,0.015264615469222725,788,0.07654022344867453,0.6865854730244745,0.3535528596187175,0.3414869029275809,867c3694-ec6a-43ea-b87c-3d92abe6f5ec,COMPLETE
372,372,0.3535528596187175,2021-10-14 15:33:38.909482,2021-10-14 15:33:39.205474,0 days 00:00:00.295992,gbdt,0.1584582710821645,0.0019636077308549703,651,,,0.3535528596187175,0.3414869029275809,0241fdaf-7a88-4700-a5fe-cccf876a05df,COMPLETE
373,373,0.3535528596187175,2021-10-14 15:33:39.210478,2021-10-14 15:33:39.562476,0 days 00:00:00.351998,gbdt,0.12958012179942924,0.005890131673685612,696,,,0.3535528596187175,0.3414869029275809,904a4d2a-bf1c-47f3-983f-cd50b9bd527a,COMPLETE
374,374,0.3535528596187175,2021-10-14 15:33:39.565477,2021-10-14 15:33:39.893480,0 days 00:00:00.328003,gbdt,0.17002189786700125,0.02233019695273517,849,,,0.3535528596187175,0.3414869029275809,89d7551a-0f4a-456b-92e6-68af790b1ad7,COMPLETE
375,375,0.3535528596187175,2021-10-14 15:33:39.896487,2021-10-14 15:33:40.252482,0 days 00:00:00.355995,gbdt,0.19641861828661283,0.008731846579619885,810,,,0.3535528596187175,0.3414869029275809,394165d1-092c-4eec-8741-c9a3907bce36,COMPLETE
376,376,0.3535528596187175,2021-10-14 15:33:40.255477,2021-10-14 15:33:40.759055,0 days 00:00:00.503578,gbdt,0.03440677594487933,0.01640608186884412,865,,,0.3535528596187175,0.3414869029275809,471fc67d-f7f7-41cb-862d-8e91438f4482,COMPLETE
377,377,0.3535528596187175,2021-10-14 15:33:40.762059,2021-10-14 15:33:41.119597,0 days 00:00:00.357538,gbdt,0.16098785124791448,0.010168229507762123,659,,,0.3535528596187175,0.3414869029275809,54e5f45e-a0b9-4102-b9ac-6d7a01fe9c11,COMPLETE
378,378,0.3535528596187175,2021-10-14 15:33:41.122598,2021-10-14 15:33:41.436595,0 days 00:00:00.313997,gbdt,0.025817614794213913,0.0019611695155366577,831,,,0.3535528596187175,0.3414869029275809,ae9202d7-e62b-4fda-9a52-defaa91c4fda,COMPLETE
379,379,0.3535528596187175,2021-10-14 15:33:41.438596,2021-10-14 15:33:41.770238,0 days 00:00:00.331642,gbdt,0.19480701377804682,0.0016854447034194125,882,,,0.3535528596187175,0.3414869029275809,a337af33-cc7d-4348-b76b-392d57f5c611,COMPLETE
380,380,0.3535528596187175,2021-10-14 15:33:41.773235,2021-10-14 15:33:42.130241,0 days 00:00:00.357006,gbdt,0.0430386699155834,0.0031505593562586973,642,,,0.3535528596187175,0.3414869029275809,633809ac-264c-4da2-add1-323eace8c8d1,COMPLETE
381,381,0.3535528596187175,2021-10-14 15:33:42.133241,2021-10-14 15:33:42.449783,0 days 00:00:00.316542,gbdt,0.14443053283820012,0.0028954683433132953,672,,,0.3535528596187175,0.3414869029275809,3b6852ed-c1a5-4bc5-b6e5-4c49e4a40a51,COMPLETE
382,382,0.3535528596187175,2021-10-14 15:33:42.451788,2021-10-14 15:33:42.867781,0 days 00:00:00.415993,gbdt,0.1573644468064354,0.002206033030530659,826,,,0.3535528596187175,0.3414869029275809,1bd38e97-e064-43b2-8e56-7b52e80de393,COMPLETE
383,383,0.3535528596187175,2021-10-14 15:33:42.870784,2021-10-14 15:33:43.248784,0 days 00:00:00.378000,gbdt,0.02297923112764602,0.0018405804761060746,850,,,0.3535528596187175,0.3414869029275809,d6580be2-3b4c-4ccc-afb7-6c697f6c77de,COMPLETE
384,384,0.3535528596187175,2021-10-14 15:33:43.251783,2021-10-14 15:33:43.630782,0 days 00:00:00.378999,gbdt,0.18036985332075095,0.0014964225720989323,818,,,0.3535528596187175,0.3414869029275809,449f5fea-10cd-4754-a765-ff53e405f808,COMPLETE
385,385,0.3535528596187175,2021-10-14 15:33:43.634779,2021-10-14 15:33:43.993780,0 days 00:00:00.359001,gbdt,0.21836514442914318,0.0016603125551207965,890,,,0.3535528596187175,0.3414869029275809,cc6ddaa4-3fda-4324-9867-8d3657a98236,COMPLETE
386,386,0.3535528596187175,2021-10-14 15:33:43.996784,2021-10-14 15:33:44.436140,0 days 00:00:00.439356,gbdt,0.13348057088798074,0.0024793604637940573,851,,,0.3535528596187175,0.3414869029275809,74406231-7933-47a4-b95b-c768387ecc28,COMPLETE
387,387,0.3535528596187175,2021-10-14 15:33:44.440141,2021-10-14 15:33:44.799684,0 days 00:00:00.359543,gbdt,0.19652820896805537,0.0012411705096466918,870,,,0.3535528596187175,0.3414869029275809,cb3f2b1b-a434-4e97-bc42-6da17b9ec955,COMPLETE
388,388,0.3535528596187175,2021-10-14 15:33:44.802682,2021-10-14 15:33:45.091681,0 days 00:00:00.288999,gbdt,0.17676235324254633,0.0013154194379581268,615,,,0.3535528596187175,0.3414869029275809,ab5e4d3d-769f-414a-948e-b557d5dacb3c,COMPLETE
389,389,0.3535528596187175,2021-10-14 15:33:45.094682,2021-10-14 15:33:45.394766,0 days 00:00:00.300084,gbdt,0.14969535486712754,0.0017795684104356735,632,,,0.3535528596187175,0.3414869029275809,3d5d0acf-0581-43c4-bb7b-f77f5b740a15,COMPLETE
390,390,0.3535528596187175,2021-10-14 15:33:45.397762,2021-10-14 15:33:45.773762,0 days 00:00:00.376000,gbdt,0.23399849152697738,0.0010452736826890143,897,,,0.3535528596187175,0.3414869029275809,16233576-5e0a-4431-886d-bfee5a14cc1b,COMPLETE
391,391,0.3535528596187175,2021-10-14 15:33:45.775762,2021-10-14 15:33:46.141765,0 days 00:00:00.366003,gbdt,0.13061076340023783,0.002256553632619597,831,,,0.3535528596187175,0.3414869029275809,711b2411-3e4d-4b1a-ab28-414fb3159316,COMPLETE
392,392,0.3535528596187175,2021-10-14 15:33:46.143763,2021-10-14 15:33:46.457762,0 days 00:00:00.313999,gbdt,0.20827679582555184,0.0011793439037489776,866,,,0.3535528596187175,0.3414869029275809,ca77d5f1-3ab5-40fd-b783-c0d9e5e88b80,COMPLETE
393,393,0.3535528596187175,2021-10-14 15:33:46.461766,2021-10-14 15:33:46.803307,0 days 00:00:00.341541,gbdt,0.16309690855734527,0.0010022611376759693,874,,,0.3535528596187175,0.3414869029275809,3782ed17-8cd6-41eb-985a-f48cca0ba3bd,COMPLETE
394,394,0.3535528596187175,2021-10-14 15:33:46.806302,2021-10-14 15:33:47.126393,0 days 00:00:00.320091,gbdt,0.1886180492399208,0.002127032338014018,581,,,0.3535528596187175,0.3414869029275809,7fbe40c5-9432-4dea-a018-71c83110fcf8,COMPLETE
395,395,0.3535528596187175,2021-10-14 15:33:47.129393,2021-10-14 15:33:47.442571,0 days 00:00:00.313178,gbdt,0.2612948935707204,0.0015032054438994446,626,,,0.3535528596187175,0.3414869029275809,472ba4ad-dfe7-4ba6-ae8e-64b0a6e1bdee,COMPLETE
396,396,0.3535528596187175,2021-10-14 15:33:47.444574,2021-10-14 15:33:47.753106,0 days 00:00:00.308532,gbdt,0.2229484164586253,0.0008351956405925428,595,,,0.3535528596187175,0.3414869029275809,69851616-135d-49bc-a45c-7461e6686b84,COMPLETE
397,397,0.3535528596187175,2021-10-14 15:33:47.758109,2021-10-14 15:33:48.107105,0 days 00:00:00.348996,gbdt,0.2043756264604773,0.001180577919368525,909,,,0.3535528596187175,0.3414869029275809,e976b492-a8f4-46d2-91a2-012021fb224c,COMPLETE
398,398,0.3535528596187175,2021-10-14 15:33:48.109677,2021-10-14 15:33:48.455644,0 days 00:00:00.345967,gbdt,0.18994603935644908,0.0014597056878201478,941,,,0.3535528596187175,0.3414869029275809,2da47a8b-d0a6-47c4-9661-35be3dfa3d5b,COMPLETE
399,399,0.3535528596187175,2021-10-14 15:33:48.458645,2021-10-14 15:33:48.788647,0 days 00:00:00.330002,gbdt,0.14537362740077114,0.0008892643240981901,604,,,0.3535528596187175,0.3414869029275809,7b289320-ffbe-43d7-b03e-89672dc5a365,COMPLETE
400,400,0.3535528596187175,2021-10-14 15:33:48.790647,2021-10-14 15:33:49.146196,0 days 00:00:00.355549,gbdt,0.1879295711615116,0.0010295780016751574,924,,,0.3535528596187175,0.3414869029275809,0514a662-1152-4722-8e31-f7e0f2ee052c,COMPLETE
401,401,0.3535528596187175,2021-10-14 15:33:49.149197,2021-10-14 15:33:49.522482,0 days 00:00:00.373285,gbdt,0.17948356136336982,0.001336557166209682,896,,,0.3535528596187175,0.3414869029275809,5b27a0c9-b9db-4fdf-a18e-2c0764966f93,COMPLETE
402,402,0.3535528596187175,2021-10-14 15:33:49.525478,2021-10-14 15:33:49.894021,0 days 00:00:00.368543,gbdt,0.9729091842046429,0.001532787493314062,932,,,0.3535528596187175,0.3414869029275809,a671cf88-7d1a-42a5-b79e-19360a121d4a,COMPLETE
403,403,0.3535528596187175,2021-10-14 15:33:49.897019,2021-10-14 15:33:50.251695,0 days 00:00:00.354676,gbdt,0.9766229793446807,0.0009824171422237486,901,,,0.3535528596187175,0.3414869029275809,ab8b0ed5-b359-4d46-b861-fc3a5bbf4728,COMPLETE
404,404,0.3535528596187175,2021-10-14 15:33:50.254691,2021-10-14 15:33:50.678690,0 days 00:00:00.423999,gbdt,0.9544796924918466,0.0012555907474531506,934,,,0.3535528596187175,0.3414869029275809,9e30e1c2-6861-4467-96a6-98c6323e01aa,COMPLETE
405,405,0.3535528596187175,2021-10-14 15:33:50.680689,2021-10-14 15:33:51.056783,0 days 00:00:00.376094,gbdt,0.9829485271562204,0.0011035575857601667,915,,,0.3535528596187175,0.3414869029275809,84fa1234-c2e2-4afd-b0e1-e776e8da60b0,COMPLETE
406,406,0.3535528596187175,2021-10-14 15:33:51.058778,2021-10-14 15:33:51.421784,0 days 00:00:00.363006,gbdt,0.9612070374568938,0.0007148310180183552,947,,,0.3535528596187175,0.3414869029275809,e7b5a280-69b3-4397-9ba6-f13a19aa77ba,COMPLETE
407,407,0.3535528596187175,2021-10-14 15:33:51.423784,2021-10-14 15:33:51.745782,0 days 00:00:00.321998,gbdt,0.9302378522976489,0.0008908773088344005,561,,,0.3535528596187175,0.3414869029275809,38b3fd43-4709-4798-9f9e-e0d5ed724713,COMPLETE
408,408,0.3535528596187175,2021-10-14 15:33:51.748784,2021-10-14 15:33:52.070327,0 days 00:00:00.321543,gbdt,0.9129336141838614,0.0007528936473828086,562,,,0.3535528596187175,0.3414869029275809,37619cfd-af8e-4f08-beaf-d5f103136cc8,COMPLETE
409,409,0.3535528596187175,2021-10-14 15:33:52.072325,2021-10-14 15:33:52.381535,0 days 00:00:00.309210,gbdt,0.9403885090754751,0.0007311336266604922,552,,,0.3535528596187175,0.3414869029275809,7980a145-ff39-412e-9d22-7c325fd49abe,COMPLETE
410,410,0.3535528596187175,2021-10-14 15:33:52.384529,2021-10-14 15:33:52.699534,0 days 00:00:00.315005,gbdt,0.9288805576390133,0.00094208216342114,542,,,0.3535528596187175,0.3414869029275809,c7b2b417-7cf6-4ddf-8850-e9140741081a,COMPLETE
411,411,0.3535528596187175,2021-10-14 15:33:52.702525,2021-10-14 15:33:53.028528,0 days 00:00:00.326003,gbdt,0.95544309509302,0.001214496195527771,591,,,0.3535528596187175,0.3414869029275809,9f0dc6b1-9721-40b5-a0d4-b1eb8a80fcf4,COMPLETE
412,412,0.3535528596187175,2021-10-14 15:33:53.031529,2021-10-14 15:33:53.343528,0 days 00:00:00.311999,gbdt,0.9258281353215511,0.0006493213644942651,607,,,0.3535528596187175,0.3414869029275809,7b455c4b-e988-4b14-af2a-1a5c9dbaa53e,COMPLETE
413,413,0.3535528596187175,2021-10-14 15:33:53.345525,2021-10-14 15:33:53.661611,0 days 00:00:00.316086,gbdt,0.9961311508511177,0.0008287479548015225,566,,,0.3535528596187175,0.3414869029275809,0b61cda8-7ffe-47c6-8732-517adb8b1ba0,COMPLETE
414,414,0.3535528596187175,2021-10-14 15:33:53.664616,2021-10-14 15:33:53.998614,0 days 00:00:00.333998,gbdt,0.9382039145197373,0.0010638054254683235,919,,,0.3535528596187175,0.3414869029275809,e4605bb2-aa4e-4349-b4b2-d2e305d3f85b,COMPLETE
415,415,0.3535528596187175,2021-10-14 15:33:54.000618,2021-10-14 15:33:54.283163,0 days 00:00:00.282545,gbdt,0.9691865590335808,0.0009119139909051394,579,,,0.3535528596187175,0.3414869029275809,9790ec48-1360-4e72-ad60-40173aae0c39,COMPLETE
416,416,0.3535528596187175,2021-10-14 15:33:54.286154,2021-10-14 15:33:54.619681,0 days 00:00:00.333527,gbdt,0.893171895483924,0.00014648438188829283,947,,,0.3535528596187175,0.3414869029275809,30c19b93-4e31-41df-8331-0fde3dd1d1ca,COMPLETE
417,417,0.3535528596187175,2021-10-14 15:33:54.622678,2021-10-14 15:33:54.938680,0 days 00:00:00.316002,gbdt,0.9070823116380962,0.0006648363923814415,907,,,0.3535528596187175,0.3414869029275809,d09d9cbc-0b61-41e7-8123-638432581539,COMPLETE
