,number,value,datetime_start,datetime_complete,duration,params_boosting,params_feature_fraction,params_learning_rate,params_num_leaves,params_other_rate,params_top_rate,user_attrs_test_error,user_attrs_train_error,user_attrs_uuid,state
0,0,0.3535528596187175,2021-10-14 15:31:34.702545,2021-10-14 15:31:35.114533,0 days 00:00:00.411988,goss,0.9434906961217091,0.04369568727906464,679,0.41371541395290296,0.2942774541374712,0.3535528596187175,0.3414869029275809,9490d081-d4f9-44d3-8548-c32be36db985,COMPLETE
1,1,0.3535528596187175,2021-10-14 15:31:35.116530,2021-10-14 15:31:35.581529,0 days 00:00:00.464999,goss,0.49696890338204447,0.0018321925223909097,898,0.14327295469535892,0.3159695889224795,0.3535528596187175,0.3414869029275809,8de26ee3-1b8d-4d64-b317-b430badd4077,COMPLETE
2,2,0.3535528596187175,2021-10-14 15:31:35.584535,2021-10-14 15:31:35.864532,0 days 00:00:00.279997,gbdt,0.7459513002965085,0.00010477202048063907,178,,,0.3535528596187175,0.3414869029275809,7575087c-efab-4d0b-b448-0820d29db3e8,COMPLETE
3,3,0.3535528596187175,2021-10-14 15:31:35.866534,2021-10-14 15:31:36.333538,0 days 00:00:00.467004,gbdt,0.9842739441856758,0.043372907702995345,403,,,0.3535528596187175,0.3414869029275809,3cd683d6-9581-4e61-8691-f36321bb274f,COMPLETE
4,4,0.3535528596187175,2021-10-14 15:31:36.335529,2021-10-14 15:31:36.859179,0 days 00:00:00.523650,gbdt,0.5226410265619217,0.0006521401646763073,815,,,0.3535528596187175,0.3414869029275809,6c91eeef-8465-49bd-ac11-b5f85a2c63cb,COMPLETE
5,5,0.3535528596187175,2021-10-14 15:31:36.861173,2021-10-14 15:31:37.318699,0 days 00:00:00.457526,gbdt,0.0759189885015622,0.5480502365897593,589,,,0.3535528596187175,0.3414869029275809,c1852c08-c560-47a8-b05e-268f41c5e9e2,COMPLETE
6,6,0.3535528596187175,2021-10-14 15:31:37.322706,2021-10-14 15:31:37.678707,0 days 00:00:00.356001,goss,0.11081977291709233,0.03753382313373361,253,0.06946321871161054,0.6863843312473736,0.3535528596187175,0.3414869029275809,a11ce851-e121-4770-acb6-03441c963129,COMPLETE
7,7,0.3535528596187175,2021-10-14 15:31:37.680699,2021-10-14 15:31:38.153700,0 days 00:00:00.473001,goss,0.0656646477289019,0.019431654312791077,984,0.234431515813475,0.7119101004409376,0.3535528596187175,0.3414869029275809,ed21a513-6c89-4a27-ba2e-317b60c61195,COMPLETE
8,8,0.3535528596187175,2021-10-14 15:31:38.156696,2021-10-14 15:31:38.511700,0 days 00:00:00.355004,gbdt,0.34567938761342387,0.01625795799240216,786,,,0.3535528596187175,0.3414869029275809,ebe2cc65-f54a-4710-81f0-d143eebba2ba,COMPLETE
9,9,0.3535528596187175,2021-10-14 15:31:38.513698,2021-10-14 15:31:39.013699,0 days 00:00:00.500001,gbdt,0.6405929667266868,0.005031354446525494,842,,,0.3535528596187175,0.3414869029275809,ff5975ca-d277-40eb-82f9-26f0fea83cb2,COMPLETE
10,10,0.3535528596187175,2021-10-14 15:31:39.015696,2021-10-14 15:31:39.374697,0 days 00:00:00.359001,goss,0.9686309573437203,0.3360624841197018,19,0.6609601292829079,0.15186364064069574,0.3535528596187175,0.3414869029275809,e47a4940-73bf-45ee-95ae-e44d53643514,COMPLETE
11,11,0.3535528596187175,2021-10-14 15:31:39.378711,2021-10-14 15:31:39.824773,0 days 00:00:00.446062,goss,0.2857261661858034,0.0021061939799582527,615,0.4579233530427569,0.24851497767928235,0.3535528596187175,0.3414869029275809,d48f1708-bb0b-43cf-8f2d-72c50ecb8aba,COMPLETE
12,12,0.3535528596187175,2021-10-14 15:31:39.827773,2021-10-14 15:31:40.306773,0 days 00:00:00.479000,goss,0.775294308075537,0.1581110692629988,994,0.319211780280238,0.3760526955232725,0.3535528596187175,0.3414869029275809,913378c0-97bf-45be-aba7-f762404af0c2,COMPLETE
13,13,0.3535528596187175,2021-10-14 15:31:40.311774,2021-10-14 15:31:40.674771,0 days 00:00:00.362997,goss,0.4144544602922155,0.0007330999681458024,688,0.8173076328788085,0.02680989046020893,0.3535528596187175,0.3414869029275809,6780c2d8-819a-4616-83c9-3ab3d7e2a1c4,COMPLETE
14,14,0.3535528596187175,2021-10-14 15:31:40.676770,2021-10-14 15:31:41.000772,0 days 00:00:00.324002,goss,0.575155473670639,0.004326367819095194,479,0.08616054616297247,0.4379763245698146,0.3535528596187175,0.3414869029275809,50a4cfaf-be55-4cbe-9640-e4fe1a881745,COMPLETE
15,15,0.3535528596187175,2021-10-14 15:31:41.003773,2021-10-14 15:31:41.361770,0 days 00:00:00.357997,goss,0.8276377478869571,0.09512891310786015,866,0.060199974640650133,0.9259947638442547,0.3535528596187175,0.3414869029275809,6f9388f1-f925-42b0-b48c-ca32f8bf0e33,COMPLETE
16,16,0.3535528596187175,2021-10-14 15:31:41.363770,2021-10-14 15:31:41.824770,0 days 00:00:00.461000,goss,0.2532108692871007,0.000931947560521,699,0.4560901394377407,0.31445056611903566,0.3535528596187175,0.3414869029275809,196962b0-ea2c-4bac-bd7f-b9aec48852af,COMPLETE
17,17,0.3535528596187175,2021-10-14 15:31:41.826773,2021-10-14 15:31:42.221774,0 days 00:00:00.395001,goss,0.8725337204786116,0.006256694966481786,433,0.0026237374573556405,0.5937056945038003,0.3535528596187175,0.3414869029275809,1d271b58-053b-48ed-bbd3-4c20703aee48,COMPLETE
18,18,0.3535528596187175,2021-10-14 15:31:42.224777,2021-10-14 15:31:42.618314,0 days 00:00:00.393537,goss,0.8555976610265004,0.1219375973818947,710,0.021311379421257104,0.962782630931401,0.3535528596187175,0.3414869029275809,8b38eb59-e763-472d-85c1-0353109705e3,COMPLETE
19,19,0.3535528596187175,2021-10-14 15:31:42.620310,2021-10-14 15:31:42.940319,0 days 00:00:00.320009,goss,0.27359661236865973,0.000128254167298919,557,0.5041951187048375,0.19294348696485236,0.3535528596187175,0.3414869029275809,e90c92f3-d7d5-4047-9622-364aba9d9204,COMPLETE
20,20,0.3535528596187175,2021-10-14 15:31:42.942310,2021-10-14 15:31:43.228310,0 days 00:00:00.286000,goss,0.6882457180154381,0.00781980181556135,380,0.21698276582140083,0.5821116472868741,0.3535528596187175,0.3414869029275809,686b08d5-87df-48ec-8f06-f3c19cdb36ce,COMPLETE
21,21,0.3535528596187175,2021-10-14 15:31:43.230310,2021-10-14 15:31:43.530315,0 days 00:00:00.300005,goss,0.8784556237092365,0.12724630586312421,688,0.01565109064407709,0.9457787054781769,0.3535528596187175,0.3414869029275809,b08c4b67-3170-46f5-af82-72e29310a9bf,COMPLETE
22,22,0.3535528596187175,2021-10-14 15:31:43.532315,2021-10-14 15:31:43.815422,0 days 00:00:00.283107,goss,0.9216850092835525,0.00011132880648744074,557,0.6105419210518801,0.14956406929699917,0.3535528596187175,0.3414869029275809,d1e05222-dbd2-4578-b538-9fe7868d7fcd,COMPLETE
23,23,0.3535528596187175,2021-10-14 15:31:43.817417,2021-10-14 15:31:44.079420,0 days 00:00:00.262003,goss,0.6904651885190712,0.0003201738287326782,324,0.22342589230534954,0.5422389435472749,0.3535528596187175,0.3414869029275809,d0daf8bf-8015-434d-a3fb-c24eacb9024a,COMPLETE
24,24,0.3535528596187175,2021-10-14 15:31:44.081419,2021-10-14 15:31:44.376421,0 days 00:00:00.295002,goss,0.7580521540444127,0.060796815080594334,357,0.03355025849727491,0.8355439059506959,0.3535528596187175,0.3414869029275809,3bba9f87-bedc-41c2-ada3-9bcf4138835c,COMPLETE
25,25,0.3535528596187175,2021-10-14 15:31:44.378421,2021-10-14 15:31:44.678423,0 days 00:00:00.300002,goss,0.9200334899725383,0.8358699174787858,547,0.65701026415075,0.07701575576372338,0.3535528596187175,0.3414869029275809,c06c7653-d93c-4dce-8050-3cc543813520,COMPLETE
26,26,0.3535528596187175,2021-10-14 15:31:44.680421,2021-10-14 15:31:44.954418,0 days 00:00:00.273997,goss,0.6522218147613194,0.0002367295775666253,280,0.32662084417738957,0.49284007677497116,0.3535528596187175,0.3414869029275809,f9d8a3a7-b023-4007-a84e-0e0a0896daf5,COMPLETE
27,27,0.3535528596187175,2021-10-14 15:31:44.956419,2021-10-14 15:31:45.227422,0 days 00:00:00.271003,goss,0.7571270323369379,0.052359321654918155,301,0.14729689400734208,0.8259026179413481,0.3535528596187175,0.3414869029275809,280d4ed9-00b2-48fd-96ba-2a101369b0c6,COMPLETE
28,28,0.3535528596187175,2021-10-14 15:31:45.229418,2021-10-14 15:31:45.512179,0 days 00:00:00.282761,goss,0.9238301286671268,0.2716050694524344,177,0.9142989564978186,0.02484452510743984,0.3535528596187175,0.3414869029275809,1c1be85d-efcb-4509-932d-782148c14874,COMPLETE
29,29,0.3535528596187175,2021-10-14 15:31:45.514176,2021-10-14 15:31:45.824178,0 days 00:00:00.310002,goss,0.6065824796325372,0.7858800561489446,480,0.34428563420812774,0.4548785149157498,0.3535528596187175,0.3414869029275809,b5c11e7a-6bad-4a74-a591-d84fe58582e6,COMPLETE
30,30,0.3535528596187175,2021-10-14 15:31:45.826181,2021-10-14 15:31:46.094713,0 days 00:00:00.268532,goss,0.47065852062190383,0.016579355881221492,53,0.1551681007822603,0.7181630675845065,0.3535528596187175,0.3414869029275809,eb07b75a-4575-4dc7-be1b-00f1ca434cb9,COMPLETE
31,31,0.3535528596187175,2021-10-14 15:31:46.096710,2021-10-14 15:31:46.362714,0 days 00:00:00.266004,goss,0.8180413318939413,0.2605812956932174,150,0.18305739748536126,0.7991705078929928,0.3535528596187175,0.3414869029275809,9a5ee522-15e8-4ae7-ac15-d4c1f358c6be,COMPLETE
32,32,0.3535528596187175,2021-10-14 15:31:46.364714,2021-10-14 15:31:46.625713,0 days 00:00:00.260999,goss,0.584843749991707,0.998764966743673,177,0.37168206459657965,0.4300891399426101,0.3535528596187175,0.3414869029275809,26492846-0f57-4c17-a89f-a3cc742faeed,COMPLETE
33,33,0.3535528596187175,2021-10-14 15:31:46.627712,2021-10-14 15:31:46.900720,0 days 00:00:00.273008,goss,0.4516037576968147,0.3140311395886509,80,0.10786849908995388,0.6993532041746793,0.3535528596187175,0.3414869029275809,6c017e66-7ae6-4945-9594-48129840c15c,COMPLETE
34,34,0.3535528596187175,2021-10-14 15:31:46.905723,2021-10-14 15:31:47.141722,0 days 00:00:00.235999,gbdt,0.5215927490099759,0.02390325319744811,90,,,0.3535528596187175,0.3414869029275809,17ebdf7a-9b8d-4dff-9fcb-4201c40afc8d,COMPLETE
35,35,0.3535528596187175,2021-10-14 15:31:47.143711,2021-10-14 15:31:47.442766,0 days 00:00:00.299055,gbdt,0.18781255246197226,0.00921114175853043,669,,,0.3535528596187175,0.3414869029275809,bd0e5674-766b-4f99-9d33-eb300216cb42,COMPLETE
36,36,0.3535528596187175,2021-10-14 15:31:47.444762,2021-10-14 15:31:47.758765,0 days 00:00:00.314003,goss,0.9836011985753124,0.0023925688952602755,772,0.5370185863591089,0.13451955826093875,0.3535528596187175,0.3414869029275809,d01bf6e5-cac9-4e3c-b4b1-c892ef5ebef9,COMPLETE
37,37,0.3535528596187175,2021-10-14 15:31:47.760765,2021-10-14 15:31:48.041302,0 days 00:00:00.280537,goss,0.9055857414544056,0.03104915406052459,399,0.28296096142742433,0.23831688455674735,0.3535528596187175,0.3414869029275809,9e0b16a0-2175-4ed8-9de3-def3be87cd81,COMPLETE
38,38,0.3535528596187175,2021-10-14 15:31:48.043302,2021-10-14 15:31:48.308311,0 days 00:00:00.265009,gbdt,0.7081644203576356,0.0003614134261022004,631,,,0.3535528596187175,0.3414869029275809,33c8da4c-df97-4e25-b1b9-c276036a11f3,COMPLETE
39,39,0.3535528596187175,2021-10-14 15:31:48.318300,2021-10-14 15:31:48.631304,0 days 00:00:00.313004,goss,0.999130412628322,0.00010880148010895174,921,0.4152372006085965,0.3158984655838564,0.3535528596187175,0.3414869029275809,3833e6dd-024a-4558-bdfd-0eafba3ada0f,COMPLETE
40,40,0.3535528596187175,2021-10-14 15:31:48.634304,2021-10-14 15:31:48.896301,0 days 00:00:00.261997,gbdt,0.790887996315355,0.05586891611629605,343,,,0.3535528596187175,0.3414869029275809,3db49790-9c4d-4b7c-953a-3954449380f1,COMPLETE
41,41,0.3535528596187175,2021-10-14 15:31:48.899300,2021-10-14 15:31:49.209420,0 days 00:00:00.310120,goss,0.9336601712408197,0.0002940872380574722,547,0.6432073321738101,0.10075195827642891,0.3535528596187175,0.3414869029275809,28c525e9-8a77-46f2-827e-f3c60b868207,COMPLETE
42,42,0.3535528596187175,2021-10-14 15:31:49.212419,2021-10-14 15:31:49.494049,0 days 00:00:00.281630,goss,0.7235247428320358,0.0002540761960194046,246,0.2520835070155838,0.584968884624765,0.3535528596187175,0.3414869029275809,7fdccef6-116c-4044-aa3c-12ac630153d3,COMPLETE
43,43,0.3535528596187175,2021-10-14 15:31:49.499050,2021-10-14 15:31:49.847590,0 days 00:00:00.348540,goss,0.6338494627395692,0.0011723843180083615,248,0.2895335494044111,0.5253302682188657,0.3535528596187175,0.3414869029275809,f80c9e0b-283f-4a3f-b304-f53653bce803,COMPLETE
44,44,0.3535528596187175,2021-10-14 15:31:49.849594,2021-10-14 15:31:50.321593,0 days 00:00:00.471999,goss,0.7572980388312158,0.052063837897647985,285,0.07898528458410745,0.8699123939995133,0.3535528596187175,0.3414869029275809,adb55981-11e8-44aa-bb4e-078af2b44e0f,COMPLETE
45,45,0.3535528596187175,2021-10-14 15:31:50.329591,2021-10-14 15:31:50.728592,0 days 00:00:00.399001,goss,0.808543130523818,0.07799107553008348,445,0.17190150961748868,0.7922644701247042,0.3535528596187175,0.3414869029275809,11e84779-1cc7-40cb-8914-2356df8b82b6,COMPLETE
46,46,0.3535528596187175,2021-10-14 15:31:50.731596,2021-10-14 15:31:51.239591,0 days 00:00:00.507995,goss,0.9424868773346564,0.5362898192254445,142,0.9748744209835856,0.01664926772698337,0.3535528596187175,0.3414869029275809,863d28c9-2169-4680-8070-13f5ef9636c2,COMPLETE
47,47,0.3535528596187175,2021-10-14 15:31:51.242592,2021-10-14 15:31:51.683689,0 days 00:00:00.441097,goss,0.8428798600116044,0.1986813488804007,761,0.7642888344283579,0.11058671698164607,0.3535528596187175,0.3414869029275809,745dbb74-a802-4686-bf02-1f89eddc2ea0,COMPLETE
48,48,0.3535528596187175,2021-10-14 15:31:51.685689,2021-10-14 15:31:52.048421,0 days 00:00:00.362732,gbdt,0.6206491778898606,0.534965939915002,216,,,0.3535528596187175,0.3414869029275809,cf34c4b2-6bcd-4578-8728-826abd7e98a1,COMPLETE
49,49,0.3535528596187175,2021-10-14 15:31:52.056422,2021-10-14 15:31:52.689051,0 days 00:00:00.632629,goss,0.5686990154988336,0.3697029641406889,200,0.37924577602583054,0.474252307556242,0.3535528596187175,0.3414869029275809,e0b241ac-db50-473c-b622-918a47ff4823,COMPLETE
50,50,0.3535528596187175,2021-10-14 15:31:52.691049,2021-10-14 15:31:53.136051,0 days 00:00:00.445002,goss,0.4695610487602801,0.014771778376128773,12,0.11864236282690316,0.6420179210457033,0.3535528596187175,0.3414869029275809,c4437c91-340a-4b96-90ad-4967527b54ae,COMPLETE
51,51,0.3535528596187175,2021-10-14 15:31:53.139046,2021-10-14 15:31:53.477690,0 days 00:00:00.338644,goss,0.8153209128824465,0.19205839368380812,119,0.13713057505160656,0.7655069281746856,0.3535528596187175,0.3414869029275809,35a9dcae-0d89-403a-bfd1-110ad224fbff,COMPLETE
52,52,0.3535528596187175,2021-10-14 15:31:53.479689,2021-10-14 15:31:53.838698,0 days 00:00:00.359009,goss,0.3695139655609097,0.8951126085038812,154,0.35933602688306665,0.37773421656361256,0.3535528596187175,0.3414869029275809,968351a6-b585-4c70-bbc7-b3d5dd2c7ab9,COMPLETE
53,53,0.3535528596187175,2021-10-14 15:31:53.840690,2021-10-14 15:31:54.196794,0 days 00:00:00.356104,goss,0.5448959162512148,0.23964401582820208,178,0.19164864720427108,0.4122844143345002,0.3535528596187175,0.3414869029275809,9e7ca71b-b996-4ba5-b425-1b1d23f1ee6d,COMPLETE
54,54,0.3535528596187175,2021-10-14 15:31:54.198787,2021-10-14 15:31:54.485327,0 days 00:00:00.286540,goss,0.43752594910098047,0.3537907809622602,66,0.14090861545585845,0.7526098899973362,0.3535528596187175,0.3414869029275809,28ced81e-717b-4b56-89b6-1cbe9b3dffe6,COMPLETE
55,55,0.3535528596187175,2021-10-14 15:31:54.487336,2021-10-14 15:31:54.832331,0 days 00:00:00.344995,goss,0.4741707706847175,0.6756765805639698,89,0.33587437525523817,0.6590743497337916,0.3535528596187175,0.3414869029275809,b6daa500-8794-4f8e-a3e1-20fffa23b707,COMPLETE
56,56,0.3535528596187175,2021-10-14 15:31:54.837331,2021-10-14 15:31:55.106331,0 days 00:00:00.269000,gbdt,0.37378699009850336,0.020590268001439226,90,,,0.3535528596187175,0.3414869029275809,52b43a0a-35bc-4766-aa86-def25a9e37fd,COMPLETE
57,57,0.3535528596187175,2021-10-14 15:31:55.109328,2021-10-14 15:31:55.345327,0 days 00:00:00.235999,gbdt,0.5154537165986744,0.030593416914234027,47,,,0.3535528596187175,0.3414869029275809,fabee1cf-dbd3-4736-a289-7a5aa3206a27,COMPLETE
58,58,0.3535528596187175,2021-10-14 15:31:55.347328,2021-10-14 15:31:55.653875,0 days 00:00:00.306547,gbdt,0.1361921075633921,0.0071805390288000115,616,,,0.3535528596187175,0.3414869029275809,5cb34c8b-d2da-48dc-a062-a3ebb5a8a357,COMPLETE
59,59,0.3535528596187175,2021-10-14 15:31:55.656875,2021-10-14 15:31:56.019515,0 days 00:00:00.362640,gbdt,0.025858080073732553,0.002981263582207278,651,,,0.3535528596187175,0.3414869029275809,c0b9bcbc-4a75-4f31-94d7-796808d029a8,COMPLETE
60,60,0.3535528596187175,2021-10-14 15:31:56.023519,2021-10-14 15:31:56.349510,0 days 00:00:00.325991,gbdt,0.20865114016725414,0.011605845976060084,763,,,0.3535528596187175,0.3414869029275809,66e12d99-ca48-45e6-9915-d7a75e8e51d5,COMPLETE
61,61,0.3535528596187175,2021-10-14 15:31:56.351508,2021-10-14 15:31:56.738510,0 days 00:00:00.387002,gbdt,0.9602724116047235,0.028744959527756048,811,,,0.3535528596187175,0.3414869029275809,8f09b3d8-596d-4502-997c-0f1f8f3ec430,COMPLETE
62,62,0.3535528596187175,2021-10-14 15:31:56.741509,2021-10-14 15:31:57.051040,0 days 00:00:00.309531,gbdt,0.8846753990856498,0.003759782599804292,717,,,0.3535528596187175,0.3414869029275809,c651a3e7-716c-455a-983d-0060ff94f338,COMPLETE
63,63,0.3535528596187175,2021-10-14 15:31:57.053041,2021-10-14 15:31:57.508043,0 days 00:00:00.455002,gbdt,0.2061496390162401,0.000484160208882547,650,,,0.3535528596187175,0.3414869029275809,616d9aa2-d41b-4a95-ade7-35ce7264d836,COMPLETE
64,64,0.3535528596187175,2021-10-14 15:31:57.511045,2021-10-14 15:31:57.896574,0 days 00:00:00.385529,gbdt,0.996405088849815,0.0016747343800906868,941,,,0.3535528596187175,0.3414869029275809,e71e3b07-9821-42b1-8e8f-e8d4abc6fe70,COMPLETE
65,65,0.3535528596187175,2021-10-14 15:31:57.898572,2021-10-14 15:31:58.257576,0 days 00:00:00.359004,gbdt,0.9970963131450576,0.00019351106702528704,891,,,0.3535528596187175,0.3414869029275809,f22efcda-c0a8-4584-96f8-993831662c83,COMPLETE
66,66,0.3535528596187175,2021-10-14 15:31:58.260574,2021-10-14 15:31:58.662577,0 days 00:00:00.402003,gbdt,0.9654307124599755,0.00016571224735148572,947,,,0.3535528596187175,0.3414869029275809,29f27e96-941f-4733-aa8c-08ecef2dd7ca,COMPLETE
67,67,0.3535528596187175,2021-10-14 15:31:58.665580,2021-10-14 15:31:58.985202,0 days 00:00:00.319622,gbdt,0.8946408838456896,0.04093721398635305,412,,,0.3535528596187175,0.3414869029275809,11ccfc37-291d-400a-b4d2-db0c87a6be0c,COMPLETE
68,68,0.3535528596187175,2021-10-14 15:31:58.987207,2021-10-14 15:31:59.332744,0 days 00:00:00.345537,goss,0.9048491962505415,0.0004871338146899337,605,0.4281157612900724,0.2666751434196722,0.3535528596187175,0.3414869029275809,409b774a-f6a4-4cae-87ca-7d14ca9ec493,COMPLETE
69,69,0.3535528596187175,2021-10-14 15:31:59.334745,2021-10-14 15:31:59.636746,0 days 00:00:00.302001,goss,0.7855748545359302,0.00032840685085649447,527,0.543604111449355,0.2169773657263608,0.3535528596187175,0.3414869029275809,0b043179-f284-40a5-9798-0e1d9ff7d070,COMPLETE
70,70,0.3535528596187175,2021-10-14 15:31:59.639749,2021-10-14 15:32:00.107752,0 days 00:00:00.468003,goss,0.663355293357051,0.00026833370431595896,323,0.2629969205729702,0.30910569089896683,0.3535528596187175,0.3414869029275809,cae29de8-e602-41ad-bfc9-9dfe58166af2,COMPLETE
71,71,0.3535528596187175,2021-10-14 15:32:00.112752,2021-10-14 15:32:00.471836,0 days 00:00:00.359084,goss,0.8300923938850433,0.4505720866462015,15,0.7495254267001643,0.05889882090692256,0.3535528596187175,0.3414869029275809,9a0978d8-eb5f-497a-a28a-8427b8f6d522,COMPLETE
72,72,0.3535528596187175,2021-10-14 15:32:00.474836,2021-10-14 15:32:00.856369,0 days 00:00:00.381533,goss,0.34599259402423965,0.1706627323921561,143,0.1778382638854541,0.6489403994526945,0.3535528596187175,0.3414869029275809,4a563d72-a756-410c-8090-23c212c28815,COMPLETE
73,73,0.3535528596187175,2021-10-14 15:32:00.858368,2021-10-14 15:32:01.119919,0 days 00:00:00.261551,goss,0.40063421228460505,0.4688804844444039,216,0.37823537623869863,0.38606469835483626,0.3535528596187175,0.3414869029275809,e7de87c9-cddb-486f-bf9f-7bc1fa58f5d0,COMPLETE
74,74,0.3535528596187175,2021-10-14 15:32:01.121921,2021-10-14 15:32:01.383214,0 days 00:00:00.261293,goss,0.5476758101187484,0.18517160014052708,210,0.1086544605497658,0.3788244113093797,0.3535528596187175,0.3414869029275809,dd8a1b05-a167-4710-86ad-b9638d0eece3,COMPLETE
75,75,0.3535528596187175,2021-10-14 15:32:01.385213,2021-10-14 15:32:01.662219,0 days 00:00:00.277006,goss,0.5433488459128948,0.21525904672804216,203,0.3690958178270909,0.4185907782963064,0.3535528596187175,0.3414869029275809,b42bd248-8fe5-408c-a3c8-d9ebfce34b33,COMPLETE
76,76,0.3535528596187175,2021-10-14 15:32:01.664217,2021-10-14 15:32:02.033283,0 days 00:00:00.369066,goss,0.4197115907090375,0.1245081686418179,123,0.14281503867068054,0.7439827399547809,0.3535528596187175,0.3414869029275809,db70d67a-c539-4235-ad65-38b7edf31c82,COMPLETE
77,77,0.3535528596187175,2021-10-14 15:32:02.036283,2021-10-14 15:32:02.313285,0 days 00:00:00.277002,goss,0.31005669997364255,0.38186846955962656,114,0.11886554235655111,0.34677464331180635,0.3535528596187175,0.3414869029275809,9108c500-5b52-40e4-9d6a-c089210e90b2,COMPLETE
78,78,0.3535528596187175,2021-10-14 15:32:02.315288,2021-10-14 15:32:02.588286,0 days 00:00:00.272998,goss,0.46628761191966184,0.665757817338052,54,0.3061047391375724,0.6696439572955465,0.3535528596187175,0.3414869029275809,ed895ac5-1496-494d-a097-612ed0ca7dd3,COMPLETE
79,79,0.3535528596187175,2021-10-14 15:32:02.591280,2021-10-14 15:32:02.849279,0 days 00:00:00.257999,goss,0.3739966364754996,0.7196144956365689,95,0.16632375467846972,0.6121860705351262,0.3535528596187175,0.3414869029275809,25e1209f-aaea-48d3-b9b4-68cb8e187d19,COMPLETE
80,80,0.3535528596187175,2021-10-14 15:32:02.852282,2021-10-14 15:32:03.087286,0 days 00:00:00.235004,gbdt,0.49033842192811644,0.09397970790358744,45,,,0.3535528596187175,0.3414869029275809,8271c235-8669-4211-b3b9-29a5f1e8b984,COMPLETE
81,81,0.3535528596187175,2021-10-14 15:32:03.089283,2021-10-14 15:32:03.316282,0 days 00:00:00.226999,gbdt,0.4334559717421914,0.006407763132280159,68,,,0.3535528596187175,0.3414869029275809,9d2376f0-25a5-48a1-90b1-5e0a847278cd,COMPLETE
