,number,value,datetime_start,datetime_complete,duration,params_boosting,params_feature_fraction,params_learning_rate,params_num_leaves,params_other_rate,params_top_rate,user_attrs_test_error,user_attrs_train_error,user_attrs_uuid,state
418,418,0.3535528596187175,2021-10-14 15:33:54.941683,2021-10-14 15:33:55.237217,0 days 00:00:00.295534,gbdt,0.9407199828832493,0.00017122941121520608,584,,,0.3535528596187175,0.3414869029275809,3f5b3f53-4556-43aa-a945-e61b8c6cb8e9,COMPLETE
419,419,0.3535528596187175,2021-10-14 15:33:55.239217,2021-10-14 15:33:55.569315,0 days 00:00:00.330098,gbdt,0.9044267239408283,0.00011754035328577672,555,,,0.3535528596187175,0.3414869029275809,a632eebd-7a9c-41f2-b53a-2bc132302e99,COMPLETE
420,420,0.3535528596187175,2021-10-14 15:33:55.573315,2021-10-14 15:33:55.878314,0 days 00:00:00.304999,gbdt,0.2484210330913009,0.00010391287406643242,536,,,0.3535528596187175,0.3414869029275809,b49060a6-b49c-494f-a12d-583ff24609dd,COMPLETE
421,421,0.3535528596187175,2021-10-14 15:33:55.881311,2021-10-14 15:33:56.244316,0 days 00:00:00.363005,gbdt,0.9563263780788057,0.00015639419223085403,953,,,0.3535528596187175,0.3414869029275809,23c91b0f-484e-4c09-bbbb-2a1c4ad6d503,COMPLETE
422,422,0.3535528596187175,2021-10-14 15:33:56.248312,2021-10-14 15:33:56.584514,0 days 00:00:00.336202,gbdt,0.8786515699093584,0.00012349510455460482,526,,,0.3535528596187175,0.3414869029275809,65740f83-ad62-440f-94e7-e4cb63c5cb53,COMPLETE
423,423,0.3535528596187175,2021-10-14 15:33:56.587524,2021-10-14 15:33:56.943053,0 days 00:00:00.355529,gbdt,0.8869062191706407,0.00013734852175974253,983,,,0.3535528596187175,0.3414869029275809,0e2baa12-025a-4cf6-bc3a-ffa2483fa6af,COMPLETE
424,424,0.3535528596187175,2021-10-14 15:33:56.946053,2021-10-14 15:33:57.256584,0 days 00:00:00.310531,gbdt,0.27503670535267566,0.0005221252963338221,508,,,0.3535528596187175,0.3414869029275809,1a6ee22d-0799-4166-8495-947c2d8f33e0,COMPLETE
425,425,0.3535528596187175,2021-10-14 15:33:57.259587,2021-10-14 15:33:57.651588,0 days 00:00:00.392001,gbdt,0.9252675848346621,0.0005881901273473741,995,,,0.3535528596187175,0.3414869029275809,7c1de4e1-6bab-4039-8c15-09058f2a6f10,COMPLETE
426,426,0.3535528596187175,2021-10-14 15:33:57.653586,2021-10-14 15:33:58.000586,0 days 00:00:00.347000,gbdt,0.9015131828180538,0.00025109827939370614,524,,,0.3535528596187175,0.3414869029275809,aacdfacf-04bf-4efe-ae12-e4f6bb75645f,COMPLETE
427,427,0.3535528596187175,2021-10-14 15:33:58.003592,2021-10-14 15:33:58.399587,0 days 00:00:00.395995,gbdt,0.8694411157513191,0.0005112895120117181,963,,,0.3535528596187175,0.3414869029275809,4e3a52d4-d48b-41d5-9f4d-990e3f6c2112,COMPLETE
428,428,0.3535528596187175,2021-10-14 15:33:58.402593,2021-10-14 15:33:58.762613,0 days 00:00:00.360020,gbdt,0.8980777599389858,0.0005594150014816763,501,,,0.3535528596187175,0.3414869029275809,fc7026b8-42b2-4da3-addb-d951c88f54c6,COMPLETE
429,429,0.3535528596187175,2021-10-14 15:33:58.765585,2021-10-14 15:33:59.144586,0 days 00:00:00.379001,gbdt,0.8584767648518264,0.0006190291958077214,540,,,0.3535528596187175,0.3414869029275809,cf65f181-cc75-40a2-ac86-b5087c0c12f3,COMPLETE
430,430,0.3535528596187175,2021-10-14 15:33:59.151583,2021-10-14 15:33:59.488586,0 days 00:00:00.337003,gbdt,0.8707238502498482,0.00018342966605369376,337,,,0.3535528596187175,0.3414869029275809,fa259f54-c498-40d2-ac1a-f07dc919bf51,COMPLETE
431,431,0.3535528596187175,2021-10-14 15:33:59.491584,2021-10-14 15:33:59.945586,0 days 00:00:00.454002,gbdt,0.8299272252689124,0.0004584988209617,961,,,0.3535528596187175,0.3414869029275809,ecdc4837-f565-4b0a-9ef6-805103541cd6,COMPLETE
432,432,0.3535528596187175,2021-10-14 15:33:59.949584,2021-10-14 15:34:00.491587,0 days 00:00:00.542003,gbdt,0.9923896328166737,0.00047765366797603503,969,,,0.3535528596187175,0.3414869029275809,f9ea4938-6537-40be-a224-b720998bd0fd,COMPLETE
433,433,0.3535528596187175,2021-10-14 15:34:00.494583,2021-10-14 15:34:00.946588,0 days 00:00:00.452005,gbdt,0.9984464106425288,0.0005692941212941103,985,,,0.3535528596187175,0.3414869029275809,7041294b-1c63-4b9c-898e-7f7e01d4e992,COMPLETE
434,434,0.3535528596187175,2021-10-14 15:34:00.948584,2021-10-14 15:34:01.291217,0 days 00:00:00.342633,gbdt,0.8280427450945602,0.00014778913092975432,457,,,0.3535528596187175,0.3414869029275809,d3963717-d1ba-48a2-a729-68dcdf224a63,COMPLETE
435,435,0.3535528596187175,2021-10-14 15:34:01.295216,2021-10-14 15:34:01.634752,0 days 00:00:00.339536,gbdt,0.8488958905982028,0.00010963168817632537,473,,,0.3535528596187175,0.3414869029275809,249891b1-c787-485f-8eb7-fe8e799ed99a,COMPLETE
436,436,0.3535528596187175,2021-10-14 15:34:01.637755,2021-10-14 15:34:01.953753,0 days 00:00:00.315998,gbdt,0.8816841104753814,0.00012929638338939116,440,,,0.3535528596187175,0.3414869029275809,c709878a-08a5-4125-8bad-1aba3235a130,COMPLETE
437,437,0.3535528596187175,2021-10-14 15:34:01.956754,2021-10-14 15:34:02.305757,0 days 00:00:00.349003,gbdt,0.854217424422873,0.00010081595470982512,998,,,0.3535528596187175,0.3414869029275809,90cc7c13-834a-42d6-afe2-07f979f688ca,COMPLETE
438,438,0.3535528596187175,2021-10-14 15:34:02.308761,2021-10-14 15:34:02.638757,0 days 00:00:00.329996,gbdt,0.7809105568551006,0.0004020663999621217,419,,,0.3535528596187175,0.3414869029275809,12d5f6ec-03ac-4e82-a4ab-e088fe8856fd,COMPLETE
439,439,0.3535528596187175,2021-10-14 15:34:02.642759,2021-10-14 15:34:03.003306,0 days 00:00:00.360547,gbdt,0.8092203645640501,0.00036196414403046837,405,,,0.3535528596187175,0.3414869029275809,fa690409-0560-42a7-b5b4-ad94b85703ee,COMPLETE
440,440,0.3535528596187175,2021-10-14 15:34:03.006305,2021-10-14 15:34:03.334305,0 days 00:00:00.328000,gbdt,0.8118338008853008,0.0003058456746913064,448,,,0.3535528596187175,0.3414869029275809,37b20ef6-d01b-4a81-ba07-145504b5d902,COMPLETE
441,441,0.3535528596187175,2021-10-14 15:34:03.337311,2021-10-14 15:34:03.697876,0 days 00:00:00.360565,gbdt,0.8375307862169664,0.00025090481893602867,480,,,0.3535528596187175,0.3414869029275809,bdba2c44-595e-4999-a373-5945fcb20827,COMPLETE
442,442,0.3535528596187175,2021-10-14 15:34:03.700879,2021-10-14 15:34:04.011423,0 days 00:00:00.310544,gbdt,0.8269767626079001,0.00044620334049293175,438,,,0.3535528596187175,0.3414869029275809,906b488b-9550-48ef-bcc4-bb8d175ede40,COMPLETE
443,443,0.3535528596187175,2021-10-14 15:34:04.016428,2021-10-14 15:34:04.326421,0 days 00:00:00.309993,gbdt,0.8039587174411612,0.0002111567838433481,481,,,0.3535528596187175,0.3414869029275809,52cd77ab-53ea-4b4c-a64a-50ade6c419eb,COMPLETE
444,444,0.3535528596187175,2021-10-14 15:34:04.330427,2021-10-14 15:34:04.623425,0 days 00:00:00.292998,gbdt,0.7913043465066532,0.0003122119741518584,460,,,0.3535528596187175,0.3414869029275809,ea5419e7-0b4e-46ae-ac0a-0e15f1c3b8d0,COMPLETE
445,445,0.3535528596187175,2021-10-14 15:34:04.626424,2021-10-14 15:34:04.928547,0 days 00:00:00.302123,gbdt,0.8461567536273615,0.00016469211389767165,491,,,0.3535528596187175,0.3414869029275809,3a5c87d2-53fd-4321-95a9-70f59e48fdb0,COMPLETE
446,446,0.3535528596187175,2021-10-14 15:34:04.931549,2021-10-14 15:34:05.250553,0 days 00:00:00.319004,gbdt,0.7651699194380326,0.0001924558030521537,486,,,0.3535528596187175,0.3414869029275809,4c3e5c04-6817-4386-acd5-d74bc56433ea,COMPLETE
447,447,0.3535528596187175,2021-10-14 15:34:05.257561,2021-10-14 15:34:05.576547,0 days 00:00:00.318986,gbdt,0.8209201066312863,0.00023058453824964466,513,,,0.3535528596187175,0.3414869029275809,557a461b-0311-4bcb-99ed-3a8a900ccc46,COMPLETE
448,448,0.3535528596187175,2021-10-14 15:34:05.579549,2021-10-14 15:34:05.899552,0 days 00:00:00.320003,gbdt,0.7874090398276008,0.00026135141102540316,439,,,0.3535528596187175,0.3414869029275809,43d63970-1db6-41bc-869d-55f571bdc57e,COMPLETE
449,449,0.3535528596187175,2021-10-14 15:34:05.902547,2021-10-14 15:34:06.209549,0 days 00:00:00.307002,gbdt,0.7925674816367829,0.00028081615251753054,470,,,0.3535528596187175,0.3414869029275809,a1a9c87e-efb4-4212-9838-476e34875886,COMPLETE
450,450,0.3535528596187175,2021-10-14 15:34:06.211547,2021-10-14 15:34:06.548550,0 days 00:00:00.337003,gbdt,0.8036287613595949,0.00037025124461981013,509,,,0.3535528596187175,0.3414869029275809,8ba62acd-4e33-4b16-aeed-960b9b4e54ac,COMPLETE
451,451,0.3535528596187175,2021-10-14 15:34:06.550546,2021-10-14 15:34:06.850548,0 days 00:00:00.300002,gbdt,0.836948140794646,0.0003532083951695276,463,,,0.3535528596187175,0.3414869029275809,db7cc889-5e8e-47f4-a1bc-2073ec3ea2ca,COMPLETE
452,452,0.3535528596187175,2021-10-14 15:34:06.854547,2021-10-14 15:34:07.166554,0 days 00:00:00.312007,gbdt,0.7451440449249304,0.00033349104812456704,411,,,0.3535528596187175,0.3414869029275809,2f2e05e3-67ad-45ee-b577-cd5e023f1422,COMPLETE
453,453,0.3535528596187175,2021-10-14 15:34:07.169546,2021-10-14 15:34:07.484548,0 days 00:00:00.315002,gbdt,0.8576816768929013,0.0004520120413910424,427,,,0.3535528596187175,0.3414869029275809,515bf0bf-bf4b-41e8-a34f-dcbd0df4ba4a,COMPLETE
454,454,0.3535528596187175,2021-10-14 15:34:07.487545,2021-10-14 15:34:07.796107,0 days 00:00:00.308562,gbdt,0.6537780179037963,0.31545360378953746,415,,,0.3535528596187175,0.3414869029275809,83fce6ce-b76a-44f9-93e2-ca9ae0e4a200,COMPLETE
455,455,0.3535528596187175,2021-10-14 15:34:07.799112,2021-10-14 15:34:08.129643,0 days 00:00:00.330531,gbdt,0.7330403471620355,0.00043612489079590853,350,,,0.3535528596187175,0.3414869029275809,02686508-19d7-4224-895d-f87d576311d9,COMPLETE
456,456,0.3535528596187175,2021-10-14 15:34:08.132645,2021-10-14 15:34:08.616641,0 days 00:00:00.483996,goss,0.6922012683335771,0.37150685287893465,320,0.6121901583910192,0.055448402126248825,0.3535528596187175,0.3414869029275809,1b01a9b0-b473-4873-bed3-1843f8fa23d7,COMPLETE
457,457,0.3535528596187175,2021-10-14 15:34:08.618641,2021-10-14 15:34:09.170641,0 days 00:00:00.552000,goss,0.717145441349751,0.0003459258702942075,366,0.7142127352587748,0.11563482915977179,0.3535528596187175,0.3414869029275809,afbce7bc-51d1-4c94-bc85-54d5089fc94e,COMPLETE
458,458,0.3535528596187175,2021-10-14 15:34:09.174642,2021-10-14 15:34:09.511640,0 days 00:00:00.336998,goss,0.6374264785535243,0.00029375531763909193,318,0.5875419864625558,0.0844820632828318,0.3535528596187175,0.3414869029275809,4462d26a-d081-4369-86da-0debc1fb11d3,COMPLETE
459,459,0.3535528596187175,2021-10-14 15:34:09.513639,2021-10-14 15:34:09.834250,0 days 00:00:00.320611,goss,0.6600547447262985,0.0003708924642622779,341,0.6340397340586856,0.13414583522403636,0.3535528596187175,0.3414869029275809,12a11b13-7a4c-4028-8f91-4de357d17564,COMPLETE
460,460,0.3535528596187175,2021-10-14 15:34:09.836252,2021-10-14 15:34:10.204255,0 days 00:00:00.368003,goss,0.7462778453784499,0.00029296151024128054,366,0.6824757676182107,0.14720685884040452,0.3535528596187175,0.3414869029275809,d74ecb08-1544-4fc6-a461-749b9134e571,COMPLETE
461,461,0.3535528596187175,2021-10-14 15:34:10.207254,2021-10-14 15:34:10.614253,0 days 00:00:00.406999,goss,0.7120593485361784,0.0003441521480574776,384,0.5494171442336594,0.12249668388433423,0.3535528596187175,0.3414869029275809,0d6bd542-da92-4531-ab52-e272ac7e2d42,COMPLETE
462,462,0.3535528596187175,2021-10-14 15:34:10.621259,2021-10-14 15:34:10.991254,0 days 00:00:00.369995,goss,0.6762436192324863,0.19779299384963003,350,0.5736533599820541,0.0450684805955892,0.3535528596187175,0.3414869029275809,30ca5dcd-a702-4d88-acb6-33f0a962f3e9,COMPLETE
463,463,0.3535528596187175,2021-10-14 15:34:10.994252,2021-10-14 15:34:11.354753,0 days 00:00:00.360501,goss,0.7228884948177672,0.0002049852347202018,396,0.5471669407444821,0.08183958522691154,0.3535528596187175,0.3414869029275809,7f35b398-5802-4c0c-b87c-97b9c3f04e49,COMPLETE
464,464,0.3535528596187175,2021-10-14 15:34:11.357750,2021-10-14 15:34:11.730820,0 days 00:00:00.373070,goss,0.7573428444514093,0.3764285631609567,373,0.6095723371934354,0.19540395406804023,0.3535528596187175,0.3414869029275809,8e5a5cef-63f1-4492-829b-460676b3ba0e,COMPLETE
465,465,0.3535528596187175,2021-10-14 15:34:11.732817,2021-10-14 15:34:12.081823,0 days 00:00:00.349006,goss,0.7653479470694264,0.00021596465708587998,411,0.5906781737144833,0.15642413192022223,0.3535528596187175,0.3414869029275809,9ec39ed7-e739-455a-8268-8a6f3811aef0,COMPLETE
466,466,0.3535528596187175,2021-10-14 15:34:12.085821,2021-10-14 15:34:12.437358,0 days 00:00:00.351537,goss,0.7062391511911136,0.29652734589461976,401,0.5146594406313751,0.20565026035459638,0.3535528596187175,0.3414869029275809,f9a06a23-a504-4d38-8aaa-cb022e790c21,COMPLETE
467,467,0.3535528596187175,2021-10-14 15:34:12.440353,2021-10-14 15:34:12.837303,0 days 00:00:00.396950,goss,0.7346119672511252,0.07838331535816483,438,0.5327688460745524,0.17949441028218815,0.3535528596187175,0.3414869029275809,fb2fdddf-8b99-4431-8700-f75ac999ca5e,COMPLETE
468,468,0.3535528596187175,2021-10-14 15:34:12.842302,2021-10-14 15:34:13.203302,0 days 00:00:00.361000,goss,0.6992520327337197,0.07492978037312498,377,0.5607839730172873,0.09809457664557161,0.3535528596187175,0.3414869029275809,487b68b2-0af5-459b-8a05-6b8d5fe5dbbf,COMPLETE
469,469,0.3535528596187175,2021-10-14 15:34:13.206302,2021-10-14 15:34:13.589931,0 days 00:00:00.383629,goss,0.7209173305452606,0.06314189521121076,396,0.5002372931562271,0.15580849615897205,0.3535528596187175,0.3414869029275809,adb51cb6-ff68-4ef8-8329-f409f5cf865a,COMPLETE
470,470,0.3535528596187175,2021-10-14 15:34:13.592931,2021-10-14 15:34:13.914474,0 days 00:00:00.321543,goss,0.6753148714733851,0.1842246205367515,393,0.4860341476424688,0.227605715036745,0.3535528596187175,0.3414869029275809,7fc1b07b-7326-4706-bd71-645b2d45e515,COMPLETE
471,471,0.3535528596187175,2021-10-14 15:34:13.916472,2021-10-14 15:34:14.300488,0 days 00:00:00.384016,goss,0.7528430547383256,0.11042198191053053,358,0.4550130464363562,0.24290865724814362,0.3535528596187175,0.3414869029275809,5e52480d-0874-43b3-b2de-41ef02515d87,COMPLETE
472,472,0.3535528596187175,2021-10-14 15:34:14.303483,2021-10-14 15:34:14.664477,0 days 00:00:00.360994,goss,0.29272067127354906,0.00025615552914302675,303,0.4588611830285184,0.20651296558081006,0.3535528596187175,0.3414869029275809,a54a3626-9ec0-4a02-bd19-31210202e002,COMPLETE
473,473,0.3535528596187175,2021-10-14 15:34:14.667476,2021-10-14 15:34:15.028476,0 days 00:00:00.361000,goss,0.7361477758802858,0.08514027136746481,332,0.49665616697938336,0.16440081671256032,0.3535528596187175,0.3414869029275809,dd5f25d3-a868-4fdf-83c0-f527e9d7a8b0,COMPLETE
474,474,0.3535528596187175,2021-10-14 15:34:15.031479,2021-10-14 15:34:15.425373,0 days 00:00:00.393894,goss,0.698024996775673,0.0002052456964310058,422,0.5980690598493712,0.17383742089559048,0.3535528596187175,0.3414869029275809,4f46d8d4-b41e-43a5-ae41-1597f0f9cdd5,COMPLETE
475,475,0.3535528596187175,2021-10-14 15:34:15.427369,2021-10-14 15:34:15.840448,0 days 00:00:00.413079,goss,0.3170599745544589,0.10189779087620994,296,0.5507996036422391,0.13115511725703954,0.3535528596187175,0.3414869029275809,86ab158e-1493-4500-b240-1e5928fa0250,COMPLETE
476,476,0.3535528596187175,2021-10-14 15:34:15.843448,2021-10-14 15:34:16.285447,0 days 00:00:00.441999,goss,0.6239378076998435,0.14857405117597408,389,0.5314964423343203,0.2503804908002407,0.3535528596187175,0.3414869029275809,43a14987-26ef-4b26-83a2-2f4798273fe0,COMPLETE
477,477,0.3535528596187175,2021-10-14 15:34:16.288446,2021-10-14 15:34:16.729451,0 days 00:00:00.441005,goss,0.3042995495538522,0.23741424586982754,361,0.6249583238374709,0.1869660452127498,0.3535528596187175,0.3414869029275809,156cb445-f053-4677-8111-1a9ce2e7b4b6,COMPLETE
478,478,0.3535528596187175,2021-10-14 15:34:16.732448,2021-10-14 15:34:17.098145,0 days 00:00:00.365697,goss,0.37210921961975224,0.17297695385596795,322,0.5177985302776286,0.26519496583236213,0.3535528596187175,0.3414869029275809,19fadf87-0182-4885-8a95-cf186d809c43,COMPLETE
479,479,0.3535528596187175,2021-10-14 15:34:17.100136,2021-10-14 15:34:17.498223,0 days 00:00:00.398087,goss,0.3533680250021976,0.1700587162767337,297,0.4940219957169476,0.2764410787936452,0.3535528596187175,0.3414869029275809,992d19d6-82b5-4a09-bc8e-546dd7ee0146,COMPLETE
480,480,0.3535528596187175,2021-10-14 15:34:17.502229,2021-10-14 15:34:17.882219,0 days 00:00:00.379990,goss,0.335825183677087,0.13253794821319595,307,0.41533655732770575,0.221029725883713,0.3535528596187175,0.3414869029275809,70455b05-3315-41ee-9df8-16b6697268d8,COMPLETE
481,481,0.3535528596187175,2021-10-14 15:34:17.884217,2021-10-14 15:34:18.248219,0 days 00:00:00.364002,goss,0.6636669858745801,0.21719461277864285,334,0.4297832194941551,0.2346750601482671,0.3535528596187175,0.3414869029275809,85d69342-78fc-4f4a-a943-faac7c4f76ea,COMPLETE
482,482,0.3535528596187175,2021-10-14 15:34:18.250221,2021-10-14 15:34:18.640418,0 days 00:00:00.390197,goss,0.6454270021657138,0.031428839833169096,291,0.4509316625525632,0.25971971395417814,0.3535528596187175,0.3414869029275809,52cbd57f-c52f-4d2b-965f-105d6cebf498,COMPLETE
483,483,0.3535528596187175,2021-10-14 15:34:18.646422,2021-10-14 15:34:19.084329,0 days 00:00:00.437907,goss,0.38759898000097426,0.2521244703926793,274,0.04098683545896864,0.958471318353891,0.3535528596187175,0.3414869029275809,d23d9e84-ba97-4ea0-aefc-d0222d8343ca,COMPLETE
484,484,0.3535528596187175,2021-10-14 15:34:19.088332,2021-10-14 15:34:19.459898,0 days 00:00:00.371566,goss,0.36684204473555215,0.03960980688255406,303,0.46738340750339286,0.30262121615989057,0.3535528596187175,0.3414869029275809,3ef0bb32-afd7-4f13-a485-1dfb144f35ef,COMPLETE
485,485,0.3535528596187175,2021-10-14 15:34:19.462901,2021-10-14 15:34:19.876438,0 days 00:00:00.413537,goss,0.392514135409549,0.055311988782632604,353,0.4869822027455231,0.2902443255355124,0.3535528596187175,0.3414869029275809,2357f235-bb4c-4bd0-8dab-e286f687da76,COMPLETE
486,486,0.3535528596187175,2021-10-14 15:34:19.879438,2021-10-14 15:34:20.467334,0 days 00:00:00.587896,goss,0.6141238236702669,0.2925945783640485,257,0.32892161747995924,0.2145799103098924,0.3535528596187175,0.3414869029275809,4ce81358-4d29-409a-93a7-c1a03be70e3d,COMPLETE
487,487,0.3535528596187175,2021-10-14 15:34:20.470334,2021-10-14 15:34:20.894420,0 days 00:00:00.424086,goss,0.684663387072319,0.04793462209795461,248,0.33788166236916856,0.42374968023648224,0.3535528596187175,0.3414869029275809,c26e4f38-fcfe-4df8-b161-29ddb36c75a5,COMPLETE
488,488,0.3535528596187175,2021-10-14 15:34:20.897420,2021-10-14 15:34:21.328419,0 days 00:00:00.430999,goss,0.4080012045749636,0.12183357710575715,206,0.13139761444874237,0.8686009727325645,0.3535528596187175,0.3414869029275809,2c0dd510-7386-4eb3-baad-2a4a0ba32120,COMPLETE
489,489,0.3535528596187175,2021-10-14 15:34:21.331420,2021-10-14 15:34:21.797416,0 days 00:00:00.465996,goss,0.3343529402935267,0.13429324995026573,261,0.4749455337706793,0.2761385355892563,0.3535528596187175,0.3414869029275809,289ecc52-37ce-4c3b-9ddd-ed96caffc7f3,COMPLETE
490,490,0.3535528596187175,2021-10-14 15:34:21.801421,2021-10-14 15:34:22.194420,0 days 00:00:00.392999,goss,0.5883650488726374,0.05056492482770463,277,0.0899420490277485,0.8973913377182999,0.3535528596187175,0.3414869029275809,f535b6de-25d2-4d83-b8a2-58153c0717ac,COMPLETE
491,491,0.3535528596187175,2021-10-14 15:34:22.200417,2021-10-14 15:34:22.536272,0 days 00:00:00.335855,goss,0.4556950403917477,0.11389895105821712,224,0.29778355533401696,0.2526807600323372,0.3535528596187175,0.3414869029275809,a2293396-5fbc-4b89-8ec1-c4154c47f232,COMPLETE
492,492,0.3535528596187175,2021-10-14 15:34:22.538261,2021-10-14 15:34:22.881330,0 days 00:00:00.343069,goss,0.6060955534113158,0.0713540266119241,228,0.08341372454608331,0.9164829463544882,0.3535528596187175,0.3414869029275809,158a3dbe-1769-456f-9b3d-5256a85ab842,COMPLETE
493,493,0.3535528596187175,2021-10-14 15:34:22.883329,2021-10-14 15:34:23.261330,0 days 00:00:00.378001,goss,0.43070762337685725,0.09281936259251353,202,0.18294536083050406,0.422965864264308,0.3535528596187175,0.3414869029275809,6ce79222-e271-4422-8806-809488a100eb,COMPLETE
494,494,0.3535528596187175,2021-10-14 15:34:23.264329,2021-10-14 15:34:23.616418,0 days 00:00:00.352089,goss,0.47906119128792335,0.04313771312234662,180,0.0033078895584101597,0.996687309268403,0.3535528596187175,0.3414869029275809,b4fd2f77-9265-4e3d-b2b3-96439ed10fea,COMPLETE
495,495,0.3535528596187175,2021-10-14 15:34:23.619416,2021-10-14 15:34:23.986412,0 days 00:00:00.366996,goss,0.47380176701488363,0.15385714008739673,141,0.026086953413611617,0.32403272401258515,0.3535528596187175,0.3414869029275809,b8a0e776-c0f1-465c-95a4-8b69da618db8,COMPLETE
496,496,0.3535528596187175,2021-10-14 15:34:23.989416,2021-10-14 15:34:24.332419,0 days 00:00:00.343003,goss,0.34559221321111244,0.06734604044368205,169,0.19692164843069843,0.3179382600377306,0.3535528596187175,0.3414869029275809,9cd54e0f-394f-49fa-9da3-0c7610312829,COMPLETE
497,497,0.3535528596187175,2021-10-14 15:34:24.335413,2021-10-14 15:34:24.695414,0 days 00:00:00.360001,goss,0.3212098276324165,0.05650215826755857,263,0.027613214796234596,0.30432911756649944,0.3535528596187175,0.3414869029275809,3d246ff9-3af9-444b-b6ca-d3ef45579608,COMPLETE
498,498,0.3535528596187175,2021-10-14 15:34:24.697416,2021-10-14 15:34:25.011417,0 days 00:00:00.314001,goss,0.5259463040829669,0.09092155839522957,214,0.2799857132344725,0.35152956689652165,0.3535528596187175,0.3414869029275809,5f221ffd-d162-4805-afa7-41955b94af2d,COMPLETE
499,499,0.3535528596187175,2021-10-14 15:34:25.013411,2021-10-14 15:34:25.342416,0 days 00:00:00.329005,goss,0.49867368862354844,0.10208696561881664,195,0.4826983251811334,0.5124114955853611,0.3535528596187175,0.3414869029275809,a14ecb0e-fa18-4a1c-b2c0-e38c093a6b3b,COMPLETE
500,500,0.3535528596187175,2021-10-14 15:34:25.344414,2021-10-14 15:34:25.682718,0 days 00:00:00.338304,goss,0.5376998315431852,0.09254998588857175,241,0.44037629729377437,0.36387509065665763,0.3535528596187175,0.3414869029275809,ef900879-db94-472c-b0bc-2962b60478e9,COMPLETE
