,number,value,datetime_start,datetime_complete,duration,params_boosting,params_feature_fraction,params_learning_rate,params_num_leaves,params_other_rate,params_top_rate,user_attrs_test_error,user_attrs_train_error,user_attrs_uuid,state
249,249,0.3535528596187175,2021-10-14 15:32:57.767144,2021-10-14 15:32:58.064687,0 days 00:00:00.297543,gbdt,0.042067332172522454,0.011712698882756601,708,,,0.3535528596187175,0.3414869029275809,685820af-4624-4be6-9c35-5300fd944348,COMPLETE
250,250,0.3535528596187175,2021-10-14 15:32:58.066687,2021-10-14 15:32:58.363687,0 days 00:00:00.297000,gbdt,0.12663715662793643,0.0025258911074804704,836,,,0.3535528596187175,0.3414869029275809,51f6c33f-d2bf-420b-b3eb-1aa6d9b4b295,COMPLETE
251,251,0.3535528596187175,2021-10-14 15:32:58.365685,2021-10-14 15:32:58.707688,0 days 00:00:00.342003,gbdt,0.20178963387362236,0.0023304746250112974,788,,,0.3535528596187175,0.3414869029275809,ef443960-c2b0-4c3e-95fd-290478316586,COMPLETE
252,252,0.3535528596187175,2021-10-14 15:32:58.709686,2021-10-14 15:32:59.029773,0 days 00:00:00.320087,gbdt,0.14768617047940985,0.0037765833769882605,858,,,0.3535528596187175,0.3414869029275809,628f8f0c-9a93-45e3-9a20-08a644cfdc0e,COMPLETE
253,253,0.3535528596187175,2021-10-14 15:32:59.032774,2021-10-14 15:32:59.340311,0 days 00:00:00.307537,gbdt,0.11629488347749994,0.038608273001102866,825,,,0.3535528596187175,0.3414869029275809,6058a7f9-c35a-4cd4-ac5e-4cdc41bb6ab0,COMPLETE
254,254,0.3535528596187175,2021-10-14 15:32:59.344307,2021-10-14 15:32:59.691848,0 days 00:00:00.347541,gbdt,0.1840792404512364,0.001809255961101136,857,,,0.3535528596187175,0.3414869029275809,0bd12113-70cb-4f4a-a452-1e6133ff3dd6,COMPLETE
255,255,0.3535528596187175,2021-10-14 15:32:59.694844,2021-10-14 15:33:00.075849,0 days 00:00:00.381005,gbdt,0.16039343746280751,0.001434571775590216,868,,,0.3535528596187175,0.3414869029275809,1a67df09-079c-418b-93ca-376f9d32113e,COMPLETE
256,256,0.3535528596187175,2021-10-14 15:33:00.077845,2021-10-14 15:33:00.404847,0 days 00:00:00.327002,gbdt,0.22931553762216117,0.01706163577027968,805,,,0.3535528596187175,0.3414869029275809,7ec598e1-011e-44d5-b628-313095895430,COMPLETE
257,257,0.3535528596187175,2021-10-14 15:33:00.407845,2021-10-14 15:33:00.718378,0 days 00:00:00.310533,gbdt,0.19167468757252515,0.006625727558093667,674,,,0.3535528596187175,0.3414869029275809,3d951d78-a17c-449f-978b-7bc8a5edb2ed,COMPLETE
258,258,0.3535528596187175,2021-10-14 15:33:00.721380,2021-10-14 15:33:01.026873,0 days 00:00:00.305493,gbdt,0.1678657890915024,0.008475959442615357,892,,,0.3535528596187175,0.3414869029275809,5c13006a-d532-48a7-8059-fda47c826ebe,COMPLETE
259,259,0.3535528596187175,2021-10-14 15:33:01.029873,2021-10-14 15:33:01.291873,0 days 00:00:00.262000,gbdt,0.029527385275912074,0.0012953082905028833,627,,,0.3535528596187175,0.3414869029275809,bb6b17e2-ac01-4857-becf-4c9a584424d4,COMPLETE
260,260,0.3535528596187175,2021-10-14 15:33:01.293872,2021-10-14 15:33:01.611953,0 days 00:00:00.318081,gbdt,0.05099439700840843,0.0017477195875116008,829,,,0.3535528596187175,0.3414869029275809,b3016f0c-51ee-4286-81b9-5642899ed57f,COMPLETE
261,261,0.3535528596187175,2021-10-14 15:33:01.613952,2021-10-14 15:33:01.968953,0 days 00:00:00.355001,gbdt,0.09346244575976008,0.001243397984752408,792,,,0.3535528596187175,0.3414869029275809,18857066-fce3-420d-a48e-3e0677111ed7,COMPLETE
262,262,0.3535528596187175,2021-10-14 15:33:01.970954,2021-10-14 15:33:02.263952,0 days 00:00:00.292998,gbdt,0.2180100891571827,0.00286819469203865,635,,,0.3535528596187175,0.3414869029275809,2b771d47-1628-4e51-a964-a5b191ac9aaf,COMPLETE
263,263,0.3535528596187175,2021-10-14 15:33:02.265949,2021-10-14 15:33:02.565957,0 days 00:00:00.300008,gbdt,0.15112892621969082,0.0009549147449012502,820,,,0.3535528596187175,0.3414869029275809,22df04bf-e876-44cc-a685-be6ef02fc814,COMPLETE
264,264,0.3535528596187175,2021-10-14 15:33:02.568953,2021-10-14 15:33:02.889958,0 days 00:00:00.321005,gbdt,0.000124891446767441,0.0021198313929188086,852,,,0.3535528596187175,0.3414869029275809,4add1662-09c6-4959-a27b-8873d6a643fa,COMPLETE
265,265,0.3535528596187175,2021-10-14 15:33:02.892963,2021-10-14 15:33:03.205950,0 days 00:00:00.312987,gbdt,0.18397561382938443,0.001486756848250611,898,,,0.3535528596187175,0.3414869029275809,da6d7a71-7c1c-40dd-b5e1-92226dbee254,COMPLETE
266,266,0.3535528596187175,2021-10-14 15:33:03.207951,2021-10-14 15:33:03.537951,0 days 00:00:00.330000,gbdt,0.12764030736375817,0.0009625911498019305,925,,,0.3535528596187175,0.3414869029275809,f0a0ed9b-73ec-44de-8adf-abb3e1f89bbe,COMPLETE
267,267,0.3535528596187175,2021-10-14 15:33:03.540952,2021-10-14 15:33:03.900957,0 days 00:00:00.360005,gbdt,0.26461214785822185,0.0010701668395836613,928,,,0.3535528596187175,0.3414869029275809,a17870b6-169f-4e82-ae3e-f2356708c1e5,COMPLETE
268,268,0.3535528596187175,2021-10-14 15:33:03.902963,2021-10-14 15:33:04.198957,0 days 00:00:00.295994,gbdt,0.931475226686771,0.0008156781584788494,612,,,0.3535528596187175,0.3414869029275809,90341a74-5bb7-468c-96a3-36540d447024,COMPLETE
269,269,0.3535528596187175,2021-10-14 15:33:04.200949,2021-10-14 15:33:04.472951,0 days 00:00:00.272002,gbdt,0.13961717530159762,0.0035279945346002057,593,,,0.3535528596187175,0.3414869029275809,99151c51-63b8-4088-8dd8-965482752dcd,COMPLETE
270,270,0.3535528596187175,2021-10-14 15:33:04.474951,2021-10-14 15:33:04.813961,0 days 00:00:00.339010,gbdt,0.9259154394656559,0.0011877568789613873,877,,,0.3535528596187175,0.3414869029275809,43f7c70a-def0-4142-962e-05b48c2e005c,COMPLETE
271,271,0.3535528596187175,2021-10-14 15:33:04.816954,2021-10-14 15:33:05.120035,0 days 00:00:00.303081,gbdt,0.2027847570005007,0.002093553323057936,582,,,0.3535528596187175,0.3414869029275809,939f25ac-c30d-4114-8c35-51a4bf55fcb3,COMPLETE
272,272,0.3535528596187175,2021-10-14 15:33:05.122036,2021-10-14 15:33:05.456038,0 days 00:00:00.334002,gbdt,0.9799191350958225,0.0007005793529203729,910,,,0.3535528596187175,0.3414869029275809,9450952b-766c-445f-9b55-39577973d770,COMPLETE
273,273,0.3535528596187175,2021-10-14 15:33:05.458036,2021-10-14 15:33:05.755037,0 days 00:00:00.297001,gbdt,0.9734951598035875,0.0008758368534962681,551,,,0.3535528596187175,0.3414869029275809,4061a6d9-31b9-449d-8428-e85df5e02e7b,COMPLETE
274,274,0.3535528596187175,2021-10-14 15:33:05.757036,2021-10-14 15:33:06.073034,0 days 00:00:00.315998,gbdt,0.1798006030470989,0.0015110520413844895,932,,,0.3535528596187175,0.3414869029275809,ad02a293-f409-4a27-8628-c62e83ce148a,COMPLETE
275,275,0.3535528596187175,2021-10-14 15:33:06.075035,2021-10-14 15:33:06.412038,0 days 00:00:00.337003,gbdt,0.8883737362958007,0.00012704097257275877,899,,,0.3535528596187175,0.3414869029275809,c168a3c9-a863-4464-b861-4caab52b1a83,COMPLETE
276,276,0.3535528596187175,2021-10-14 15:33:06.415038,2021-10-14 15:33:06.740586,0 days 00:00:00.325548,gbdt,0.950919554460753,0.001013167763184825,942,,,0.3535528596187175,0.3414869029275809,fd0d9928-075d-4e5d-8d76-8da2a858423a,COMPLETE
277,277,0.3535528596187175,2021-10-14 15:33:06.743584,2021-10-14 15:33:07.057717,0 days 00:00:00.314133,gbdt,0.9610361452801235,0.001283383246400462,843,,,0.3535528596187175,0.3414869029275809,680f6de5-e542-46c8-85d4-98c1e07d118b,COMPLETE
278,278,0.3535528596187175,2021-10-14 15:33:07.059716,2021-10-14 15:33:07.369718,0 days 00:00:00.310002,gbdt,0.8714886273119444,0.0006080292262278509,982,,,0.3535528596187175,0.3414869029275809,e72c4006-e1ad-4ed9-aac1-e230e12b1f2b,COMPLETE
279,279,0.3535528596187175,2021-10-14 15:33:07.371720,2021-10-14 15:33:07.644795,0 days 00:00:00.273075,gbdt,0.9190349037791372,0.00010390891172373866,536,,,0.3535528596187175,0.3414869029275809,1fe758b4-bbcc-4fd3-b544-13879f18a509,COMPLETE
280,280,0.3535528596187175,2021-10-14 15:33:07.646793,2021-10-14 15:33:07.918795,0 days 00:00:00.272002,gbdt,0.7869723707562365,0.0007144779792704989,549,,,0.3535528596187175,0.3414869029275809,4d7c8d75-c802-402f-8351-6f708e59145a,COMPLETE
281,281,0.3535528596187175,2021-10-14 15:33:07.921793,2021-10-14 15:33:08.197798,0 days 00:00:00.276005,gbdt,0.9378983375563626,0.00016243966890001007,423,,,0.3535528596187175,0.3414869029275809,7b8be0b5-163f-4c78-a873-e71f808b666c,COMPLETE
282,282,0.3535528596187175,2021-10-14 15:33:08.200791,2021-10-14 15:33:08.476794,0 days 00:00:00.276003,gbdt,0.7452408733307382,0.0002430559856095219,604,,,0.3535528596187175,0.3414869029275809,9b356113-ac74-47e6-9dea-6b02436f31a5,COMPLETE
283,283,0.3535528596187175,2021-10-14 15:33:08.478792,2021-10-14 15:33:08.754795,0 days 00:00:00.276003,gbdt,0.7758731552191199,0.000248354380953964,445,,,0.3535528596187175,0.3414869029275809,e9f9d937-d991-4db4-ae29-f9b6d44ce92b,COMPLETE
284,284,0.3535528596187175,2021-10-14 15:33:08.757796,2021-10-14 15:33:09.142336,0 days 00:00:00.384540,gbdt,0.8395080301477573,0.00016330886485090788,914,,,0.3535528596187175,0.3414869029275809,de7320fb-5ef3-462d-81bf-203559a5a237,COMPLETE
285,285,0.3535528596187175,2021-10-14 15:33:09.147343,2021-10-14 15:33:09.446436,0 days 00:00:00.299093,gbdt,0.21708519719751695,0.000287315666715676,568,,,0.3535528596187175,0.3414869029275809,1257e8ab-faec-43be-b3a1-cc571acc3285,COMPLETE
286,286,0.3535528596187175,2021-10-14 15:33:09.449429,2021-10-14 15:33:09.734967,0 days 00:00:00.285538,gbdt,0.24468472903081984,0.0001234541324987681,485,,,0.3535528596187175,0.3414869029275809,14dabe98-be01-4f71-bedc-805015ce60da,COMPLETE
287,287,0.3535528596187175,2021-10-14 15:33:09.737967,2021-10-14 15:33:10.132977,0 days 00:00:00.395010,gbdt,0.697215116019286,0.00014593625049283187,958,,,0.3535528596187175,0.3414869029275809,229b36a7-6fc6-4f97-8341-fa0a96db5125,COMPLETE
288,288,0.3535528596187175,2021-10-14 15:33:10.136971,2021-10-14 15:33:10.592519,0 days 00:00:00.455548,gbdt,0.8873010210258042,0.000863057979668793,513,,,0.3535528596187175,0.3414869029275809,05bd2d90-1e2b-417e-929d-cfc056ac23ac,COMPLETE
289,289,0.3535528596187175,2021-10-14 15:33:10.595519,2021-10-14 15:33:11.061317,0 days 00:00:00.465798,gbdt,0.27856918654028245,0.0007698121044292446,992,,,0.3535528596187175,0.3414869029275809,0410abf1-c1a4-4ac8-8e0d-50b2e1eb9e66,COMPLETE
290,290,0.3535528596187175,2021-10-14 15:33:11.064310,2021-10-14 15:33:11.393846,0 days 00:00:00.329536,gbdt,0.9035270101560232,0.0005817935526470975,318,,,0.3535528596187175,0.3414869029275809,e4fa6fdf-bdb4-40b8-9297-38b5ef66030e,COMPLETE
291,291,0.3535528596187175,2021-10-14 15:33:11.396844,2021-10-14 15:33:11.831842,0 days 00:00:00.434998,gbdt,0.911558662174731,0.0003436842407690918,338,,,0.3535528596187175,0.3414869029275809,db172e40-d049-491d-9e22-7e66c443dfeb,COMPLETE
292,292,0.3535528596187175,2021-10-14 15:33:11.834842,2021-10-14 15:33:12.388360,0 days 00:00:00.553518,gbdt,0.8669000305045687,0.0005276198665052292,360,,,0.3535528596187175,0.3414869029275809,81c5d744-165c-4459-a55e-bf3f135d7878,COMPLETE
293,293,0.3535528596187175,2021-10-14 15:33:12.390362,2021-10-14 15:33:12.779367,0 days 00:00:00.389005,gbdt,0.9536065970066672,0.0006364995898965457,334,,,0.3535528596187175,0.3414869029275809,23da67ca-1373-4e31-bc5e-d56e27f2e7b6,COMPLETE
294,294,0.3535528596187175,2021-10-14 15:33:12.781360,2021-10-14 15:33:13.073737,0 days 00:00:00.292377,gbdt,0.8243996434358027,0.00048720226576076176,375,,,0.3535528596187175,0.3414869029275809,e4382d93-f3ce-4562-8d71-a57c53eacd08,COMPLETE
295,295,0.3535528596187175,2021-10-14 15:33:13.076724,2021-10-14 15:33:13.416807,0 days 00:00:00.340083,gbdt,0.9994716262460249,0.0004447826338219647,979,,,0.3535528596187175,0.3414869029275809,ef74b656-77e7-4fd8-85b4-7f5d09115e3b,COMPLETE
296,296,0.3535528596187175,2021-10-14 15:33:13.419810,2021-10-14 15:33:13.710806,0 days 00:00:00.290996,gbdt,0.8248295148137074,0.00014986714628368133,467,,,0.3535528596187175,0.3414869029275809,7b7d33ea-f31f-4f71-9fff-edb44796af50,COMPLETE
297,297,0.3535528596187175,2021-10-14 15:33:13.713803,2021-10-14 15:33:13.984804,0 days 00:00:00.271001,gbdt,0.8547241068369617,0.00010477361254773959,530,,,0.3535528596187175,0.3414869029275809,850a80d6-acd9-4de7-a6e7-580e217c38f8,COMPLETE
298,298,0.3535528596187175,2021-10-14 15:33:13.987805,2021-10-14 15:33:14.271805,0 days 00:00:00.284000,gbdt,0.8820928749444535,0.07885744465056417,391,,,0.3535528596187175,0.3414869029275809,500da0f9-1bcb-4b66-b47f-518008eac9e6,COMPLETE
299,299,0.3535528596187175,2021-10-14 15:33:14.273802,2021-10-14 15:33:14.605808,0 days 00:00:00.332006,gbdt,0.8184664792911962,0.00036030204069498423,420,,,0.3535528596187175,0.3414869029275809,cb5b243c-95eb-46f0-ac0d-6dc136e6da0f,COMPLETE
300,300,0.3535528596187175,2021-10-14 15:33:14.607804,2021-10-14 15:33:14.924807,0 days 00:00:00.317003,gbdt,0.8030074694585557,0.0003131511226269755,448,,,0.3535528596187175,0.3414869029275809,694e1166-97fc-455f-bacc-e56adb2caeb5,COMPLETE
301,301,0.3535528596187175,2021-10-14 15:33:14.927804,2021-10-14 15:33:15.279803,0 days 00:00:00.351999,gbdt,0.8281088543117912,0.0004434379485381409,474,,,0.3535528596187175,0.3414869029275809,1435833e-1adb-425d-bf06-dcaa2983cf4b,COMPLETE
302,302,0.3535528596187175,2021-10-14 15:33:15.283805,2021-10-14 15:33:15.659810,0 days 00:00:00.376005,goss,0.8476204535167284,0.00020053010398801653,476,0.6162697360195788,0.14665949206005918,0.3535528596187175,0.3414869029275809,2565cf1b-b81b-4c6e-960d-73b91005a382,COMPLETE
303,303,0.3535528596187175,2021-10-14 15:33:15.662811,2021-10-14 15:33:16.017808,0 days 00:00:00.354997,gbdt,0.7694106019339806,0.00012309453911467456,964,,,0.3535528596187175,0.3414869029275809,4bb627b1-0405-49c7-9e82-ee7067ed703d,COMPLETE
304,304,0.3535528596187175,2021-10-14 15:33:16.022805,2021-10-14 15:33:16.359802,0 days 00:00:00.336997,goss,0.7918302849169423,0.21905346977186904,515,0.573442274976784,0.1157418508068406,0.3535528596187175,0.3414869029275809,b2770483-1ac8-4766-8509-06209584ab56,COMPLETE
305,305,0.3535528596187175,2021-10-14 15:33:16.361803,2021-10-14 15:33:16.660806,0 days 00:00:00.299003,goss,0.6556086265355143,0.00022953602662243553,502,0.5997027349074572,0.1553335913109898,0.3535528596187175,0.3414869029275809,384afa98-1360-4db7-9ec1-f368f0dd9234,COMPLETE
306,306,0.3535528596187175,2021-10-14 15:33:16.662807,2021-10-14 15:33:16.965807,0 days 00:00:00.303000,goss,0.8028295606034852,0.0002688344101169467,428,0.549587026359476,0.17508998829667757,0.3535528596187175,0.3414869029275809,b919ebbb-45f5-411e-98e1-57a36f195a7a,COMPLETE
307,307,0.3535528596187175,2021-10-14 15:33:16.967801,2021-10-14 15:33:17.262804,0 days 00:00:00.295003,goss,0.6271188616793293,0.00035736296053184965,456,0.49923709640597236,0.08434608657114542,0.3535528596187175,0.3414869029275809,b9418f03-66fc-4072-a892-2eb740389ef3,COMPLETE
308,308,0.3535528596187175,2021-10-14 15:33:17.264812,2021-10-14 15:33:17.563804,0 days 00:00:00.298992,goss,0.7346296324482275,0.3171674421930582,418,0.4926053525521403,0.1727082579342129,0.3535528596187175,0.3414869029275809,11a2da25-9398-47d6-bc93-a0e257c6f661,COMPLETE
309,309,0.3535528596187175,2021-10-14 15:33:17.565802,2021-10-14 15:33:17.868803,0 days 00:00:00.303001,goss,0.520725923055679,0.00020557457759189153,409,0.5190638348200904,0.19455231897299657,0.3535528596187175,0.3414869029275809,cb0573f8-0902-44bc-964f-a97870fd1789,COMPLETE
310,310,0.3535528596187175,2021-10-14 15:33:17.871805,2021-10-14 15:33:18.175802,0 days 00:00:00.303997,goss,0.7174693869757047,0.3893050580193575,284,0.48840806116555185,0.12848990583133485,0.3535528596187175,0.3414869029275809,c66a866b-0ea2-4604-befa-c602f65d89f2,COMPLETE
311,311,0.3535528596187175,2021-10-14 15:33:18.177802,2021-10-14 15:33:18.476883,0 days 00:00:00.299081,goss,0.567425570958445,0.0003699249188828718,298,0.4291873229840876,0.2446805588412105,0.3535528596187175,0.3414869029275809,2821abd7-890b-4d24-8769-5b8643a8d8d0,COMPLETE
312,312,0.3535528596187175,2021-10-14 15:33:18.479886,2021-10-14 15:33:18.770884,0 days 00:00:00.290998,goss,0.6802527417951189,0.0002865137832968953,326,0.34804463977677635,0.24189486387182463,0.3535528596187175,0.3414869029275809,47ae2ce6-f277-4523-bb33-d60b3f2ba815,COMPLETE
313,313,0.3535528596187175,2021-10-14 15:33:18.773881,2021-10-14 15:33:19.086881,0 days 00:00:00.313000,goss,0.7284101168362737,0.00032715059052886643,345,0.4604479098349287,0.20528731642061285,0.3535528596187175,0.3414869029275809,0241a467-0f4d-406b-a69a-537919848cd0,COMPLETE
314,314,0.3535528596187175,2021-10-14 15:33:19.088882,2021-10-14 15:33:19.389885,0 days 00:00:00.301003,goss,0.7488441166655047,0.17070756283578067,371,0.45470355381135946,0.25325780768532724,0.3535528596187175,0.3414869029275809,885b5428-6bef-419b-8648-482a973f426d,COMPLETE
315,315,0.3535528596187175,2021-10-14 15:33:19.392885,2021-10-14 15:33:19.689884,0 days 00:00:00.296999,goss,0.7037611360329418,0.07061668195904144,361,0.5286515649071486,0.23387684935685496,0.3535528596187175,0.3414869029275809,20a92788-5cac-4685-b95c-9d003f5e5016,COMPLETE
316,316,0.3535528596187175,2021-10-14 15:33:19.692882,2021-10-14 15:33:19.982885,0 days 00:00:00.290003,goss,0.7596181862025919,0.05457543785912766,354,0.45148764511757256,0.21319784988970647,0.3535528596187175,0.3414869029275809,8e412da3-615d-4422-9be6-b99354c4030c,COMPLETE
317,317,0.3535528596187175,2021-10-14 15:33:19.986887,2021-10-14 15:33:20.328885,0 days 00:00:00.341998,goss,0.7177775950130908,0.08133589916853778,398,0.41471347860870744,0.2610765398671011,0.3535528596187175,0.3414869029275809,c97afb75-aff4-49ef-a53c-167a01c67b68,COMPLETE
318,318,0.3535528596187175,2021-10-14 15:33:20.330884,2021-10-14 15:33:20.646885,0 days 00:00:00.316001,goss,0.30343360286154025,0.10033340598796939,328,0.4673940950597128,0.2769596073063829,0.3535528596187175,0.3414869029275809,aaea3a68-c02b-45a7-959b-3f9d73a978c4,COMPLETE
319,319,0.3535528596187175,2021-10-14 15:33:20.648882,2021-10-14 15:33:20.953884,0 days 00:00:00.305002,goss,0.2933653139044038,0.06321852396511989,376,0.007628064715044014,0.9922300543984344,0.3535528596187175,0.3414869029275809,feb34248-aa69-4c29-bc62-d2ba4277e8b3,COMPLETE
320,320,0.3535528596187175,2021-10-14 15:33:20.955883,2021-10-14 15:33:21.246883,0 days 00:00:00.291000,goss,0.3721777261535611,0.123908892952915,395,0.46992659710277374,0.2260085677426838,0.3535528596187175,0.3414869029275809,e9b95fcc-9ed7-4dee-a551-c0e554509dce,COMPLETE
321,321,0.3535528596187175,2021-10-14 15:33:21.248885,2021-10-14 15:33:21.553884,0 days 00:00:00.304999,goss,0.3394845441792156,0.00021624802051482158,302,0.45219658519301914,0.17040416055993,0.3535528596187175,0.3414869029275809,9b09ba44-463d-4ff1-9363-b0269052d71d,COMPLETE
322,322,0.3535528596187175,2021-10-14 15:33:21.556886,2021-10-14 15:33:21.898987,0 days 00:00:00.342101,goss,0.36116624657667673,0.00017599338142718505,394,0.5251648558358212,0.28980103738846746,0.3535528596187175,0.3414869029275809,10b92177-5a26-447d-b6c4-9967cf226738,COMPLETE
323,323,0.3535528596187175,2021-10-14 15:33:21.901986,2021-10-14 15:33:22.212613,0 days 00:00:00.310627,goss,0.7758887172037296,0.0886125734298343,378,0.4064144982303534,0.4901220301626477,0.3535528596187175,0.3414869029275809,c3f9ed5a-6bdd-4d4a-80f8-eb1657beac86,COMPLETE
324,324,0.3535528596187175,2021-10-14 15:33:22.214611,2021-10-14 15:33:22.575154,0 days 00:00:00.360543,goss,0.374738053834159,0.15942772704625574,178,0.03654830655470656,0.29843137819501525,0.3535528596187175,0.3414869029275809,f1ea4fc7-a559-45ea-b0e0-91b3954a35e0,COMPLETE
325,325,0.3535528596187175,2021-10-14 15:33:22.577151,2021-10-14 15:33:22.894686,0 days 00:00:00.317535,goss,0.32716629610961045,0.18218329883135365,310,0.29734609964264985,0.2624571004723595,0.3535528596187175,0.3414869029275809,7b67ef21-0909-44ee-b72c-a322cdbe3d26,COMPLETE
326,326,0.3535528596187175,2021-10-14 15:33:22.896685,2021-10-14 15:33:23.189226,0 days 00:00:00.292541,goss,0.6809711225361685,0.057947971572719525,199,0.5061028420848356,0.4760536854228894,0.3535528596187175,0.3414869029275809,7557ac98-b1e5-4eca-94d6-482338da4709,COMPLETE
327,327,0.3535528596187175,2021-10-14 15:33:23.191222,2021-10-14 15:33:23.518753,0 days 00:00:00.327531,goss,0.39810025873695476,0.009258926492888887,12,0.19843272604858908,0.3242230403016027,0.3535528596187175,0.3414869029275809,ed0c25e5-218e-482a-bc7f-340cf71b3ff8,COMPLETE
328,328,0.3535528596187175,2021-10-14 15:33:23.520753,2021-10-14 15:33:23.821836,0 days 00:00:00.301083,goss,0.6441060148138554,0.21465655445131596,253,0.43668036408232613,0.4356714395571064,0.3535528596187175,0.3414869029275809,72b7e3f0-5b26-434a-b7a8-93f7850eec45,COMPLETE
329,329,0.3535528596187175,2021-10-14 15:33:23.824836,2021-10-14 15:33:24.124020,0 days 00:00:00.299184,goss,0.4786234545407532,0.04919553885252287,148,0.2816649998641381,0.42423869426495975,0.3535528596187175,0.3414869029275809,60791aa7-4b8a-483c-b1c8-f313058e7bb6,COMPLETE
330,330,0.3535528596187175,2021-10-14 15:33:24.130020,2021-10-14 15:33:24.471019,0 days 00:00:00.340999,goss,0.38712650980387625,0.2634951277465202,247,0.23054749454525358,0.4413965881602147,0.3535528596187175,0.3414869029275809,ee2a44ec-14b9-4d81-aaf5-8468e845ca94,COMPLETE
331,331,0.3535528596187175,2021-10-14 15:33:24.474027,2021-10-14 15:33:24.809020,0 days 00:00:00.334993,goss,0.4302478497790384,0.040313925050028294,280,0.4783317633669016,0.3030959172247546,0.3535528596187175,0.3414869029275809,d7f0ee2b-8d67-42f8-a6f1-283f7bf00d00,COMPLETE
332,332,0.3535528596187175,2021-10-14 15:33:24.811020,2021-10-14 15:33:25.164020,0 days 00:00:00.353000,goss,0.6123795076062581,0.1098574918420239,256,0.3296059125180697,0.578883214050254,0.3535528596187175,0.3414869029275809,82f05c0e-ac9f-41b2-a85c-dcb6875ddb31,COMPLETE
333,333,0.3535528596187175,2021-10-14 15:33:25.167017,2021-10-14 15:33:25.480026,0 days 00:00:00.313009,goss,0.44786651704445796,0.1314606895508088,229,0.142907498933703,0.8390760317971495,0.3535528596187175,0.3414869029275809,82f9c6e4-3c43-4e7c-9b1c-2df5059f2255,COMPLETE
