,number,value,datetime_start,datetime_complete,duration,params_boosting,params_feature_fraction,params_learning_rate,params_num_leaves,params_other_rate,params_top_rate,user_attrs_test_error,user_attrs_train_error,user_attrs_uuid,state
673,673,0.3535528596187175,2021-10-14 15:35:28.710046,2021-10-14 15:35:29.077058,0 days 00:00:00.367012,gbdt,0.7245552441639392,0.0003525179933775118,373,,,0.3535528596187175,0.3414869029275809,8cc64006-4f76-4e24-8d09-af42e3d46461,COMPLETE
674,674,0.3535528596187175,2021-10-14 15:35:29.081041,2021-10-14 15:35:29.419047,0 days 00:00:00.338006,gbdt,0.6941209728736475,0.00030520763343595136,348,,,0.3535528596187175,0.3414869029275809,b7943ca6-c1a3-4cea-869d-454e456f3c3b,COMPLETE
675,675,0.3535528596187175,2021-10-14 15:35:29.422044,2021-10-14 15:35:29.747044,0 days 00:00:00.325000,gbdt,0.6617151188345429,0.0002454798190687639,343,,,0.3535528596187175,0.3414869029275809,42bdf3f0-d206-42e6-b7e7-12b3e39a4e7a,COMPLETE
676,676,0.3535528596187175,2021-10-14 15:35:29.750041,2021-10-14 15:35:30.095047,0 days 00:00:00.345006,gbdt,0.7148106960430016,0.0003957788658666632,376,,,0.3535528596187175,0.3414869029275809,38fde4bf-897e-4b13-9129-81fdbbd078fa,COMPLETE
677,677,0.3535528596187175,2021-10-14 15:35:30.097038,2021-10-14 15:35:30.443114,0 days 00:00:00.346076,gbdt,0.6695581442731559,0.0003101071712326586,390,,,0.3535528596187175,0.3414869029275809,961f42cc-6f6d-47d5-93c7-2a7d414bf4cd,COMPLETE
678,678,0.3535528596187175,2021-10-14 15:35:30.446106,2021-10-14 15:35:30.804350,0 days 00:00:00.358244,goss,0.7135668683943857,0.33179963803825563,322,0.6901616197177588,0.05083490576162314,0.3535528596187175,0.3414869029275809,733bc4d1-4fc9-47bd-b74e-e3828df08e4f,COMPLETE
679,679,0.3535528596187175,2021-10-14 15:35:30.807345,2021-10-14 15:35:31.177660,0 days 00:00:00.370315,goss,0.6813155804642784,0.41031501764695655,369,0.7037221815714841,0.0011796510332649918,0.3535528596187175,0.3414869029275809,6bb28324-39f4-4d8d-aef9-fd3a88c3ead3,COMPLETE
680,680,0.3535528596187175,2021-10-14 15:35:31.180658,2021-10-14 15:35:31.559183,0 days 00:00:00.378525,goss,0.7556110703847592,0.33502987247477445,398,0.6525631594383057,0.06065264949752326,0.3535528596187175,0.3414869029275809,223b0764-88c6-4c66-a117-a7468816018e,COMPLETE
681,681,0.3535528596187175,2021-10-14 15:35:31.563187,2021-10-14 15:35:31.904728,0 days 00:00:00.341541,goss,0.7324857168094419,0.00039163301679252333,358,0.8256587865224352,0.04270763322328518,0.3535528596187175,0.3414869029275809,9ac28ea0-83cf-44b9-aec6-ccfdebe3f5d0,COMPLETE
682,682,0.3535528596187175,2021-10-14 15:35:31.907732,2021-10-14 15:35:32.273726,0 days 00:00:00.365994,goss,0.7150295653652907,0.3737026541708164,337,0.5884057981165577,0.08877487773339358,0.3535528596187175,0.3414869029275809,5957bc27-9b6d-4afb-88cd-1601eb48a6e9,COMPLETE
683,683,0.3535528596187175,2021-10-14 15:35:32.276724,2021-10-14 15:35:32.647739,0 days 00:00:00.371015,goss,0.6926311924409785,0.0002092409208541936,404,0.6282016744289189,0.11000554246317268,0.3535528596187175,0.3414869029275809,3297a602-ca4b-4857-8242-34ee4d865dc9,COMPLETE
684,684,0.3535528596187175,2021-10-14 15:35:32.650728,2021-10-14 15:35:32.999728,0 days 00:00:00.349000,goss,0.7126039771256044,0.3644689017938251,375,0.5678284412866875,0.07289383748773494,0.3535528596187175,0.3414869029275809,20d700c4-fe92-424a-9f1b-d9933f8c6eda,COMPLETE
685,685,0.3535528596187175,2021-10-14 15:35:33.003729,2021-10-14 15:35:33.370729,0 days 00:00:00.367000,goss,0.6994691369509499,0.2872817635747091,384,0.678104461950557,0.12917830547341225,0.3535528596187175,0.3414869029275809,336c54c2-4036-4375-a069-dfe083515d07,COMPLETE
686,686,0.3535528596187175,2021-10-14 15:35:33.373731,2021-10-14 15:35:33.769649,0 days 00:00:00.395918,goss,0.7258309992149187,0.39499306058713984,392,0.6075771414491156,0.10771602237969184,0.3535528596187175,0.3414869029275809,56001209-7ec8-4651-89d5-efc6ce08d6f2,COMPLETE
687,687,0.3535528596187175,2021-10-14 15:35:33.774650,2021-10-14 15:35:34.185137,0 days 00:00:00.410487,goss,0.7376827296496201,0.4345465862028219,406,0.64219141924823,0.032120867340253934,0.3535528596187175,0.3414869029275809,2ec6127f-0b6b-49df-81e5-6ff71cea8b6a,COMPLETE
688,688,0.3535528596187175,2021-10-14 15:35:34.188140,2021-10-14 15:35:34.666676,0 days 00:00:00.478536,goss,0.6643894488375331,0.21367810687117317,393,0.7268759381877968,0.1427873923185691,0.3535528596187175,0.3414869029275809,8353b5eb-6881-47bd-b4c8-50c507308390,COMPLETE
689,689,0.3535528596187175,2021-10-14 15:35:34.669679,2021-10-14 15:35:35.084756,0 days 00:00:00.415077,goss,0.6820702652416902,0.29909347957937993,364,0.580989084130644,0.0953829228139294,0.3535528596187175,0.3414869029275809,75a240ab-8cad-4d3f-a696-6366cad50da7,COMPLETE
690,690,0.3535528596187175,2021-10-14 15:35:35.088758,2021-10-14 15:35:35.564941,0 days 00:00:00.476183,goss,0.7137971673121749,0.25187613757165067,366,0.5574571624432534,0.07381410993699562,0.3535528596187175,0.3414869029275809,4798e056-d942-4ba3-9699-fb4de57b249f,COMPLETE
691,691,0.3535528596187175,2021-10-14 15:35:35.568939,2021-10-14 15:35:35.965486,0 days 00:00:00.396547,goss,0.6520509315938003,0.20526334160169984,350,0.5412892913313743,0.15009615397384224,0.3535528596187175,0.3414869029275809,bb2986c4-fb4d-4381-998d-d667356a36ba,COMPLETE
692,692,0.3535528596187175,2021-10-14 15:35:35.968484,2021-10-14 15:35:36.398486,0 days 00:00:00.430002,goss,0.6985280370437847,0.2793882365716597,329,0.5890111062230203,0.16409269769325638,0.3535528596187175,0.3414869029275809,3f883d6f-2780-488d-a061-dd675cfb0329,COMPLETE
693,693,0.3535528596187175,2021-10-14 15:35:36.401491,2021-10-14 15:35:36.815020,0 days 00:00:00.413529,goss,0.6793624848241541,0.07905546351822233,347,0.5472795983386898,0.12096579831121848,0.3535528596187175,0.3414869029275809,f284b6da-f33d-466b-904b-effc25287b9c,COMPLETE
694,694,0.3535528596187175,2021-10-14 15:35:36.818018,2021-10-14 15:35:37.375639,0 days 00:00:00.557621,goss,0.7011935485099476,0.17832710372817204,319,0.6159116734677645,0.18948418697843267,0.3535528596187175,0.3414869029275809,2fcf1ffa-9baa-44e7-98eb-bea7717ddf7b,COMPLETE
695,695,0.3535528596187175,2021-10-14 15:35:37.378639,2021-10-14 15:35:37.758259,0 days 00:00:00.379620,goss,0.7346538205445298,0.07722735135100632,378,0.5930938884715111,0.16493476265752058,0.3535528596187175,0.3414869029275809,bef976b6-0f6e-4167-b938-a294d1bb9815,COMPLETE
696,696,0.3535528596187175,2021-10-14 15:35:37.761258,2021-10-14 15:35:38.135799,0 days 00:00:00.374541,goss,0.7500641085995967,0.07349221962348165,313,0.567526262458882,0.13388679511757742,0.3535528596187175,0.3414869029275809,3dc3b138-fdba-439f-8e97-f7c8cce89230,COMPLETE
697,697,0.3535528596187175,2021-10-14 15:35:38.138802,2021-10-14 15:35:38.525328,0 days 00:00:00.386526,goss,0.7190147855263197,0.4593210652754011,359,0.5548128509745868,0.09290939224856132,0.3535528596187175,0.3414869029275809,4d67c3d6-fd9b-4941-a944-5a24a7c8fc34,COMPLETE
698,698,0.3535528596187175,2021-10-14 15:35:38.528335,2021-10-14 15:35:38.878329,0 days 00:00:00.349994,goss,0.6944404157622025,0.10357178783043554,393,0.5323384876077798,0.19591034444876748,0.3535528596187175,0.3414869029275809,545a7eb1-2d63-45c1-98a9-6cdecbd8414a,COMPLETE
699,699,0.3535528596187175,2021-10-14 15:35:38.882329,2021-10-14 15:35:39.233332,0 days 00:00:00.351003,goss,0.6439439855417174,0.1843326929460009,387,0.6350351445573849,0.18255969246534665,0.3535528596187175,0.3414869029275809,effbd8b2-4014-44e6-8808-c44ef78be994,COMPLETE
700,700,0.3535528596187175,2021-10-14 15:35:39.236332,2021-10-14 15:35:39.582874,0 days 00:00:00.346542,goss,0.30473991487608126,0.15515649794486974,382,0.5207524446540716,0.15478624097896834,0.3535528596187175,0.3414869029275809,8ef0573e-e779-4c28-ad59-0a553dccc2a2,COMPLETE
701,701,0.3535528596187175,2021-10-14 15:35:39.585874,2021-10-14 15:35:39.936871,0 days 00:00:00.350997,goss,0.6769730643775215,0.18761060979749977,336,0.5145110976243411,0.19719716033926235,0.3535528596187175,0.3414869029275809,ec4ae51b-0c7d-430c-94a7-841abc10a9d4,COMPLETE
702,702,0.3535528596187175,2021-10-14 15:35:39.940870,2021-10-14 15:35:40.278095,0 days 00:00:00.337225,goss,0.288498604544565,0.17465325385998312,306,0.5384183789550226,0.1843432637046073,0.3535528596187175,0.3414869029275809,38c88780-3fe1-4839-b3a8-81f428644195,COMPLETE
703,703,0.3535528596187175,2021-10-14 15:35:40.281114,2021-10-14 15:35:40.649651,0 days 00:00:00.368537,goss,0.3276041979423341,0.22316117508310135,295,0.5052452031937836,0.22372986216456625,0.3535528596187175,0.3414869029275809,56c58a00-b7af-4376-a1d8-ce5f360eebf3,COMPLETE
704,704,0.3535528596187175,2021-10-14 15:35:40.652650,2021-10-14 15:35:40.989659,0 days 00:00:00.337009,goss,0.3088911073574063,0.11697075064997633,293,0.5111873113861306,0.20940743955552957,0.3535528596187175,0.3414869029275809,b996aecc-a3d9-4847-b550-3bd5787e94d6,COMPLETE
705,705,0.3535528596187175,2021-10-14 15:35:40.992650,2021-10-14 15:35:41.342788,0 days 00:00:00.350138,goss,0.7533513725278486,0.13596026909550804,304,0.569129052487855,0.23261370454431585,0.3535528596187175,0.3414869029275809,63b4577b-026c-4926-bd3e-6d7b422ebd10,COMPLETE
706,706,0.3535528596187175,2021-10-14 15:35:41.345796,2021-10-14 15:35:41.703986,0 days 00:00:00.358190,goss,0.3179077029787266,0.2420968227740565,282,0.5379214446288445,0.2118051882384992,0.3535528596187175,0.3414869029275809,0b26ef33-d824-46aa-9941-0d07efdbd09e,COMPLETE
707,707,0.3535528596187175,2021-10-14 15:35:41.705981,2021-10-14 15:35:42.060984,0 days 00:00:00.355003,goss,0.3597443577971484,0.1586489383994732,294,0.4984484631120635,0.23990144924797235,0.3535528596187175,0.3414869029275809,06bc4102-ee29-47db-a87c-2b341e533809,COMPLETE
708,708,0.3535528596187175,2021-10-14 15:35:42.063984,2021-10-14 15:35:42.421985,0 days 00:00:00.358001,goss,0.38029194711692194,0.13792668075799028,309,0.4941983712535446,0.26793338119227145,0.3535528596187175,0.3414869029275809,f7d043a6-3b37-4489-a429-fd6a478eae17,COMPLETE
709,709,0.3535528596187175,2021-10-14 15:35:42.424983,2021-10-14 15:35:42.763629,0 days 00:00:00.338646,goss,0.3424455422104007,0.22069677919140665,319,0.5225596333045035,0.2559944679025221,0.3535528596187175,0.3414869029275809,ccc5944d-b2b7-40e8-882b-277647b784ef,COMPLETE
710,710,0.3535528596187175,2021-10-14 15:35:42.766626,2021-10-14 15:35:43.109663,0 days 00:00:00.343037,goss,0.37973107983786175,0.2651849857007371,284,0.4806644959179219,0.22945655806590956,0.3535528596187175,0.3414869029275809,0908d245-bd3e-452c-bfa3-32e286df9cad,COMPLETE
711,711,0.3535528596187175,2021-10-14 15:35:43.111657,2021-10-14 15:35:43.461058,0 days 00:00:00.349401,goss,0.6359025274248304,0.1784907794764326,326,0.48632953850973015,0.21107065373883893,0.3535528596187175,0.3414869029275809,f0b41fe8-72e7-48bb-822f-9bff8451500d,COMPLETE
712,712,0.3535528596187175,2021-10-14 15:35:43.464058,2021-10-14 15:35:43.817059,0 days 00:00:00.353001,goss,0.6150732351348511,0.030350400864138972,279,0.4580589037777452,0.2745731181313742,0.3535528596187175,0.3414869029275809,d4929d86-09c8-44e4-a9f4-4a355278fd1c,COMPLETE
713,713,0.3535528596187175,2021-10-14 15:35:43.821057,2021-10-14 15:35:44.179245,0 days 00:00:00.358188,goss,0.3534660993442935,0.11353569363418468,305,0.4639300395518868,0.2923671079655398,0.3535528596187175,0.3414869029275809,8a8ecfbe-4c54-41f7-8c32-8e8b646f051c,COMPLETE
714,714,0.3535528596187175,2021-10-14 15:35:44.182246,2021-10-14 15:35:44.560779,0 days 00:00:00.378533,goss,0.37102754377334435,0.1491381788027936,262,0.5005872455452393,0.24866563177891782,0.3535528596187175,0.3414869029275809,c19e6ad0-8e6e-4a67-8e06-0c3a3bae6fd8,COMPLETE
715,715,0.3535528596187175,2021-10-14 15:35:44.564774,2021-10-14 15:35:44.917771,0 days 00:00:00.352997,goss,0.3316953323543074,0.1488244774341378,269,0.47817668813479636,0.28389789892034334,0.3535528596187175,0.3414869029275809,0151dcc4-9be8-4b2e-9877-0cb6628408af,COMPLETE
716,716,0.3535528596187175,2021-10-14 15:35:44.919775,2021-10-14 15:35:45.278775,0 days 00:00:00.359000,goss,0.40416365037672675,0.11130867423573108,266,0.06521446350621873,0.9347164222791977,0.3535528596187175,0.3414869029275809,5c6fac8d-15c4-42d2-8913-0699509b848d,COMPLETE
717,717,0.3535528596187175,2021-10-14 15:35:45.281775,2021-10-14 15:35:45.639775,0 days 00:00:00.358000,goss,0.6005283181061644,0.12521519051189403,286,0.46060055239424913,0.26583070110100654,0.3535528596187175,0.3414869029275809,b5b5c37b-1a68-4341-8c7a-988adf934c14,COMPLETE
718,718,0.3535528596187175,2021-10-14 15:35:45.643775,2021-10-14 15:35:45.985773,0 days 00:00:00.341998,goss,0.39484747998183606,0.12649805429064412,254,0.08227660827596678,0.9149577158402085,0.3535528596187175,0.3414869029275809,12efe9e2-f18d-4a12-adf7-f891353eb9a7,COMPLETE
719,719,0.3535528596187175,2021-10-14 15:35:45.988775,2021-10-14 15:35:46.329778,0 days 00:00:00.341003,goss,0.6266170828408906,0.19772555451240745,285,0.412008205758393,0.24883762730470832,0.3535528596187175,0.3414869029275809,e7d99991-3e0a-4559-9c78-8549ad801446,COMPLETE
720,720,0.3535528596187175,2021-10-14 15:35:46.331774,2021-10-14 15:35:46.683776,0 days 00:00:00.352002,goss,0.59808004728283,0.0954126083563225,259,0.020969574438322924,0.8735928829022497,0.3535528596187175,0.3414869029275809,d400201c-523e-4bfd-bcdb-bb45b6253d71,COMPLETE
721,721,0.3535528596187175,2021-10-14 15:35:46.686782,2021-10-14 15:35:47.047775,0 days 00:00:00.360993,goss,0.6107086522224006,0.12281643826870252,306,0.02289265741938952,0.955994846716592,0.3535528596187175,0.3414869029275809,721c3fa0-3ddb-4e49-a4f7-a4d42ad075ce,COMPLETE
722,722,0.3535528596187175,2021-10-14 15:35:47.051775,2021-10-14 15:35:47.402775,0 days 00:00:00.351000,goss,0.3457845385673626,0.04847720590456257,275,0.08493454698478947,0.9148703343660665,0.3535528596187175,0.3414869029275809,33129bb0-1be8-4b9a-917c-a58802e40544,COMPLETE
723,723,0.3535528596187175,2021-10-14 15:35:47.405774,2021-10-14 15:35:47.738777,0 days 00:00:00.333003,goss,0.3950951633423119,0.04070646357750698,227,0.020951407429821822,0.9788562414372829,0.3535528596187175,0.3414869029275809,9a99c398-d3d3-47b9-9d23-8d7aa1ebc21d,COMPLETE
724,724,0.3535528596187175,2021-10-14 15:35:47.741773,2021-10-14 15:35:48.088609,0 days 00:00:00.346836,goss,0.6257389517131642,0.03371635472874457,200,0.005341829718169676,0.943490238057995,0.3535528596187175,0.3414869029275809,0fedecd2-705b-4a9f-a655-8f41178a410a,COMPLETE
725,725,0.3535528596187175,2021-10-14 15:35:48.091606,2021-10-14 15:35:48.447609,0 days 00:00:00.356003,goss,0.4684289639971773,0.15364133440539224,235,0.11327525442542558,0.8845076159821951,0.3535528596187175,0.3414869029275809,9f6a6169-a619-4a5f-9b10-b4ee922a2e10,COMPLETE
726,726,0.3535528596187175,2021-10-14 15:35:48.450606,2021-10-14 15:35:48.795607,0 days 00:00:00.345001,goss,0.3660793787403866,0.054695129517609124,207,0.09632159361035725,0.9034700349017145,0.3535528596187175,0.3414869029275809,16b89192-739e-4e9e-a74c-2619428183ad,COMPLETE
727,727,0.3535528596187175,2021-10-14 15:35:48.798603,2021-10-14 15:35:49.130613,0 days 00:00:00.332010,goss,0.4060793924400242,0.04006217241565779,178,0.03097297163359991,0.9678633849321236,0.3535528596187175,0.3414869029275809,d5059e1f-f495-4143-a728-2894926fd85b,COMPLETE
728,728,0.3535528596187175,2021-10-14 15:35:49.133605,2021-10-14 15:35:49.484607,0 days 00:00:00.351002,goss,0.34058337317974857,0.04929545541390524,244,0.3496114846027276,0.30486843186140383,0.3535528596187175,0.3414869029275809,868c5fe4-5059-4e9a-8566-455556c6613c,COMPLETE
729,729,0.3535528596187175,2021-10-14 15:35:49.487608,2021-10-14 15:35:49.844608,0 days 00:00:00.357000,goss,0.6040835053616488,0.05204734600626395,249,0.009073934278744256,0.9905959689671282,0.3535528596187175,0.3414869029275809,487f7153-eb9b-4742-9424-d10c0af60d3c,COMPLETE
730,730,0.3535528596187175,2021-10-14 15:35:49.847607,2021-10-14 15:35:50.225608,0 days 00:00:00.378001,goss,0.38735020033217904,0.06603797802855368,209,0.29067081250715093,0.33988528328747647,0.3535528596187175,0.3414869029275809,3b8b10ab-89c9-4b42-8d5e-fc1c698b3762,COMPLETE
731,731,0.3535528596187175,2021-10-14 15:35:50.228611,2021-10-14 15:35:50.684607,0 days 00:00:00.455996,goss,0.48386231401707797,0.08764933631814874,196,0.27567492811104277,0.31302421890161236,0.3535528596187175,0.3414869029275809,9f33ab5a-7e9a-435c-b6c0-bf3f7704f657,COMPLETE
732,732,0.3535528596187175,2021-10-14 15:35:50.687606,2021-10-14 15:35:51.062609,0 days 00:00:00.375003,goss,0.5880707821606135,0.09559806493994967,223,0.42136734694674627,0.3669740913370569,0.3535528596187175,0.3414869029275809,0f767a28-1770-4e57-853d-a72f47ac1f8d,COMPLETE
733,733,0.3535528596187175,2021-10-14 15:35:51.066609,2021-10-14 15:35:51.443751,0 days 00:00:00.377142,goss,0.5130825967162855,0.0841529201791169,235,0.43417668134583315,0.32500437894787004,0.3535528596187175,0.3414869029275809,f02a2ec4-aa9b-4f1a-ae6c-4e8764fe2f61,COMPLETE
734,734,0.3535528596187175,2021-10-14 15:35:51.448750,2021-10-14 15:35:51.806748,0 days 00:00:00.357998,goss,0.4584162175707686,0.0675195320045993,175,0.4357526717458731,0.3505633869768368,0.3535528596187175,0.3414869029275809,0a31067b-9a80-49a6-b0d3-a41a8eca6d64,COMPLETE
735,735,0.3535528596187175,2021-10-14 15:35:51.809749,2021-10-14 15:35:52.184750,0 days 00:00:00.375001,goss,0.4856202414748723,0.035000374807991244,213,0.4629219128821596,0.38098137961531514,0.3535528596187175,0.3414869029275809,5303a806-b7dc-45f7-8860-98dc9fec90f3,COMPLETE
736,736,0.3535528596187175,2021-10-14 15:35:52.187747,2021-10-14 15:35:52.546747,0 days 00:00:00.359000,goss,0.45273051283245525,0.042349093533538114,165,0.5012097777632226,0.41626704141730564,0.3535528596187175,0.3414869029275809,97b3bc6e-b22f-41c3-8cce-88523b9ae46c,COMPLETE
737,737,0.3535528596187175,2021-10-14 15:35:52.549749,2021-10-14 15:35:52.890750,0 days 00:00:00.341001,goss,0.4974388140854368,0.04795251615273512,184,0.03525407853106471,0.299966821455455,0.3535528596187175,0.3414869029275809,77269704-5ad6-45ff-927a-7a9f221ac0af,COMPLETE
738,738,0.3535528596187175,2021-10-14 15:35:52.893750,2021-10-14 15:35:53.244756,0 days 00:00:00.351006,goss,0.4439567078029799,0.027909406552990658,196,0.14847173838696318,0.8490900740840955,0.3535528596187175,0.3414869029275809,48dc0c9c-98c8-4a0a-babe-bddf1c601f1a,COMPLETE
739,739,0.3535528596187175,2021-10-14 15:35:53.247755,2021-10-14 15:35:53.596747,0 days 00:00:00.348992,goss,0.4185719647327802,0.057882639140497225,148,0.022828061819631252,0.8916350786760516,0.3535528596187175,0.3414869029275809,7f7bafea-cf7b-4b65-a5db-66266c0c30c2,COMPLETE
740,740,0.3535528596187175,2021-10-14 15:35:53.599745,2021-10-14 15:35:53.939747,0 days 00:00:00.340002,goss,0.5525980445459591,0.0441462594874353,212,0.09434574670929557,0.49504248749126456,0.3535528596187175,0.3414869029275809,11758079-42d2-42ec-9dfb-64ef666daa94,COMPLETE
741,741,0.3535528596187175,2021-10-14 15:35:53.942748,2021-10-14 15:35:54.289744,0 days 00:00:00.346996,goss,0.4766995859791327,0.05863199555926806,188,0.18693546649707532,0.42289788087711944,0.3535528596187175,0.3414869029275809,bf01d320-ccd1-475c-856b-41c993c8bf65,COMPLETE
742,742,0.3535528596187175,2021-10-14 15:35:54.292745,2021-10-14 15:35:54.639821,0 days 00:00:00.347076,goss,0.5275421150018722,0.05312831610758708,168,0.0468260909419568,0.5139825134098995,0.3535528596187175,0.3414869029275809,dee32845-87be-4519-9570-1ae3e1ca8b9d,COMPLETE
743,743,0.3535528596187175,2021-10-14 15:35:54.642824,2021-10-14 15:35:54.978971,0 days 00:00:00.336147,goss,0.43524803816258417,0.03448415757621024,221,0.1280712776679124,0.8661368818413355,0.3535528596187175,0.3414869029275809,6e7e97ce-5410-45cc-b933-d359612352f4,COMPLETE
744,744,0.3535528596187175,2021-10-14 15:35:54.981973,2021-10-14 15:35:55.341506,0 days 00:00:00.359533,goss,0.5103485676195051,0.07618898314290286,200,0.49497538944338465,0.49438418731932,0.3535528596187175,0.3414869029275809,f99ccb2f-a744-4917-b607-227d51b7a261,COMPLETE
745,745,0.3535528596187175,2021-10-14 15:35:55.344505,2021-10-14 15:35:55.737505,0 days 00:00:00.393000,goss,0.47168721662476576,0.09422363885387026,146,0.4889239179614688,0.4881285692609425,0.3535528596187175,0.3414869029275809,500106ee-46c4-4b83-bebf-d9448ec6b1c5,COMPLETE
746,746,0.3535528596187175,2021-10-14 15:35:55.741505,2021-10-14 15:35:56.133523,0 days 00:00:00.392018,goss,0.4665368514040393,0.0411075984176897,232,0.27573491500257885,0.4352785217175404,0.3535528596187175,0.3414869029275809,7dc6b614-a75c-4f0a-84d3-d854f69c71ee,COMPLETE
747,747,0.3535528596187175,2021-10-14 15:35:56.137521,2021-10-14 15:35:56.498529,0 days 00:00:00.361008,goss,0.5417749886684688,0.059938135344556095,155,0.4379061048980851,0.4656037224539343,0.3535528596187175,0.3414869029275809,e98e7e14-66c0-477c-94fe-be54b48bf2a9,COMPLETE
748,748,0.3535528596187175,2021-10-14 15:35:56.501526,2021-10-14 15:35:56.912526,0 days 00:00:00.411000,goss,0.5006892742246181,0.03004072728407081,135,0.21547085989185988,0.451968397393937,0.3535528596187175,0.3414869029275809,dfe3d89c-f986-4711-968a-5c6b7441b505,COMPLETE
749,749,0.3535528596187175,2021-10-14 15:35:56.915527,2021-10-14 15:35:57.323529,0 days 00:00:00.408002,goss,0.530398939685672,0.06697471580900195,121,0.0008752012315286798,0.4767490616004162,0.3535528596187175,0.3414869029275809,ff1ddda2-a252-440d-b198-c2d14f1abaf1,COMPLETE
750,750,0.3535528596187175,2021-10-14 15:35:57.329524,2021-10-14 15:35:57.714495,0 days 00:00:00.384971,goss,0.5603413740169675,0.035191142254110214,170,0.16420290422174796,0.4002021948746787,0.3535528596187175,0.3414869029275809,2c3a597c-7c2a-4fa9-a791-97fc729c2591,COMPLETE
751,751,0.3535528596187175,2021-10-14 15:35:57.718494,2021-10-14 15:35:58.233488,0 days 00:00:00.514994,goss,0.5087089830847487,0.036971954115220036,180,0.45708517275705673,0.38910030247387883,0.3535528596187175,0.3414869029275809,5f2c0ab5-faaa-473b-9de8-ad0a601b420f,COMPLETE
