,number,value,datetime_start,datetime_complete,duration,params_boosting,params_feature_fraction,params_learning_rate,params_num_leaves,params_other_rate,params_top_rate,user_attrs_test_error,user_attrs_train_error,user_attrs_uuid,state
166,166,0.3535528596187175,2021-10-14 15:32:31.030381,2021-10-14 15:32:31.371385,0 days 00:00:00.341004,goss,0.0920527235158968,0.004909222433986501,737,0.13952104466539395,0.5988667673531005,0.3535528596187175,0.3414869029275809,0bb3ffb8-5a5d-4c05-a3d3-43a6261ff5e3,COMPLETE
167,167,0.3535528596187175,2021-10-14 15:32:31.373386,2021-10-14 15:32:31.653386,0 days 00:00:00.280000,goss,0.5064175259867945,0.008183369135778825,108,0.1091073747191591,0.6800291852473421,0.3535528596187175,0.3414869029275809,20c9dc0d-5870-4708-926f-02b8f62d46f1,COMPLETE
168,168,0.3535528596187175,2021-10-14 15:32:31.655381,2021-10-14 15:32:31.928386,0 days 00:00:00.273005,goss,0.11981463036654494,0.005071334054575124,28,0.3761164814064143,0.5315904308041016,0.3535528596187175,0.3414869029275809,474ca0a1-e0a2-4821-a2b1-af1772b588f5,COMPLETE
169,169,0.3535528596187175,2021-10-14 15:32:31.930384,2021-10-14 15:32:32.234384,0 days 00:00:00.304000,goss,0.02258101326409261,0.013940848989228522,687,0.1622636635258445,0.7342799005858486,0.3535528596187175,0.3414869029275809,d0b3fe2f-1cdd-4b17-b7ba-a7f634596d6e,COMPLETE
170,170,0.3535528596187175,2021-10-14 15:32:32.237380,2021-10-14 15:32:32.572383,0 days 00:00:00.335003,gbdt,0.07099563302568873,0.00574095354571157,746,,,0.3535528596187175,0.3414869029275809,90160a63-8f60-4fed-85fa-352fa8b4d8d9,COMPLETE
171,171,0.3535528596187175,2021-10-14 15:32:32.574384,2021-10-14 15:32:32.861385,0 days 00:00:00.287001,gbdt,0.12387114485994595,0.007623527851374221,779,,,0.3535528596187175,0.3414869029275809,b972866b-bec4-4464-a0c0-879db5bd42f3,COMPLETE
172,172,0.3535528596187175,2021-10-14 15:32:32.863380,2021-10-14 15:32:33.139917,0 days 00:00:00.276537,gbdt,0.15394467987157812,0.003344612411878536,759,,,0.3535528596187175,0.3414869029275809,ccc1398b-16e3-4669-ab5b-39155c53dcd5,COMPLETE
173,173,0.3535528596187175,2021-10-14 15:32:33.141918,2021-10-14 15:32:33.410914,0 days 00:00:00.268996,gbdt,0.05565987522909825,0.0042172768160356365,717,,,0.3535528596187175,0.3414869029275809,6f956eae-f265-41c6-909f-6d186e6b4995,COMPLETE
174,174,0.3535528596187175,2021-10-14 15:32:33.413917,2021-10-14 15:32:33.717551,0 days 00:00:00.303634,gbdt,0.009381605928420161,0.0021617867237777085,791,,,0.3535528596187175,0.3414869029275809,31322d89-666d-4578-a0e0-bfd43b01dc76,COMPLETE
175,175,0.3535528596187175,2021-10-14 15:32:33.719554,2021-10-14 15:32:34.023552,0 days 00:00:00.303998,gbdt,0.03878274800574258,0.006084479302799682,834,,,0.3535528596187175,0.3414869029275809,93eb8dc5-9661-4235-b3ef-85116f674fa6,COMPLETE
176,176,0.3535528596187175,2021-10-14 15:32:34.026558,2021-10-14 15:32:34.363082,0 days 00:00:00.336524,gbdt,0.08502884595041774,0.0024512855369774704,896,,,0.3535528596187175,0.3414869029275809,c176d21b-9b6c-4562-9e7d-18161da00b31,COMPLETE
177,177,0.3535528596187175,2021-10-14 15:32:34.365085,2021-10-14 15:32:34.690019,0 days 00:00:00.324934,gbdt,0.0026238657106547308,0.0014186787879576562,679,,,0.3535528596187175,0.3414869029275809,c4d41c03-3900-4b4a-80af-c9c8ddd8857e,COMPLETE
178,178,0.3535528596187175,2021-10-14 15:32:34.693018,2021-10-14 15:32:35.004017,0 days 00:00:00.310999,gbdt,0.10819835895644253,0.01856061686392433,842,,,0.3535528596187175,0.3414869029275809,da4bb49f-1247-42b5-bb72-286682b56e9f,COMPLETE
179,179,0.3535528596187175,2021-10-14 15:32:35.008019,2021-10-14 15:32:35.316548,0 days 00:00:00.308529,gbdt,0.17627225421293882,0.011842490107871131,916,,,0.3535528596187175,0.3414869029275809,189b8961-d774-4015-a8f5-538391c98bb9,COMPLETE
180,180,0.3535528596187175,2021-10-14 15:32:35.318547,2021-10-14 15:32:35.643094,0 days 00:00:00.324547,gbdt,0.050025441876542176,0.0014063689297401768,880,,,0.3535528596187175,0.3414869029275809,9bb52043-5e7a-4d3b-b820-800db1f3debc,COMPLETE
181,181,0.3535528596187175,2021-10-14 15:32:35.645089,2021-10-14 15:32:35.955090,0 days 00:00:00.310001,gbdt,0.20248533891841142,0.002518212532172895,827,,,0.3535528596187175,0.3414869029275809,420938a8-fcf7-4fac-846e-07b665d42470,COMPLETE
182,182,0.3535528596187175,2021-10-14 15:32:35.958090,2021-10-14 15:32:36.248090,0 days 00:00:00.290000,gbdt,0.2187862249583304,0.03594532247861392,865,,,0.3535528596187175,0.3414869029275809,1c6d89dd-efb8-4e0a-a925-edf875a37b78,COMPLETE
183,183,0.3535528596187175,2021-10-14 15:32:36.251093,2021-10-14 15:32:36.586172,0 days 00:00:00.335079,gbdt,0.15310124030264322,0.0011960954678532224,861,,,0.3535528596187175,0.3414869029275809,d38f48b1-cf37-4782-9d17-1d94415afd15,COMPLETE
184,184,0.3535528596187175,2021-10-14 15:32:36.589172,2021-10-14 15:32:36.845171,0 days 00:00:00.255999,gbdt,0.17701242327958722,0.0018528304118938987,615,,,0.3535528596187175,0.3414869029275809,9284d360-74c6-423e-a8ac-eed082d545bd,COMPLETE
185,185,0.3535528596187175,2021-10-14 15:32:36.848172,2021-10-14 15:32:37.153174,0 days 00:00:00.305002,gbdt,0.23139187112255308,0.000844746825287123,799,,,0.3535528596187175,0.3414869029275809,3db652ea-b3b3-41f4-8a40-1eaad51aa98e,COMPLETE
186,186,0.3535528596187175,2021-10-14 15:32:37.155174,2021-10-14 15:32:37.467257,0 days 00:00:00.312083,gbdt,0.9710285327955265,0.0011247202711002096,922,,,0.3535528596187175,0.3414869029275809,b94049e0-f862-4adf-93bd-ef6b324f7a53,COMPLETE
187,187,0.3535528596187175,2021-10-14 15:32:37.470262,2021-10-14 15:32:37.730244,0 days 00:00:00.259982,gbdt,0.9339663051931342,0.0014246367528677327,629,,,0.3535528596187175,0.3414869029275809,42633172-aeb7-4758-9335-0b4f518f0596,COMPLETE
188,188,0.3535528596187175,2021-10-14 15:32:37.733248,2021-10-14 15:32:38.034249,0 days 00:00:00.301001,gbdt,0.9388686021210576,0.00014509018847223913,822,,,0.3535528596187175,0.3414869029275809,eec95180-d4fd-46d3-a24d-046919e9ff91,COMPLETE
189,189,0.3535528596187175,2021-10-14 15:32:38.037253,2021-10-14 15:32:38.378248,0 days 00:00:00.340995,gbdt,0.26055196104159783,0.0009610153557538746,568,,,0.3535528596187175,0.3414869029275809,741d788a-578d-4948-b142-320a922dd2e4,COMPLETE
190,190,0.3535528596187175,2021-10-14 15:32:38.380250,2021-10-14 15:32:38.732252,0 days 00:00:00.352002,gbdt,0.9175957844535549,0.0006854760762427227,979,,,0.3535528596187175,0.3414869029275809,e775fa3d-1855-495d-96c9-e732cab0b398,COMPLETE
191,191,0.3535528596187175,2021-10-14 15:32:38.734247,2021-10-14 15:32:39.027249,0 days 00:00:00.293002,gbdt,0.13929220374439558,0.0009736313448487201,924,,,0.3535528596187175,0.3414869029275809,c775c0da-2906-4a96-9ea0-e70846cd8152,COMPLETE
192,192,0.3535528596187175,2021-10-14 15:32:39.029248,2021-10-14 15:32:39.347252,0 days 00:00:00.318004,gbdt,0.919276108121993,0.000641231892662054,540,,,0.3535528596187175,0.3414869029275809,a452738d-e7cf-4e16-a78c-db5768da9e1e,COMPLETE
193,193,0.3535528596187175,2021-10-14 15:32:39.349246,2021-10-14 15:32:39.733249,0 days 00:00:00.384003,gbdt,0.8808647384880006,0.0035152543429455736,595,,,0.3535528596187175,0.3414869029275809,ceffffef-e445-4054-8f72-c567ceffd311,COMPLETE
194,194,0.3535528596187175,2021-10-14 15:32:39.736246,2021-10-14 15:32:40.187251,0 days 00:00:00.451005,gbdt,0.8389559649172077,0.00013593726479584512,980,,,0.3535528596187175,0.3414869029275809,311921ad-c93c-4ec7-b6ff-f9f5dd0d4002,COMPLETE
195,195,0.3535528596187175,2021-10-14 15:32:40.190253,2021-10-14 15:32:40.556980,0 days 00:00:00.366727,gbdt,0.9770970102150527,0.00025240844033536656,902,,,0.3535528596187175,0.3414869029275809,8b3edd67-b41f-4cb8-9031-e2322c2e04f5,COMPLETE
196,196,0.3535528596187175,2021-10-14 15:32:40.559981,2021-10-14 15:32:40.896984,0 days 00:00:00.337003,gbdt,0.8667767524616626,0.00012400552071335132,490,,,0.3535528596187175,0.3414869029275809,665c6b4f-a194-4261-937d-d7a9687345e6,COMPLETE
197,197,0.3535528596187175,2021-10-14 15:32:40.899980,2021-10-14 15:32:41.198618,0 days 00:00:00.298638,gbdt,0.8865433925185897,0.0008244521904281306,474,,,0.3535528596187175,0.3414869029275809,4bb531b8-97fe-4124-83ff-5818939b43dc,COMPLETE
198,198,0.3535528596187175,2021-10-14 15:32:41.200629,2021-10-14 15:32:41.542156,0 days 00:00:00.341527,gbdt,0.9505904068385487,0.0005862667935128351,944,,,0.3535528596187175,0.3414869029275809,257d293b-00fb-41f5-97c3-91ae78ca0e2c,COMPLETE
199,199,0.3535528596187175,2021-10-14 15:32:41.544158,2021-10-14 15:32:41.874155,0 days 00:00:00.329997,gbdt,0.8625853968158061,0.0004045921241389093,999,,,0.3535528596187175,0.3414869029275809,99124f7c-e5dc-4e1d-bc20-a3cbdf977d7e,COMPLETE
200,200,0.3535528596187175,2021-10-14 15:32:41.876154,2021-10-14 15:32:42.227061,0 days 00:00:00.350907,gbdt,0.8242903222633899,0.0004900401912477387,970,,,0.3535528596187175,0.3414869029275809,b17c2e05-b834-4ca6-9092-bc6d9de27424,COMPLETE
201,201,0.3535528596187175,2021-10-14 15:32:42.230055,2021-10-14 15:32:42.546131,0 days 00:00:00.316076,gbdt,0.9098688479883331,0.0003188295948164489,502,,,0.3535528596187175,0.3414869029275809,42f3e566-75c9-47e7-af63-3cf9df3e7a0a,COMPLETE
202,202,0.3535528596187175,2021-10-14 15:32:42.548133,2021-10-14 15:32:42.833134,0 days 00:00:00.285001,gbdt,0.9420587561577466,0.0001593690803987391,464,,,0.3535528596187175,0.3414869029275809,d32a7078-dc68-4aba-9a47-513f70835c68,COMPLETE
203,203,0.3535528596187175,2021-10-14 15:32:42.835131,2021-10-14 15:32:43.137201,0 days 00:00:00.302070,gbdt,0.7593547214537075,0.00010002078535554916,537,,,0.3535528596187175,0.3414869029275809,0406102d-bf27-4748-9825-bd6226349a61,COMPLETE
204,204,0.3535528596187175,2021-10-14 15:32:43.139197,2021-10-14 15:32:43.435201,0 days 00:00:00.296004,gbdt,0.795962117393324,0.00022443354901819396,455,,,0.3535528596187175,0.3414869029275809,45ee9201-382e-464e-92f8-e1625c5993b9,COMPLETE
205,205,0.3535528596187175,2021-10-14 15:32:43.438231,2021-10-14 15:32:43.722202,0 days 00:00:00.283971,gbdt,0.7357343885697942,0.000358225590294652,409,,,0.3535528596187175,0.3414869029275809,37c78d86-b4c3-45a8-9b88-9f745cf234e8,COMPLETE
206,206,0.3535528596187175,2021-10-14 15:32:43.724200,2021-10-14 15:32:44.050204,0 days 00:00:00.326004,goss,0.805953908256382,0.0004455336785756941,429,0.5208272151616491,0.1475779028626917,0.3535528596187175,0.3414869029275809,5b527443-0659-4fa8-9cb3-b0c5bc406b77,COMPLETE
207,207,0.3535528596187175,2021-10-14 15:32:44.052201,2021-10-14 15:32:44.424199,0 days 00:00:00.371998,goss,0.8481608538748113,0.0002831848833792482,970,0.5694321160262483,0.17025038498507802,0.3535528596187175,0.3414869029275809,ac3a077b-313b-4e8c-8ffa-d7de2a40ae78,COMPLETE
208,208,0.3535528596187175,2021-10-14 15:32:44.427199,2021-10-14 15:32:44.768203,0 days 00:00:00.341004,goss,0.7017861452957247,0.00022110947238084913,375,0.4523395203107721,0.22431760991092792,0.3535528596187175,0.3414869029275809,f6fab97f-2b10-4089-be41-72330fd76046,COMPLETE
209,209,0.3535528596187175,2021-10-14 15:32:44.771203,2021-10-14 15:32:45.078409,0 days 00:00:00.307206,goss,0.7718314918502385,0.00011883762146447892,430,0.47266422840424965,0.2915836695569045,0.3535528596187175,0.3414869029275809,371beebf-1fb4-40ec-ae84-46b37b9eaa08,COMPLETE
210,210,0.3535528596187175,2021-10-14 15:32:45.081414,2021-10-14 15:32:45.392940,0 days 00:00:00.311526,goss,0.6355873077142437,0.00017641431404975585,494,0.49505214926995866,0.24237922134809622,0.3535528596187175,0.3414869029275809,af512d5e-ecd2-4e3b-a050-34e0e709cb77,COMPLETE
211,211,0.3535528596187175,2021-10-14 15:32:45.394938,2021-10-14 15:32:45.681940,0 days 00:00:00.287002,goss,0.28568044591649727,0.31235793570003456,335,0.48738668225946163,0.1784526886550714,0.3535528596187175,0.3414869029275809,6723ef3f-c37c-44e5-bb85-07f0a51df081,COMPLETE
212,212,0.3535528596187175,2021-10-14 15:32:45.683939,2021-10-14 15:32:45.972939,0 days 00:00:00.289000,goss,0.6804009868217431,0.0003453252736775312,303,0.40000800210540083,0.19818015395586244,0.3535528596187175,0.3414869029275809,26f6f446-49a8-4aa1-8dbe-623a5e2c64b9,COMPLETE
213,213,0.3535528596187175,2021-10-14 15:32:45.974937,2021-10-14 15:32:46.262940,0 days 00:00:00.288003,goss,0.2943697714032546,0.0004220075613746626,366,0.44329663677834374,0.28930141187068686,0.3535528596187175,0.3414869029275809,f390775b-667d-41c2-9239-3b5eb4cffea6,COMPLETE
214,214,0.3535528596187175,2021-10-14 15:32:46.264939,2021-10-14 15:32:46.547936,0 days 00:00:00.282997,goss,0.7134578045313266,0.15891837936527717,336,0.4693882399540591,0.2550685386129803,0.3535528596187175,0.3414869029275809,2731d936-3ff6-46a9-b6d4-68cc77230c92,COMPLETE
215,215,0.3535528596187175,2021-10-14 15:32:46.549941,2021-10-14 15:32:46.846231,0 days 00:00:00.296290,goss,0.7528212768003386,0.0002900688122612286,350,0.3563521532266203,0.24144587221617939,0.3535528596187175,0.3414869029275809,909b86c5-7180-485b-8f19-8ab6d7b2bae1,COMPLETE
216,216,0.3535528596187175,2021-10-14 15:32:46.848230,2021-10-14 15:32:47.154299,0 days 00:00:00.306069,goss,0.35348985674822236,0.07770549720064455,386,0.46062191030727895,0.33000506267694124,0.3535528596187175,0.3414869029275809,8b00dafc-7e4a-4f38-afaf-5381c1855854,COMPLETE
217,217,0.3535528596187175,2021-10-14 15:32:47.156297,2021-10-14 15:32:47.453304,0 days 00:00:00.297007,goss,0.8193607182367291,0.08619251573998929,391,0.5318965523445598,0.22478656717025194,0.3535528596187175,0.3414869029275809,61339082-64b5-4281-bf4e-d1fa2d1b28e5,COMPLETE
218,218,0.3535528596187175,2021-10-14 15:32:47.455298,2021-10-14 15:32:47.791296,0 days 00:00:00.335998,goss,0.3262790721157165,0.06316829336374306,315,0.4125076851026527,0.2607837975710483,0.3535528596187175,0.3414869029275809,707e6e17-030c-48a3-b774-60029746455e,COMPLETE
219,219,0.3535528596187175,2021-10-14 15:32:47.793296,2021-10-14 15:32:48.089297,0 days 00:00:00.296001,goss,0.35400471485453955,0.10715581573627371,286,0.21413476521405525,0.27640284631258843,0.3535528596187175,0.3414869029275809,cc137607-5b24-41ea-a745-efc6cccb31a8,COMPLETE
220,220,0.3535528596187175,2021-10-14 15:32:48.092296,2021-10-14 15:32:48.391301,0 days 00:00:00.299005,goss,0.4383771777289213,0.067808567471248,180,0.4390910388869918,0.483620179737051,0.3535528596187175,0.3414869029275809,a0251d8a-2962-4127-a319-9efb7de9c7a1,COMPLETE
221,221,0.3535528596187175,2021-10-14 15:32:48.393298,2021-10-14 15:32:48.719969,0 days 00:00:00.326671,goss,0.37197522901284386,0.11873832445645838,186,0.2739749307194876,0.44323746241595485,0.3535528596187175,0.3414869029275809,ea076cc6-1e70-4dd5-9961-c516be90510e,COMPLETE
222,222,0.3535528596187175,2021-10-14 15:32:48.721969,2021-10-14 15:32:49.045506,0 days 00:00:00.323537,goss,0.3937022489708517,0.2210781392922735,161,0.04553302009836155,0.3313735984383839,0.3535528596187175,0.3414869029275809,fb74dd25-c828-448f-b8c1-0345993c0324,COMPLETE
223,223,0.3535528596187175,2021-10-14 15:32:49.048512,2021-10-14 15:32:49.357508,0 days 00:00:00.308996,goss,0.4792162815428442,0.049482401347895714,247,0.192843037876683,0.3055119784432416,0.3535528596187175,0.3414869029275809,abc30c16-000f-4b88-a50a-a5a2fb25f671,COMPLETE
224,224,0.3535528596187175,2021-10-14 15:32:49.360508,2021-10-14 15:32:49.691046,0 days 00:00:00.330538,goss,0.383839937247589,0.15609505070131863,240,0.02949665102288122,0.358694473771744,0.3535528596187175,0.3414869029275809,4f77386c-22f3-4a89-9e1b-4ea4b1109321,COMPLETE
225,225,0.3535528596187175,2021-10-14 15:32:49.694048,2021-10-14 15:32:49.987049,0 days 00:00:00.293001,goss,0.615687392843064,0.25517896260219625,148,0.5028664473849863,0.46930634953877176,0.3535528596187175,0.3414869029275809,042ff4a8-56c4-4a8b-b158-183c8a469443,COMPLETE
226,226,0.3535528596187175,2021-10-14 15:32:49.990046,2021-10-14 15:32:50.273046,0 days 00:00:00.283000,goss,0.5616088931644284,0.049838920526312995,233,0.4805908222708203,0.5129668368761128,0.3535528596187175,0.3414869029275809,65fb051c-9486-4f42-8ea4-4a95b7ecf9cb,COMPLETE
227,227,0.3535528596187175,2021-10-14 15:32:50.275044,2021-10-14 15:32:50.578043,0 days 00:00:00.302999,goss,0.41544075191284896,0.3920270171104183,261,0.4234122358632212,0.5756989154958588,0.3535528596187175,0.3414869029275809,a5678f3d-4933-4909-8ce0-66ce5148017e,COMPLETE
228,228,0.3535528596187175,2021-10-14 15:32:50.580050,2021-10-14 15:32:50.868117,0 days 00:00:00.288067,goss,0.5193114435998353,0.14173679880550757,285,0.018295650392200616,0.5587872637745788,0.3535528596187175,0.3414869029275809,26ec7730-c1d3-4633-950f-04b62d363f2b,COMPLETE
229,229,0.3535528596187175,2021-10-14 15:32:50.871119,2021-10-14 15:32:51.220118,0 days 00:00:00.348999,goss,0.45417962290606406,0.11501393449711064,267,0.3907289293697963,0.5978752685015823,0.3535528596187175,0.3414869029275809,23222b2b-ee66-4837-95ba-1eaca0f27ac2,COMPLETE
230,230,0.3535528596187175,2021-10-14 15:32:51.222120,2021-10-14 15:32:51.539121,0 days 00:00:00.317001,goss,0.5830891330430652,0.0739859641535412,92,0.09228484517402077,0.3223162203858872,0.3535528596187175,0.3414869029275809,0d12c6af-9eea-4b4a-aac4-dad7d0103e83,COMPLETE
231,231,0.3535528596187175,2021-10-14 15:32:51.541117,2021-10-14 15:32:51.850121,0 days 00:00:00.309004,goss,0.49550995506451856,0.09186992171109133,59,0.39514139258408004,0.5341533161709495,0.3535528596187175,0.3414869029275809,7d97bedf-32a7-4e83-ab9b-77090e38439e,COMPLETE
232,232,0.3535528596187175,2021-10-14 15:32:51.852117,2021-10-14 15:32:52.188120,0 days 00:00:00.336003,goss,0.07793707930685982,0.5221738801765003,129,0.12374180899698073,0.5643492647226321,0.3535528596187175,0.3414869029275809,faf206e1-4b16-4a89-a681-0d41b4838e6d,COMPLETE
233,233,0.3535528596187175,2021-10-14 15:32:52.192124,2021-10-14 15:32:52.508124,0 days 00:00:00.316000,goss,0.34341847279728,0.0584858312547977,356,0.09466825820061393,0.7020005554807691,0.3535528596187175,0.3414869029275809,4320817f-1b8c-4a77-ac1c-1758b527deb6,COMPLETE
234,234,0.3535528596187175,2021-10-14 15:32:52.512120,2021-10-14 15:32:52.813122,0 days 00:00:00.301002,goss,0.06181549796373019,0.01438657804387067,214,0.4467254801073825,0.5387080400781751,0.3535528596187175,0.3414869029275809,c734b376-a0b7-473c-9650-ce0e9083dbaa,COMPLETE
235,235,0.3535528596187175,2021-10-14 15:32:52.816119,2021-10-14 15:32:53.161123,0 days 00:00:00.345004,goss,0.075162975912548,0.0072456791772955095,751,0.4690154375914719,0.5235338129753089,0.3535528596187175,0.3414869029275809,529574a6-5b8a-4a0f-8993-a11daee826cf,COMPLETE
236,236,0.3535528596187175,2021-10-14 15:32:53.164122,2021-10-14 15:32:53.525215,0 days 00:00:00.361093,goss,0.1173785022026895,0.00563256026901916,770,0.1318924639309154,0.4940284994372121,0.3535528596187175,0.3414869029275809,3299c453-4d06-49b6-8b97-b451b1f44e15,COMPLETE
237,237,0.3535528596187175,2021-10-14 15:32:53.528217,2021-10-14 15:32:53.861219,0 days 00:00:00.333002,goss,0.11120521016110962,0.005066548789373878,761,0.10229669737346805,0.6111778920760864,0.3535528596187175,0.3414869029275809,6b7eb3db-33b4-4aca-8b7c-54d796a268a9,COMPLETE
238,238,0.3535528596187175,2021-10-14 15:32:53.863214,2021-10-14 15:32:54.194219,0 days 00:00:00.331005,goss,0.06718321751789855,0.004239084321124821,708,0.5220239315613803,0.46490509084552584,0.3535528596187175,0.3414869029275809,8e9d7f4b-1377-46aa-ab80-bb460cb3b52b,COMPLETE
239,239,0.3535528596187175,2021-10-14 15:32:54.196227,2021-10-14 15:32:54.513219,0 days 00:00:00.316992,goss,0.4202115430763437,0.008127727796622979,29,0.12326038244913681,0.7272763484012259,0.3535528596187175,0.3414869029275809,d874eacc-796d-459d-aec7-8f005fc5f136,COMPLETE
240,240,0.3535528596187175,2021-10-14 15:32:54.515217,2021-10-14 15:32:54.873219,0 days 00:00:00.358002,goss,0.03280808597689645,0.00964540524175402,698,0.3216643102609229,0.6777666042608953,0.3535528596187175,0.3414869029275809,2add506d-93f1-466c-9ccd-8a73784d3892,COMPLETE
241,241,0.3535528596187175,2021-10-14 15:32:54.875223,2021-10-14 15:32:55.221758,0 days 00:00:00.346535,goss,0.024378913044697845,0.0070392275015476215,780,0.21617583829109074,0.40691552093715433,0.3535528596187175,0.3414869029275809,68c839eb-38bc-4a17-b6f4-120acee251f4,COMPLETE
242,242,0.3535528596187175,2021-10-14 15:32:55.227757,2021-10-14 15:32:55.580761,0 days 00:00:00.353004,goss,0.051039666845386904,0.005521011311630125,10,0.25973599467735686,0.44146508896533915,0.3535528596187175,0.3414869029275809,3f397000-863c-4e13-b230-30f9d0b5a97a,COMPLETE
243,243,0.3535528596187175,2021-10-14 15:32:55.583762,2021-10-14 15:32:55.958876,0 days 00:00:00.375114,goss,0.015285435916334078,0.004415733054808043,717,0.35814872735067776,0.5800327343381233,0.3535528596187175,0.3414869029275809,854a6df8-cdfc-4030-8066-543bc6dda16d,COMPLETE
244,244,0.3535528596187175,2021-10-14 15:32:55.963891,2021-10-14 15:32:56.428950,0 days 00:00:00.465059,goss,0.0007743946086856725,0.017470494512282407,685,0.11735798132825771,0.7558695771709444,0.3535528596187175,0.3414869029275809,5acb3f68-5bc6-4460-8740-6695033ab48a,COMPLETE
245,245,0.3535528596187175,2021-10-14 15:32:56.430950,2021-10-14 15:32:56.831949,0 days 00:00:00.400999,goss,0.07964966630086098,0.043121375843789535,735,0.2197578170045935,0.7785926451320592,0.3535528596187175,0.3414869029275809,2da80867-86c7-4ebb-9d35-b6152311d07f,COMPLETE
246,246,0.3535528596187175,2021-10-14 15:32:56.833948,2021-10-14 15:32:57.116042,0 days 00:00:00.282094,goss,0.09557697866531559,0.011347740143644985,89,0.15200070386096215,0.629272104927056,0.3535528596187175,0.3414869029275809,7ef51d84-5dcc-4671-8c9c-2d72f321a9ef,COMPLETE
247,247,0.3535528596187175,2021-10-14 15:32:57.118040,2021-10-14 15:32:57.452580,0 days 00:00:00.334540,goss,0.09710858611569234,0.01334790378884226,753,0.09275592471058011,0.6522525425819663,0.3535528596187175,0.3414869029275809,b9b938e6-71e7-4398-ade7-ef0e7ae7f217,COMPLETE
248,248,0.3535528596187175,2021-10-14 15:32:57.455582,2021-10-14 15:32:57.765145,0 days 00:00:00.309563,gbdt,0.0545693445432396,0.0020960077646146407,883,,,0.3535528596187175,0.3414869029275809,b2c7509e-a3d7-4f74-907b-f9b3b32fd70f,COMPLETE
