,number,value,datetime_start,datetime_complete,duration,params_boosting,params_feature_fraction,params_learning_rate,params_num_leaves,params_other_rate,params_top_rate,user_attrs_test_error,user_attrs_train_error,user_attrs_uuid,state
831,831,0.3535528596187175,2021-10-14 15:36:34.591572,2021-10-14 15:36:34.991575,0 days 00:00:00.400003,gbdt,0.16490501707484864,0.0018802682517424167,849,,,0.3535528596187175,0.3414869029275809,76acb6f4-1e84-42ec-baa2-ede3de1f2f29,COMPLETE
832,832,0.3535528596187175,2021-10-14 15:36:34.995577,2021-10-14 15:36:35.375766,0 days 00:00:00.380189,gbdt,0.16466209075679586,0.0019233634998065752,638,,,0.3535528596187175,0.3414869029275809,d75f5419-7821-42a6-97d4-3569d83c28f8,COMPLETE
833,833,0.3535528596187175,2021-10-14 15:36:35.378764,2021-10-14 15:36:35.776764,0 days 00:00:00.398000,gbdt,0.17430749534123177,0.0024847871888995002,862,,,0.3535528596187175,0.3414869029275809,5c335192-5cb5-4d9f-a9a7-7a4be30f7ab3,COMPLETE
834,834,0.3535528596187175,2021-10-14 15:36:35.779764,2021-10-14 15:36:36.143302,0 days 00:00:00.363538,gbdt,0.16376103768367195,0.0018862139368447564,856,,,0.3535528596187175,0.3414869029275809,a06a6339-36c7-43cb-8ec3-0d38620e7bec,COMPLETE
835,835,0.3535528596187175,2021-10-14 15:36:36.146301,2021-10-14 15:36:36.533297,0 days 00:00:00.386996,gbdt,0.17615129388969988,0.002203984421812095,852,,,0.3535528596187175,0.3414869029275809,ca93b26b-0cb9-4d57-a4a3-c063c2b7d94b,COMPLETE
836,836,0.3535528596187175,2021-10-14 15:36:36.537296,2021-10-14 15:36:36.916297,0 days 00:00:00.379001,gbdt,0.2079531642023673,0.002564454772939691,838,,,0.3535528596187175,0.3414869029275809,e4ccdac5-9854-4a93-afaf-39d505a1733f,COMPLETE
837,837,0.3535528596187175,2021-10-14 15:36:36.921297,2021-10-14 15:36:37.278028,0 days 00:00:00.356731,gbdt,0.18018144256434726,0.0022140932475242774,877,,,0.3535528596187175,0.3414869029275809,829049b7-6fa0-4944-9a89-08d88f368110,COMPLETE
838,838,0.3535528596187175,2021-10-14 15:36:37.282029,2021-10-14 15:36:37.644031,0 days 00:00:00.362002,gbdt,0.21096460294163102,0.0018632599559336518,881,,,0.3535528596187175,0.3414869029275809,1b44ca61-0e60-45d3-a07f-e2abed26f161,COMPLETE
839,839,0.3535528596187175,2021-10-14 15:36:37.647032,2021-10-14 15:36:38.022028,0 days 00:00:00.374996,gbdt,0.2208086976544332,0.0025659238760656284,862,,,0.3535528596187175,0.3414869029275809,d588af03-734d-4342-b86c-c74f372848e0,COMPLETE
840,840,0.3535528596187175,2021-10-14 15:36:38.027027,2021-10-14 15:36:38.428180,0 days 00:00:00.401153,gbdt,0.19716226429995934,0.0017464329277020968,831,,,0.3535528596187175,0.3414869029275809,ea02702e-a385-45fc-bfae-804e76b4e7aa,COMPLETE
841,841,0.3535528596187175,2021-10-14 15:36:38.431178,2021-10-14 15:36:38.815172,0 days 00:00:00.383994,gbdt,0.19175986339665557,0.0022779001960489156,877,,,0.3535528596187175,0.3414869029275809,afc25572-2f88-4cb5-b187-3ec6ac28a6b7,COMPLETE
842,842,0.3535528596187175,2021-10-14 15:36:38.818175,2021-10-14 15:36:39.211373,0 days 00:00:00.393198,gbdt,0.21650406259579802,0.0021624059133272078,878,,,0.3535528596187175,0.3414869029275809,aa4149af-8149-4340-b1be-5e58dc08dd25,COMPLETE
843,843,0.3535528596187175,2021-10-14 15:36:39.214373,2021-10-14 15:36:39.598372,0 days 00:00:00.383999,gbdt,0.17902608295926828,0.002708198081810454,864,,,0.3535528596187175,0.3414869029275809,7aeb8bef-dd68-4553-ade9-2bc425d46dea,COMPLETE
844,844,0.3535528596187175,2021-10-14 15:36:39.601370,2021-10-14 15:36:39.976453,0 days 00:00:00.375083,gbdt,0.2396268633387063,0.0017306535631318295,882,,,0.3535528596187175,0.3414869029275809,20bee20f-1bb7-4c0e-9ff8-4f509c5e13aa,COMPLETE
845,845,0.3535528596187175,2021-10-14 15:36:39.980449,2021-10-14 15:36:40.378446,0 days 00:00:00.397997,gbdt,0.2266647190211109,0.0029380146946158094,861,,,0.3535528596187175,0.3414869029275809,5f503486-340e-4106-8ad8-8e8c12c25cb3,COMPLETE
846,846,0.3535528596187175,2021-10-14 15:36:40.381448,2021-10-14 15:36:40.767446,0 days 00:00:00.385998,gbdt,0.24243381787472276,0.0023250121741587634,637,,,0.3535528596187175,0.3414869029275809,327f8391-a54f-4cf5-8be3-e1fa80323efd,COMPLETE
847,847,0.3535528596187175,2021-10-14 15:36:40.770445,2021-10-14 15:36:41.138447,0 days 00:00:00.368002,gbdt,0.2494134683767904,0.0023400543882962084,879,,,0.3535528596187175,0.3414869029275809,a740831f-fddc-4718-9f0d-c7ae34fdb3a4,COMPLETE
848,848,0.3535528596187175,2021-10-14 15:36:41.141442,2021-10-14 15:36:41.535561,0 days 00:00:00.394119,gbdt,0.21890826807035413,0.0015784303252080853,894,,,0.3535528596187175,0.3414869029275809,722d9cd1-82cc-453b-aa5d-aeac13c53f84,COMPLETE
849,849,0.3535528596187175,2021-10-14 15:36:41.538559,2021-10-14 15:36:41.975540,0 days 00:00:00.436981,gbdt,0.22999598029100593,0.0017361084706984816,885,,,0.3535528596187175,0.3414869029275809,c54f59fe-d09c-41ea-a0d5-fd731c56fb74,COMPLETE
850,850,0.3535528596187175,2021-10-14 15:36:41.979539,2021-10-14 15:36:42.403078,0 days 00:00:00.423539,gbdt,0.2613023759843604,0.0019460371319094533,864,,,0.3535528596187175,0.3414869029275809,7a3f6109-2b8b-47d5-85df-c5b77e2cd160,COMPLETE
851,851,0.3535528596187175,2021-10-14 15:36:42.406076,2021-10-14 15:36:42.773083,0 days 00:00:00.367007,gbdt,0.24046174978295662,0.001588768820152451,621,,,0.3535528596187175,0.3414869029275809,519bead7-501d-4a3e-8e3a-4226036ea9f1,COMPLETE
852,852,0.3535528596187175,2021-10-14 15:36:42.776084,2021-10-14 15:36:43.127148,0 days 00:00:00.351064,gbdt,0.20421005651720503,0.0014541517218136831,617,,,0.3535528596187175,0.3414869029275809,b13d687e-4490-42f3-8071-e91ccb840636,COMPLETE
853,853,0.3535528596187175,2021-10-14 15:36:43.131148,2021-10-14 15:36:43.566162,0 days 00:00:00.435014,gbdt,0.22752419788546413,0.0016754509686794663,862,,,0.3535528596187175,0.3414869029275809,9952680e-6aab-41f6-8688-a0d212e1a6ce,COMPLETE
854,854,0.3535528596187175,2021-10-14 15:36:43.570155,2021-10-14 15:36:43.999151,0 days 00:00:00.428996,gbdt,0.2612874493867823,0.0013412217297638237,847,,,0.3535528596187175,0.3414869029275809,a02c836d-44d0-4416-90ed-b0ee88d96049,COMPLETE
855,855,0.3535528596187175,2021-10-14 15:36:44.002152,2021-10-14 15:36:44.388149,0 days 00:00:00.385997,gbdt,0.21456605173238763,0.0014997024118549398,889,,,0.3535528596187175,0.3414869029275809,15c8f24a-4065-4b4a-96b2-516910646adc,COMPLETE
856,856,0.3535528596187175,2021-10-14 15:36:44.393152,2021-10-14 15:36:44.786154,0 days 00:00:00.393002,gbdt,0.24507672198752428,0.001358955262236557,612,,,0.3535528596187175,0.3414869029275809,09d6d992-8a45-4f8d-af58-8ee33d5a59ba,COMPLETE
857,857,0.3535528596187175,2021-10-14 15:36:44.789153,2021-10-14 15:36:45.136149,0 days 00:00:00.346996,gbdt,0.20448708696094528,0.0021154739585675206,626,,,0.3535528596187175,0.3414869029275809,f4c57983-6862-4530-86f8-cc82d1cd1cff,COMPLETE
858,858,0.3535528596187175,2021-10-14 15:36:45.139146,2021-10-14 15:36:45.490147,0 days 00:00:00.351001,gbdt,0.19333745533474647,0.0013242823127793647,610,,,0.3535528596187175,0.3414869029275809,3bab56eb-c05d-4406-86b9-96f83815bd6d,COMPLETE
859,859,0.3535528596187175,2021-10-14 15:36:45.499149,2021-10-14 15:36:45.860156,0 days 00:00:00.361007,gbdt,0.22804211714782827,0.0012217141208271383,892,,,0.3535528596187175,0.3414869029275809,bc50ce98-383c-417e-8e58-a2638d01e6ec,COMPLETE
860,860,0.3535528596187175,2021-10-14 15:36:45.865149,2021-10-14 15:36:46.220153,0 days 00:00:00.355004,gbdt,0.19483168872688508,0.0013417552003089188,630,,,0.3535528596187175,0.3414869029275809,2dc8c589-31fe-4e1f-83f1-55ea2f63a118,COMPLETE
861,861,0.3535528596187175,2021-10-14 15:36:46.223146,2021-10-14 15:36:46.636146,0 days 00:00:00.413000,gbdt,0.2541931105116597,0.0015001778767672572,905,,,0.3535528596187175,0.3414869029275809,b1da16db-39f3-4a2b-acec-123adf3c9fdc,COMPLETE
862,862,0.3535528596187175,2021-10-14 15:36:46.639144,2021-10-14 15:36:47.010149,0 days 00:00:00.371005,gbdt,0.1863489080951796,0.0012488553381399168,905,,,0.3535528596187175,0.3414869029275809,23d22e47-1f6d-4d2c-915d-620030c51bd2,COMPLETE
863,863,0.3535528596187175,2021-10-14 15:36:47.014147,2021-10-14 15:36:47.349689,0 days 00:00:00.335542,gbdt,0.2126268741059119,0.0011185783168347575,621,,,0.3535528596187175,0.3414869029275809,ce80c2bd-4f0c-43f6-9587-b87545d2182b,COMPLETE
864,864,0.3535528596187175,2021-10-14 15:36:47.352682,2021-10-14 15:36:47.730216,0 days 00:00:00.377534,gbdt,0.2280225578658401,0.001221993119379546,915,,,0.3535528596187175,0.3414869029275809,eed7f2e5-e746-44e3-aacf-2a89e80edd09,COMPLETE
865,865,0.3535528596187175,2021-10-14 15:36:47.733215,2021-10-14 15:36:48.134217,0 days 00:00:00.401002,gbdt,0.2710974482249904,0.0014346724974223157,915,,,0.3535528596187175,0.3414869029275809,f2dcf8bb-a18f-4b1d-a18a-61fcd1711851,COMPLETE
866,866,0.3535528596187175,2021-10-14 15:36:48.138214,2021-10-14 15:36:48.576217,0 days 00:00:00.438003,gbdt,0.2069589040510979,0.0010461146382277336,904,,,0.3535528596187175,0.3414869029275809,d3e1513f-39a5-412e-83ca-7cee8e959eb7,COMPLETE
867,867,0.3535528596187175,2021-10-14 15:36:48.579215,2021-10-14 15:36:48.992223,0 days 00:00:00.413008,gbdt,0.23747373716227885,0.0011210361178645226,917,,,0.3535528596187175,0.3414869029275809,5191784d-d57c-4652-b9bb-d6eab0bcfaae,COMPLETE
868,868,0.3535528596187175,2021-10-14 15:36:48.996214,2021-10-14 15:36:49.413221,0 days 00:00:00.417007,gbdt,0.2396852862951279,0.001019116224359709,925,,,0.3535528596187175,0.3414869029275809,2dd8b8fd-ed9f-49f4-8c8d-ecec9c4f7fc5,COMPLETE
869,869,0.3535528596187175,2021-10-14 15:36:49.418220,2021-10-14 15:36:49.818217,0 days 00:00:00.399997,gbdt,0.20099085082640225,0.001089977864755104,932,,,0.3535528596187175,0.3414869029275809,e376d0ce-af8e-4cc0-8183-504a9400c7ee,COMPLETE
870,870,0.3535528596187175,2021-10-14 15:36:49.822216,2021-10-14 15:36:50.202215,0 days 00:00:00.379999,gbdt,0.2734361017222472,0.000979714412960986,925,,,0.3535528596187175,0.3414869029275809,f710dfbb-b2e8-471e-bd15-a240f40131d9,COMPLETE
871,871,0.3535528596187175,2021-10-14 15:36:50.205220,2021-10-14 15:36:50.646217,0 days 00:00:00.440997,gbdt,0.22663869486526614,0.0012816014162028494,937,,,0.3535528596187175,0.3414869029275809,ddbce24e-20c4-41bd-93df-31aed7988740,COMPLETE
872,872,0.3535528596187175,2021-10-14 15:36:50.649217,2021-10-14 15:36:51.025839,0 days 00:00:00.376622,gbdt,0.18419334427264333,0.0009287649550164324,906,,,0.3535528596187175,0.3414869029275809,edc208fc-825d-420d-933f-5f78b6f7a934,COMPLETE
873,873,0.3535528596187175,2021-10-14 15:36:51.029838,2021-10-14 15:36:51.411373,0 days 00:00:00.381535,gbdt,0.24866481188244086,0.0008585044768575986,937,,,0.3535528596187175,0.3414869029275809,a5de1606-601d-44a1-8f17-925e2ba58612,COMPLETE
874,874,0.3535528596187175,2021-10-14 15:36:51.414372,2021-10-14 15:36:51.847371,0 days 00:00:00.432999,gbdt,0.20557440282518358,0.001077995346506061,944,,,0.3535528596187175,0.3414869029275809,2de1685c-c102-4ad4-9ecf-f5a27f9d7291,COMPLETE
875,875,0.3535528596187175,2021-10-14 15:36:51.850373,2021-10-14 15:36:52.278377,0 days 00:00:00.428004,gbdt,0.18907789894012308,0.0008739644562213983,928,,,0.3535528596187175,0.3414869029275809,0c3801fb-8044-411b-bbaf-5fc0b17f365b,COMPLETE
876,876,0.3535528596187175,2021-10-14 15:36:52.282373,2021-10-14 15:36:52.713375,0 days 00:00:00.431002,gbdt,0.1792323139749273,0.0008472387168745077,926,,,0.3535528596187175,0.3414869029275809,940fa4c9-7230-4054-a30e-978762d514f2,COMPLETE
877,877,0.3535528596187175,2021-10-14 15:36:52.717373,2021-10-14 15:36:53.199375,0 days 00:00:00.482002,gbdt,0.2549776026500606,0.0010673658410983598,913,,,0.3535528596187175,0.3414869029275809,48d8a815-2c6d-4c83-a7f7-325f3a559415,COMPLETE
878,878,0.3535528596187175,2021-10-14 15:36:53.202373,2021-10-14 15:36:53.632919,0 days 00:00:00.430546,gbdt,0.9768713697990126,0.0007831664666938411,942,,,0.3535528596187175,0.3414869029275809,dee95210-3186-4785-8fa0-737f89f0cd36,COMPLETE
879,879,0.3535528596187175,2021-10-14 15:36:53.635917,2021-10-14 15:36:53.989920,0 days 00:00:00.354003,gbdt,0.9782440616916297,0.0007705188314455777,590,,,0.3535528596187175,0.3414869029275809,460959bb-0a7d-49cd-89a7-7e5841a1a41f,COMPLETE
880,880,0.3535528596187175,2021-10-14 15:36:53.993925,2021-10-14 15:36:54.417056,0 days 00:00:00.423131,gbdt,0.9667621037741077,0.0007452100799745889,929,,,0.3535528596187175,0.3414869029275809,c386a837-c643-4e53-a2ef-4168b98077ba,COMPLETE
881,881,0.3535528596187175,2021-10-14 15:36:54.420057,2021-10-14 15:36:54.826055,0 days 00:00:00.405998,gbdt,0.9673553617198959,0.0009412283489570348,943,,,0.3535528596187175,0.3414869029275809,cd78a1f9-662a-43f7-86e7-406f1a2276c7,COMPLETE
882,882,0.3535528596187175,2021-10-14 15:36:54.829055,2021-10-14 15:36:55.201653,0 days 00:00:00.372598,gbdt,0.9866824607914148,0.0007959878632921266,589,,,0.3535528596187175,0.3414869029275809,2da08555-16c8-44a7-868b-a5c05984f83f,COMPLETE
883,883,0.3535528596187175,2021-10-14 15:36:55.204652,2021-10-14 15:36:55.595191,0 days 00:00:00.390539,gbdt,0.9549018609252021,0.000701333348682816,602,,,0.3535528596187175,0.3414869029275809,ec91535c-e22b-4c73-9031-e8f66d84b651,COMPLETE
884,884,0.3535528596187175,2021-10-14 15:36:55.599188,2021-10-14 15:36:56.016301,0 days 00:00:00.417113,gbdt,0.9982807797795004,0.0009049394884009066,575,,,0.3535528596187175,0.3414869029275809,42a96c2a-562e-4aa2-85ee-bfc2653fb9f1,COMPLETE
885,885,0.3535528596187175,2021-10-14 15:36:56.019302,2021-10-14 15:36:56.391302,0 days 00:00:00.372000,gbdt,0.9548547660257075,0.0007291464126583587,569,,,0.3535528596187175,0.3414869029275809,ec315da7-7f24-4740-847d-8a47af275b0b,COMPLETE
886,886,0.3535528596187175,2021-10-14 15:36:56.394302,2021-10-14 15:36:56.751299,0 days 00:00:00.356997,gbdt,0.9529876523160488,0.0007132579003822728,563,,,0.3535528596187175,0.3414869029275809,7cf81439-2b46-4111-a988-3b562fd1338b,COMPLETE
887,887,0.3535528596187175,2021-10-14 15:36:56.754302,2021-10-14 15:36:57.279234,0 days 00:00:00.524932,gbdt,0.9499176185333968,0.0008726485616555848,595,,,0.3535528596187175,0.3414869029275809,c977dd75-534d-4da6-9867-134e04f50548,COMPLETE
888,888,0.3535528596187175,2021-10-14 15:36:57.282229,2021-10-14 15:36:57.660233,0 days 00:00:00.378004,gbdt,0.9964121613146631,0.0006537230636029783,568,,,0.3535528596187175,0.3414869029275809,c2c642ca-d6e2-4e53-9d8a-becc0aba2cb3,COMPLETE
889,889,0.3535528596187175,2021-10-14 15:36:57.663233,2021-10-14 15:36:58.006234,0 days 00:00:00.343001,gbdt,0.9713883562397004,0.0009350252499407484,556,,,0.3535528596187175,0.3414869029275809,f0734c93-0a2a-4c47-a66e-af0b913c9ac2,COMPLETE
890,890,0.3535528596187175,2021-10-14 15:36:58.010235,2021-10-14 15:36:58.395252,0 days 00:00:00.385017,gbdt,0.9434586318789201,0.0007797348653565891,956,,,0.3535528596187175,0.3414869029275809,199aa036-dc2c-4157-91a1-c9fed117460d,COMPLETE
891,891,0.3535528596187175,2021-10-14 15:36:58.399251,2021-10-14 15:36:58.761232,0 days 00:00:00.361981,gbdt,0.9743362109522573,0.0009948220576899193,555,,,0.3535528596187175,0.3414869029275809,8bbe6b8b-e4f8-4b35-8516-c32736e45462,COMPLETE
892,892,0.3535528596187175,2021-10-14 15:36:58.765229,2021-10-14 15:36:59.167231,0 days 00:00:00.402002,gbdt,0.9628649793046813,0.0006482007516611057,925,,,0.3535528596187175,0.3414869029275809,d2a5a29a-3399-4f84-a10a-29bfa69e3aaf,COMPLETE
893,893,0.3535528596187175,2021-10-14 15:36:59.170233,2021-10-14 15:36:59.555232,0 days 00:00:00.384999,gbdt,0.9362342851368535,0.0007335288455137788,953,,,0.3535528596187175,0.3414869029275809,8bbecdca-fb2e-4fc7-b41e-f1279659b3db,COMPLETE
894,894,0.3535528596187175,2021-10-14 15:36:59.559233,2021-10-14 15:36:59.955234,0 days 00:00:00.396001,gbdt,0.9286676468515459,0.0008469825863179802,953,,,0.3535528596187175,0.3414869029275809,ab711c15-d99e-420e-88cc-ecf58592802e,COMPLETE
895,895,0.3535528596187175,2021-10-14 15:36:59.958234,2021-10-14 15:37:00.304233,0 days 00:00:00.345999,gbdt,0.9996658167444138,0.000610353335179651,553,,,0.3535528596187175,0.3414869029275809,16cef265-f283-4de5-b407-af1027dbba87,COMPLETE
896,896,0.3535528596187175,2021-10-14 15:37:00.308232,2021-10-14 15:37:00.692231,0 days 00:00:00.383999,gbdt,0.9270996924197598,0.0007038399847490598,578,,,0.3535528596187175,0.3414869029275809,db849ba9-32cf-4df9-bb4a-c1a4c5f6c186,COMPLETE
897,897,0.3535528596187175,2021-10-14 15:37:00.695234,2021-10-14 15:37:01.043235,0 days 00:00:00.348001,gbdt,0.9461422643171994,0.0006893100797652696,578,,,0.3535528596187175,0.3414869029275809,9cc17bfe-b71c-46b0-8c50-114a9cadc0ab,COMPLETE
898,898,0.3535528596187175,2021-10-14 15:37:01.047230,2021-10-14 15:37:01.387235,0 days 00:00:00.340005,gbdt,0.9222447947058088,0.0008301811029307653,545,,,0.3535528596187175,0.3414869029275809,dc6fa4b2-bff2-488b-a021-760b1ded148b,COMPLETE
899,899,0.3535528596187175,2021-10-14 15:37:01.391230,2021-10-14 15:37:01.735767,0 days 00:00:00.344537,gbdt,0.9367028118273816,0.0006004679622863766,535,,,0.3535528596187175,0.3414869029275809,9c513f47-ae88-4c91-89a5-e808f1d462fa,COMPLETE
900,900,0.3535528596187175,2021-10-14 15:37:01.738766,2021-10-14 15:37:02.104092,0 days 00:00:00.365326,gbdt,0.9611039372597592,0.0006526458541846359,564,,,0.3535528596187175,0.3414869029275809,a3a5a603-5f27-42a9-be9a-3a97023f5422,COMPLETE
901,901,0.3535528596187175,2021-10-14 15:37:02.107091,2021-10-14 15:37:02.498100,0 days 00:00:00.391009,gbdt,0.9605038679699025,0.0007755310549104667,580,,,0.3535528596187175,0.3414869029275809,3800f44b-f977-4111-a18c-90ccb91c4f05,COMPLETE
902,902,0.3535528596187175,2021-10-14 15:37:02.503095,2021-10-14 15:37:02.872632,0 days 00:00:00.369537,gbdt,0.9437622621728905,0.0007988220321434629,542,,,0.3535528596187175,0.3414869029275809,2e4b6f1d-55d9-42f1-957b-ae919f309b64,COMPLETE
903,903,0.3535528596187175,2021-10-14 15:37:02.875628,2021-10-14 15:37:03.223635,0 days 00:00:00.348007,gbdt,0.9792792569141429,0.0006610613082705852,544,,,0.3535528596187175,0.3414869029275809,47cadbf3-0e65-4ca2-b1d1-6c04290cf900,COMPLETE
904,904,0.3535528596187175,2021-10-14 15:37:03.227630,2021-10-14 15:37:03.576170,0 days 00:00:00.348540,gbdt,0.9217935960468869,0.0006167040522129234,551,,,0.3535528596187175,0.3414869029275809,96e2fd55-592d-48a2-ab5a-30bfc893ce70,COMPLETE
905,905,0.3535528596187175,2021-10-14 15:37:03.580173,2021-10-14 15:37:03.914174,0 days 00:00:00.334001,gbdt,0.9381715319885756,0.0007332483036010196,524,,,0.3535528596187175,0.3414869029275809,218533b3-c29d-4e54-9a3d-dc8a5ec410f9,COMPLETE
906,906,0.3535528596187175,2021-10-14 15:37:03.917168,2021-10-14 15:37:04.267170,0 days 00:00:00.350002,gbdt,0.9136663566804496,0.0005531581553727714,562,,,0.3535528596187175,0.3414869029275809,c47ed3d4-f4f4-40af-82d7-e67b48898eaa,COMPLETE
907,907,0.3535528596187175,2021-10-14 15:37:04.271167,2021-10-14 15:37:04.645171,0 days 00:00:00.374004,gbdt,0.9065775684058293,0.0006511560741750926,524,,,0.3535528596187175,0.3414869029275809,c5eb8b50-6714-4135-a36c-eecfc68c22f8,COMPLETE
908,908,0.3535528596187175,2021-10-14 15:37:04.649167,2021-10-14 15:37:04.999171,0 days 00:00:00.350004,gbdt,0.9427848296857388,0.00013902447344249676,533,,,0.3535528596187175,0.3414869029275809,068acb7a-adb4-4b41-a95b-3cdf3e3ccf72,COMPLETE
909,909,0.3535528596187175,2021-10-14 15:37:05.003169,2021-10-14 15:37:05.356172,0 days 00:00:00.353003,gbdt,0.9058416624996294,0.0009189654833553982,532,,,0.3535528596187175,0.3414869029275809,93e9eebf-4a11-433a-bb4d-dfa3f5fbe96c,COMPLETE
910,910,0.3535528596187175,2021-10-14 15:37:05.359168,2021-10-14 15:37:05.712171,0 days 00:00:00.353003,gbdt,0.9155534623637867,0.00010012462103069031,544,,,0.3535528596187175,0.3414869029275809,4a9dcc6a-fb53-4b93-85af-e8bbe70124fc,COMPLETE
911,911,0.3535528596187175,2021-10-14 15:37:05.715168,2021-10-14 15:37:06.068172,0 days 00:00:00.353004,gbdt,0.9231309079076879,0.00012141266062781285,578,,,0.3535528596187175,0.3414869029275809,4cb5c9ca-04d2-4dc0-b86b-21ec03f74e44,COMPLETE
912,912,0.3535528596187175,2021-10-14 15:37:06.071169,2021-10-14 15:37:06.435170,0 days 00:00:00.364001,gbdt,0.9009028732892548,0.00014747079112964532,521,,,0.3535528596187175,0.3414869029275809,826b3b46-2352-4aca-8100-18902ca8df96,COMPLETE
913,913,0.3535528596187175,2021-10-14 15:37:06.438170,2021-10-14 15:37:06.784171,0 days 00:00:00.346001,gbdt,0.9266530631344604,0.00012169858417506315,553,,,0.3535528596187175,0.3414869029275809,648db73a-372f-447e-a943-eedbf365c7ef,COMPLETE
914,914,0.3535528596187175,2021-10-14 15:37:06.787170,2021-10-14 15:37:07.144172,0 days 00:00:00.357002,gbdt,0.8981010181593552,0.00014462469719617792,586,,,0.3535528596187175,0.3414869029275809,50b07e08-c4a0-4232-915b-36628996e4b7,COMPLETE
915,915,0.3535528596187175,2021-10-14 15:37:07.148168,2021-10-14 15:37:07.509170,0 days 00:00:00.361002,gbdt,0.8957272902288209,0.0001429850916499105,522,,,0.3535528596187175,0.3414869029275809,568bcedc-0d49-4331-9fce-f06e1085e850,COMPLETE
916,916,0.3535528596187175,2021-10-14 15:37:07.514171,2021-10-14 15:37:07.852171,0 days 00:00:00.338000,gbdt,0.9142836298299012,0.0001416828513756601,542,,,0.3535528596187175,0.3414869029275809,9380958c-4b86-4956-bed3-db0f37e0dd85,COMPLETE
917,917,0.3535528596187175,2021-10-14 15:37:07.856170,2021-10-14 15:37:08.210171,0 days 00:00:00.354001,gbdt,0.8888102411645608,0.00016008212001191268,524,,,0.3535528596187175,0.3414869029275809,8d3bde71-8e5e-4e27-a6da-ca3751fb0887,COMPLETE
918,918,0.3535528596187175,2021-10-14 15:37:08.213169,2021-10-14 15:37:08.571172,0 days 00:00:00.358003,gbdt,0.8883455000645734,0.00011691875783120833,514,,,0.3535528596187175,0.3414869029275809,be0eb6b6-bcf6-43fe-bc60-57fabe7102bc,COMPLETE
919,919,0.3535528596187175,2021-10-14 15:37:08.575169,2021-10-14 15:37:08.942173,0 days 00:00:00.367004,gbdt,0.9094569408956681,0.00013524655690866564,531,,,0.3535528596187175,0.3414869029275809,2a085073-9468-4d82-a834-cb06c5a823d7,COMPLETE
920,920,0.3535528596187175,2021-10-14 15:37:08.946168,2021-10-14 15:37:09.300704,0 days 00:00:00.354536,gbdt,0.874922369731212,0.00014630077765224087,559,,,0.3535528596187175,0.3414869029275809,e459216c-7122-442d-b769-157b3cb7e76f,COMPLETE
