,number,value,datetime_start,datetime_complete,duration,params_boosting,params_feature_fraction,params_learning_rate,params_num_leaves,params_other_rate,params_top_rate,user_attrs_test_error,user_attrs_train_error,user_attrs_uuid,state
921,921,0.3535528596187175,2021-10-14 15:37:09.304702,2021-10-14 15:37:09.659700,0 days 00:00:00.354998,gbdt,0.8850979443634651,0.0005914371932862622,543,,,0.3535528596187175,0.3414869029275809,e482f591-fa0a-47a7-ae3d-39865fb9bce4,COMPLETE
922,922,0.3535528596187175,2021-10-14 15:37:09.662705,2021-10-14 15:37:10.028704,0 days 00:00:00.365999,gbdt,0.9100035825349629,0.00010075991028451643,572,,,0.3535528596187175,0.3414869029275809,660bf0f3-723a-44d6-9ca0-35bf4ad0d078,COMPLETE
923,923,0.3535528596187175,2021-10-14 15:37:10.032701,2021-10-14 15:37:10.553245,0 days 00:00:00.520544,gbdt,0.8824683140710865,0.00016089762233279339,977,,,0.3535528596187175,0.3414869029275809,38c1ee92-38d7-4ea7-9ca3-e7a311b70178,COMPLETE
924,924,0.3535528596187175,2021-10-14 15:37:10.556242,2021-10-14 15:37:10.985323,0 days 00:00:00.429081,gbdt,0.8747965473571427,0.00010391707362492373,976,,,0.3535528596187175,0.3414869029275809,29c9e297-db35-46e9-8815-1c3ee471920d,COMPLETE
925,925,0.3535528596187175,2021-10-14 15:37:10.988312,2021-10-14 15:37:11.420313,0 days 00:00:00.432001,gbdt,0.8946651568778525,0.00011721927594958259,1000,,,0.3535528596187175,0.3414869029275809,14de2bef-92b9-4f80-b804-97f4668e4c9b,COMPLETE
926,926,0.3535528596187175,2021-10-14 15:37:11.424312,2021-10-14 15:37:11.808322,0 days 00:00:00.384010,gbdt,0.8694487320066127,0.00012791938705664234,506,,,0.3535528596187175,0.3414869029275809,1c93b9d0-d4b4-434e-8425-b61dcd0fa421,COMPLETE
927,927,0.3535528596187175,2021-10-14 15:37:11.812319,2021-10-14 15:37:12.216405,0 days 00:00:00.404086,gbdt,0.8869719474412564,0.00018480652721056612,969,,,0.3535528596187175,0.3414869029275809,4a77f2ab-15ce-4dd9-b614-82251098470d,COMPLETE
928,928,0.3535528596187175,2021-10-14 15:37:12.220381,2021-10-14 15:37:12.679414,0 days 00:00:00.459033,gbdt,0.8666073714902707,0.0001618243380494927,973,,,0.3535528596187175,0.3414869029275809,da994918-15bc-43cf-afa5-2f4725bc02da,COMPLETE
929,929,0.3535528596187175,2021-10-14 15:37:12.683414,2021-10-14 15:37:13.106953,0 days 00:00:00.423539,gbdt,0.8846065530093526,0.0001732475639147189,970,,,0.3535528596187175,0.3414869029275809,7501bf47-e75e-4923-8dbd-44ebe9e88f23,COMPLETE
930,930,0.3535528596187175,2021-10-14 15:37:13.109958,2021-10-14 15:37:13.497953,0 days 00:00:00.387995,gbdt,0.8675138549745518,0.00012245561163986958,985,,,0.3535528596187175,0.3414869029275809,774af177-cc0a-479c-b47d-91c45800c9ab,COMPLETE
931,931,0.3535528596187175,2021-10-14 15:37:13.500954,2021-10-14 15:37:13.894956,0 days 00:00:00.394002,gbdt,0.8970976037011883,0.00012870566114731784,974,,,0.3535528596187175,0.3414869029275809,c6442f93-4be0-496d-94e3-aea4a3d2422f,COMPLETE
932,932,0.3535528596187175,2021-10-14 15:37:13.897957,2021-10-14 15:37:14.297952,0 days 00:00:00.399995,gbdt,0.8738259136476051,0.0001591681158777294,993,,,0.3535528596187175,0.3414869029275809,d42bb86f-4cba-463a-b3be-6609065e45e2,COMPLETE
933,933,0.3535528596187175,2021-10-14 15:37:14.300953,2021-10-14 15:37:14.700951,0 days 00:00:00.399998,gbdt,0.8950927063734374,0.00012494676431524404,992,,,0.3535528596187175,0.3414869029275809,48633a13-0490-496c-9a12-e87ab4abbc6f,COMPLETE
934,934,0.3535528596187175,2021-10-14 15:37:14.704952,2021-10-14 15:37:15.120046,0 days 00:00:00.415094,gbdt,0.8550814117477836,0.0001199098207533449,1000,,,0.3535528596187175,0.3414869029275809,3c2b6ed9-467a-4912-b4c5-c35115e196b8,COMPLETE
935,935,0.3535528596187175,2021-10-14 15:37:15.123042,2021-10-14 15:37:15.562051,0 days 00:00:00.439009,gbdt,0.8839430028741029,0.00010001060588566884,963,,,0.3535528596187175,0.3414869029275809,4049d86b-3267-4315-ab01-800761733935,COMPLETE
936,936,0.3535528596187175,2021-10-14 15:37:15.565056,2021-10-14 15:37:15.966047,0 days 00:00:00.400991,gbdt,0.8649772762803833,0.00011213961996725446,982,,,0.3535528596187175,0.3414869029275809,cb472342-b8c4-44af-b65b-011b24a84856,COMPLETE
937,937,0.3535528596187175,2021-10-14 15:37:15.970043,2021-10-14 15:37:16.406042,0 days 00:00:00.435999,gbdt,0.8583587305055088,0.0001488201015373804,994,,,0.3535528596187175,0.3414869029275809,d13ef158-7fa5-48b7-b851-0926bb34890a,COMPLETE
938,938,0.3535528596187175,2021-10-14 15:37:16.411044,2021-10-14 15:37:16.881045,0 days 00:00:00.470001,gbdt,0.8638648742356887,0.00010239543704950397,1000,,,0.3535528596187175,0.3414869029275809,cc2d3d75-5c8b-4d19-b088-a6be325a31c8,COMPLETE
939,939,0.3535528596187175,2021-10-14 15:37:16.885044,2021-10-14 15:37:17.351044,0 days 00:00:00.466000,gbdt,0.8532587210495262,0.00013518129145617777,962,,,0.3535528596187175,0.3414869029275809,13b7c04f-54b8-4fcd-97d2-7edddd9e67d7,COMPLETE
940,940,0.3535528596187175,2021-10-14 15:37:17.355044,2021-10-14 15:37:17.749044,0 days 00:00:00.394000,gbdt,0.8537752846033889,0.00017561952466891892,976,,,0.3535528596187175,0.3414869029275809,a5acc5e2-4520-41ea-87bc-d38ba398ba7c,COMPLETE
941,941,0.3535528596187175,2021-10-14 15:37:17.752043,2021-10-14 15:37:18.144044,0 days 00:00:00.392001,gbdt,0.8668461460619756,0.00013629305183087865,981,,,0.3535528596187175,0.3414869029275809,98c8d781-097c-452f-bd59-8c2556c335df,COMPLETE
942,942,0.3535528596187175,2021-10-14 15:37:18.147048,2021-10-14 15:37:18.558043,0 days 00:00:00.410995,gbdt,0.8478986621646404,0.0001231232973242714,999,,,0.3535528596187175,0.3414869029275809,66add198-be14-4add-be5b-aa6e6016529b,COMPLETE
943,943,0.3535528596187175,2021-10-14 15:37:18.561042,2021-10-14 15:37:18.966705,0 days 00:00:00.405663,gbdt,0.8404861283354456,0.0005147656363211195,961,,,0.3535528596187175,0.3414869029275809,49a133e5-d27c-42a4-b045-5451ef432bfd,COMPLETE
944,944,0.3535528596187175,2021-10-14 15:37:18.969239,2021-10-14 15:37:19.379238,0 days 00:00:00.409999,gbdt,0.8430761224978798,0.0004715492850055426,977,,,0.3535528596187175,0.3414869029275809,9d63f210-4573-496a-9d54-25d801bc0e56,COMPLETE
945,945,0.3535528596187175,2021-10-14 15:37:19.384241,2021-10-14 15:37:19.784767,0 days 00:00:00.400526,gbdt,0.8585334687099065,0.00047559507465310644,963,,,0.3535528596187175,0.3414869029275809,2bbad1c3-1c6f-4205-a3a8-878b032f6fa1,COMPLETE
946,946,0.3535528596187175,2021-10-14 15:37:19.798772,2021-10-14 15:37:20.196769,0 days 00:00:00.397997,gbdt,0.8311483761206159,0.00048612367848617136,979,,,0.3535528596187175,0.3414869029275809,8a644b7f-aeba-4ce4-98c8-2bd0b36f2e7d,COMPLETE
947,947,0.3535528596187175,2021-10-14 15:37:20.200768,2021-10-14 15:37:20.614771,0 days 00:00:00.414003,gbdt,0.8422716303304806,0.00042206314612619716,962,,,0.3535528596187175,0.3414869029275809,a7a88855-64fc-47cb-8325-6910830db93f,COMPLETE
948,948,0.3535528596187175,2021-10-14 15:37:20.617774,2021-10-14 15:37:21.026769,0 days 00:00:00.408995,gbdt,0.8388962750129497,0.0004328224278313685,982,,,0.3535528596187175,0.3414869029275809,c02ee260-5c72-4c17-845d-1bde960f657e,COMPLETE
949,949,0.3535528596187175,2021-10-14 15:37:21.029766,2021-10-14 15:37:21.418027,0 days 00:00:00.388261,gbdt,0.8448655118438883,0.0004986340854463156,960,,,0.3535528596187175,0.3414869029275809,844f9048-b112-4820-a6fe-905643a1d7cf,COMPLETE
950,950,0.3535528596187175,2021-10-14 15:37:21.422029,2021-10-14 15:37:21.807892,0 days 00:00:00.385863,gbdt,0.8349212273734171,0.00045418472003724137,1000,,,0.3535528596187175,0.3414869029275809,0e563102-3ec4-4fef-8030-e4a21ae173f5,COMPLETE
951,951,0.3535528596187175,2021-10-14 15:37:21.810889,2021-10-14 15:37:22.199891,0 days 00:00:00.389002,gbdt,0.854178384653404,0.000433816067585651,966,,,0.3535528596187175,0.3414869029275809,f57e052b-5782-4cd6-890f-f85ec0a6cb48,COMPLETE
952,952,0.3535528596187175,2021-10-14 15:37:22.202892,2021-10-14 15:37:22.587894,0 days 00:00:00.385002,gbdt,0.8225240683938829,0.00041181950312487364,481,,,0.3535528596187175,0.3414869029275809,38fa9457-102f-4a9a-bc96-915189384c0f,COMPLETE
953,953,0.3535528596187175,2021-10-14 15:37:22.591891,2021-10-14 15:37:22.932890,0 days 00:00:00.340999,gbdt,0.8065876472078582,0.0005316577683360817,489,,,0.3535528596187175,0.3414869029275809,92fb6beb-1d41-4b79-9218-d07663e5d148,COMPLETE
954,954,0.3535528596187175,2021-10-14 15:37:22.935893,2021-10-14 15:37:23.292890,0 days 00:00:00.356997,gbdt,0.8177281469998138,0.00041679241261133657,461,,,0.3535528596187175,0.3414869029275809,ff030a55-3281-42e2-ae02-5e9631fc7ed4,COMPLETE
955,955,0.3535528596187175,2021-10-14 15:37:23.295894,2021-10-14 15:37:23.651894,0 days 00:00:00.356000,gbdt,0.818689648651242,0.00020868893869995759,491,,,0.3535528596187175,0.3414869029275809,2c88a055-f725-44cf-82fe-17db22f7a0e1,COMPLETE
956,956,0.3535528596187175,2021-10-14 15:37:23.655891,2021-10-14 15:37:24.029610,0 days 00:00:00.373719,gbdt,0.8232959188903295,0.00021203584086682765,484,,,0.3535528596187175,0.3414869029275809,3447c536-996d-4c75-8ecb-27d80d4dbafe,COMPLETE
957,957,0.3535528596187175,2021-10-14 15:37:24.032597,2021-10-14 15:37:24.389214,0 days 00:00:00.356617,gbdt,0.8238327829358238,0.0002123501157105009,476,,,0.3535528596187175,0.3414869029275809,bc9db79a-b991-4416-ae1c-e6a61fb3e8c1,COMPLETE
958,958,0.3535528596187175,2021-10-14 15:37:24.393214,2021-10-14 15:37:24.758221,0 days 00:00:00.365007,gbdt,0.8056933061436918,0.00023757792071124416,449,,,0.3535528596187175,0.3414869029275809,f96a1aef-8771-4dd9-b7f0-c80b912795e0,COMPLETE
959,959,0.3535528596187175,2021-10-14 15:37:24.762210,2021-10-14 15:37:25.110211,0 days 00:00:00.348001,gbdt,0.803551187614685,0.00019318768078973038,494,,,0.3535528596187175,0.3414869029275809,7acd3181-5dfa-4778-8721-3b04487ebd00,COMPLETE
960,960,0.3535528596187175,2021-10-14 15:37:25.114213,2021-10-14 15:37:25.466211,0 days 00:00:00.351998,gbdt,0.8353980459434103,0.00020449903345223954,451,,,0.3535528596187175,0.3414869029275809,a4819f05-aa5c-462d-9cdf-bec8eee58e31,COMPLETE
961,961,0.3535528596187175,2021-10-14 15:37:25.469209,2021-10-14 15:37:25.840214,0 days 00:00:00.371005,gbdt,0.8253338224392062,0.00023675275125977974,456,,,0.3535528596187175,0.3414869029275809,477ddbc4-8080-42f6-9055-3dabec3c34d6,COMPLETE
962,962,0.3535528596187175,2021-10-14 15:37:25.844212,2021-10-14 15:37:26.280750,0 days 00:00:00.436538,gbdt,0.7831344181619355,0.00024122877501752115,444,,,0.3535528596187175,0.3414869029275809,ed057c68-f7fe-4043-926a-5f17a0fff5a6,COMPLETE
963,963,0.3535528596187175,2021-10-14 15:37:26.283750,2021-10-14 15:37:26.805086,0 days 00:00:00.521336,gbdt,0.7891597887119359,0.00028358620721061326,469,,,0.3535528596187175,0.3414869029275809,4d243af0-4bef-42cc-96b8-8c0ba6a71481,COMPLETE
964,964,0.3535528596187175,2021-10-14 15:37:26.809085,2021-10-14 15:37:27.247086,0 days 00:00:00.438001,gbdt,0.7961465203301609,0.0002578336874594918,471,,,0.3535528596187175,0.3414869029275809,0806aa39-0da3-4ffe-84c6-90c60cdcbd6d,COMPLETE
965,965,0.3535528596187175,2021-10-14 15:37:27.250086,2021-10-14 15:37:27.801088,0 days 00:00:00.551002,gbdt,0.8069496010603686,0.00023896546834970998,448,,,0.3535528596187175,0.3414869029275809,cccabff0-de7d-437c-a7e4-155e8be5980b,COMPLETE
966,966,0.3535528596187175,2021-10-14 15:37:27.808087,2021-10-14 15:37:28.207089,0 days 00:00:00.399002,gbdt,0.7907096756508972,0.0002932719911763149,464,,,0.3535528596187175,0.3414869029275809,e6185cf9-441d-4a87-9674-57c5b57f69b4,COMPLETE
967,967,0.3535528596187175,2021-10-14 15:37:28.211084,2021-10-14 15:37:28.763926,0 days 00:00:00.552842,gbdt,0.7758539517219865,0.0003250176149362822,442,,,0.3535528596187175,0.3414869029275809,c56d0b4d-61a5-4144-8a73-2cc4369894f3,COMPLETE
968,968,0.3535528596187175,2021-10-14 15:37:28.767926,2021-10-14 15:37:29.144927,0 days 00:00:00.377001,gbdt,0.809517201116852,0.0003673030927554407,462,,,0.3535528596187175,0.3414869029275809,64b47a27-33e2-463d-9fb7-e1b2302a3f2a,COMPLETE
969,969,0.3535528596187175,2021-10-14 15:37:29.147928,2021-10-14 15:37:29.524926,0 days 00:00:00.376998,gbdt,0.7772305196237095,0.0002745106188649998,437,,,0.3535528596187175,0.3414869029275809,d026e5b5-1847-40f9-95b0-3fa1b4c49d5c,COMPLETE
970,970,0.3535528596187175,2021-10-14 15:37:29.528924,2021-10-14 15:37:29.901930,0 days 00:00:00.373006,gbdt,0.8025915094890056,0.0002920627148469009,484,,,0.3535528596187175,0.3414869029275809,fe668ad6-8f94-4d4b-a99b-245eaf23787c,COMPLETE
971,971,0.3535528596187175,2021-10-14 15:37:29.905931,2021-10-14 15:37:30.260927,0 days 00:00:00.354996,gbdt,0.8051408765280491,0.0003391373212264732,434,,,0.3535528596187175,0.3414869029275809,b76aa4b5-6b07-4854-a887-922aa0208c68,COMPLETE
972,972,0.3535528596187175,2021-10-14 15:37:30.265927,2021-10-14 15:37:30.666931,0 days 00:00:00.401004,gbdt,0.7821122897659221,0.00029527371546158405,430,,,0.3535528596187175,0.3414869029275809,1409f06e-eed0-4df0-a2a7-e7403c152cd6,COMPLETE
973,973,0.3535528596187175,2021-10-14 15:37:30.670927,2021-10-14 15:37:31.026931,0 days 00:00:00.356004,gbdt,0.7857941511027471,0.0002591782628218107,463,,,0.3535528596187175,0.3414869029275809,87724b4f-bb0f-4676-b8ab-866d6d380e19,COMPLETE
974,974,0.3535528596187175,2021-10-14 15:37:31.029930,2021-10-14 15:37:31.380926,0 days 00:00:00.350996,gbdt,0.7736218520650637,0.00033670716676939436,476,,,0.3535528596187175,0.3414869029275809,6e2eac55-68d5-4baa-bbe9-d7894dd05fdb,COMPLETE
975,975,0.3535528596187175,2021-10-14 15:37:31.386927,2021-10-14 15:37:31.760928,0 days 00:00:00.374001,gbdt,0.7944018935930607,0.0002659032371512223,425,,,0.3535528596187175,0.3414869029275809,abba3aee-f4af-4977-8fe4-6216765a75b3,COMPLETE
976,976,0.3535528596187175,2021-10-14 15:37:31.763926,2021-10-14 15:37:32.118929,0 days 00:00:00.355003,gbdt,0.769984889748915,0.00032883137101460627,422,,,0.3535528596187175,0.3414869029275809,37d6cc34-1d0d-42ef-89a0-9d8e3a3a924f,COMPLETE
977,977,0.3535528596187175,2021-10-14 15:37:32.121924,2021-10-14 15:37:32.493001,0 days 00:00:00.371077,gbdt,0.81587610348767,0.00029258870274897185,457,,,0.3535528596187175,0.3414869029275809,77051008-496c-457d-a344-0515af86a251,COMPLETE
978,978,0.3535528596187175,2021-10-14 15:37:32.496993,2021-10-14 15:37:32.859997,0 days 00:00:00.363004,gbdt,0.7659657630208683,0.00023431942982879328,445,,,0.3535528596187175,0.3414869029275809,bb5f0dac-770f-427c-bc4b-329be1299696,COMPLETE
979,979,0.3535528596187175,2021-10-14 15:37:32.863994,2021-10-14 15:37:33.218994,0 days 00:00:00.355000,gbdt,0.7886004698710115,0.00024194442962481566,483,,,0.3535528596187175,0.3414869029275809,28b03a77-11eb-4abe-81ef-d23b0213051d,COMPLETE
980,980,0.3535528596187175,2021-10-14 15:37:33.221997,2021-10-14 15:37:33.593996,0 days 00:00:00.371999,gbdt,0.7632361848978297,0.00020297559729415352,497,,,0.3535528596187175,0.3414869029275809,80d70568-f5f1-472d-96cd-439ed80c4ec5,COMPLETE
981,981,0.3535528596187175,2021-10-14 15:37:33.597996,2021-10-14 15:37:33.946991,0 days 00:00:00.348995,gbdt,0.7730022574612803,0.00026096345945004107,420,,,0.3535528596187175,0.3414869029275809,c914a9c8-fefe-408b-9f95-a922d00eac58,COMPLETE
982,982,0.3535528596187175,2021-10-14 15:37:33.949994,2021-10-14 15:37:34.313816,0 days 00:00:00.363822,gbdt,0.7609189661102215,0.0002162220771589017,418,,,0.3535528596187175,0.3414869029275809,c00cb5ee-9347-4cfb-a080-7f80d5aac937,COMPLETE
983,983,0.3535528596187175,2021-10-14 15:37:34.318821,2021-10-14 15:37:34.700816,0 days 00:00:00.381995,gbdt,0.8011657490497485,0.00034430652213824725,436,,,0.3535528596187175,0.3414869029275809,3d0475d1-4eac-45e4-bc5c-64966b4dac1e,COMPLETE
984,984,0.3535528596187175,2021-10-14 15:37:34.704817,2021-10-14 15:37:35.091349,0 days 00:00:00.386532,gbdt,0.7578025642581766,0.0003013071802549795,422,,,0.3535528596187175,0.3414869029275809,3d61147a-733b-4142-88b9-f72b3493cd6d,COMPLETE
985,985,0.3535528596187175,2021-10-14 15:37:35.094348,2021-10-14 15:37:35.463347,0 days 00:00:00.368999,gbdt,0.7814340433071066,0.00036159144302253226,433,,,0.3535528596187175,0.3414869029275809,f9f598ec-e6fe-4680-b3ca-ca6c1b6702c1,COMPLETE
986,986,0.3535528596187175,2021-10-14 15:37:35.467352,2021-10-14 15:37:35.873912,0 days 00:00:00.406560,gbdt,0.7480246931045283,0.00027534735768212004,461,,,0.3535528596187175,0.3414869029275809,e9d89245-7829-4259-a1da-1a9b049bba0a,COMPLETE
987,987,0.3535528596187175,2021-10-14 15:37:35.876904,2021-10-14 15:37:36.262908,0 days 00:00:00.386004,gbdt,0.7469025766966114,0.00032522473068231716,414,,,0.3535528596187175,0.3414869029275809,9b655cc1-f515-4377-8f03-ddd2b344c842,COMPLETE
988,988,0.3535528596187175,2021-10-14 15:37:36.266906,2021-10-14 15:37:36.634989,0 days 00:00:00.368083,gbdt,0.7676564185341723,0.0003087039441909812,410,,,0.3535528596187175,0.3414869029275809,61339222-f760-4e44-98d7-59c4e04fb44f,COMPLETE
989,989,0.3535528596187175,2021-10-14 15:37:36.637990,2021-10-14 15:37:37.015986,0 days 00:00:00.377996,gbdt,0.7448737811119962,0.00033607047383384396,441,,,0.3535528596187175,0.3414869029275809,e1da866a-6dd1-4ec7-9c77-f531516309d0,COMPLETE
990,990,0.3535528596187175,2021-10-14 15:37:37.019986,2021-10-14 15:37:37.389999,0 days 00:00:00.370013,gbdt,0.7378810058652909,0.00024791420851524295,427,,,0.3535528596187175,0.3414869029275809,4658d62a-e5d0-4160-850b-1dc99bac471f,COMPLETE
991,991,0.3535528596187175,2021-10-14 15:37:37.393992,2021-10-14 15:37:37.759625,0 days 00:00:00.365633,gbdt,0.7592225066239073,0.0001984160446875068,417,,,0.3535528596187175,0.3414869029275809,fb01588f-6ea9-485c-b1a7-2d4ff1f536b0,COMPLETE
992,992,0.3535528596187175,2021-10-14 15:37:37.764628,2021-10-14 15:37:38.149914,0 days 00:00:00.385286,gbdt,0.7343092884972225,0.00035621525176187036,419,,,0.3535528596187175,0.3414869029275809,3b22862a-ef1f-4ccc-a6fa-67e64cd144bd,COMPLETE
993,993,0.3535528596187175,2021-10-14 15:37:38.153913,2021-10-14 15:37:38.548369,0 days 00:00:00.394456,gbdt,0.7673746378545598,0.0002624763905820206,404,,,0.3535528596187175,0.3414869029275809,f1dd7b00-cde2-4a0f-bd58-22a7b537d697,COMPLETE
994,994,0.3535528596187175,2021-10-14 15:37:38.552367,2021-10-14 15:37:38.961369,0 days 00:00:00.409002,gbdt,0.7259210860039645,0.00030310445062997887,399,,,0.3535528596187175,0.3414869029275809,97ba535d-133e-45e4-832f-0acaa9a6ac10,COMPLETE
995,995,0.3535528596187175,2021-10-14 15:37:38.965363,2021-10-14 15:37:39.365071,0 days 00:00:00.399708,gbdt,0.721851803199332,0.0003654111264204805,383,,,0.3535528596187175,0.3414869029275809,e34aff05-b1d6-4a90-bfba-492b79380eb6,COMPLETE
996,996,0.3535528596187175,2021-10-14 15:37:39.369070,2021-10-14 15:37:39.731648,0 days 00:00:00.362578,gbdt,0.6707145685736781,0.00036602023909094794,373,,,0.3535528596187175,0.3414869029275809,4145545f-39ba-4c07-95bb-15c77b8cd8bf,COMPLETE
997,997,0.3535528596187175,2021-10-14 15:37:39.735646,2021-10-14 15:37:40.096176,0 days 00:00:00.360530,gbdt,0.7045175482659023,0.0002924001855222532,403,,,0.3535528596187175,0.3414869029275809,fb4a46e3-3795-4c4a-9dcb-1f8e83a9bb88,COMPLETE
998,998,0.3535528596187175,2021-10-14 15:37:40.101176,2021-10-14 15:37:40.476181,0 days 00:00:00.375005,gbdt,0.738297690696929,0.00035414760560897456,383,,,0.3535528596187175,0.3414869029275809,31611bcf-b517-4383-8342-547f686aea62,COMPLETE
999,999,0.3535528596187175,2021-10-14 15:37:40.480177,2021-10-14 15:37:40.849176,0 days 00:00:00.368999,gbdt,0.6907545291225801,0.0002955613210437704,396,,,0.3535528596187175,0.3414869029275809,b5d196ce-0104-4c2f-a889-d09557dfd849,COMPLETE
