,number,value,datetime_start,datetime_complete,duration,params_boosting,params_feature_fraction,params_learning_rate,params_num_leaves,params_other_rate,params_top_rate,user_attrs_test_error,user_attrs_train_error,user_attrs_uuid,state
82,82,0.3535528596187175,2021-10-14 15:32:03.321283,2021-10-14 15:32:03.608284,0 days 00:00:00.287001,gbdt,0.03253755584403687,0.004015550104966511,729,,,0.3535528596187175,0.3414869029275809,318d4060-52df-402b-ac4b-262b8f9c50c7,COMPLETE
83,83,0.3535528596187175,2021-10-14 15:32:03.610295,2021-10-14 15:32:03.866284,0 days 00:00:00.255989,gbdt,0.10067260372065097,0.021723111673136966,39,,,0.3535528596187175,0.3414869029275809,fa79d024-3aba-494b-b1e4-b67b55d5fda0,COMPLETE
84,84,0.3535528596187175,2021-10-14 15:32:03.869287,2021-10-14 15:32:04.230280,0 days 00:00:00.360993,gbdt,0.15886383806018173,0.01318294633958869,667,,,0.3535528596187175,0.3414869029275809,bbac07c1-3943-439d-b272-0e624525e78f,COMPLETE
85,85,0.3535528596187175,2021-10-14 15:32:04.234282,2021-10-14 15:32:04.604905,0 days 00:00:00.370623,gbdt,0.04241641612154799,0.009584664366668728,735,,,0.3535528596187175,0.3414869029275809,4e5b4718-8a26-4565-ae80-04ec7ea09345,COMPLETE
86,86,0.3535528596187175,2021-10-14 15:32:04.606907,2021-10-14 15:32:04.903452,0 days 00:00:00.296545,gbdt,0.2425177901769499,0.02504975382328637,572,,,0.3535528596187175,0.3414869029275809,a90f3f7f-4e83-4091-9da9-d82e837c758d,COMPLETE
87,87,0.3535528596187175,2021-10-14 15:32:04.905453,2021-10-14 15:32:05.220445,0 days 00:00:00.314992,gbdt,0.13726124220651123,0.0032714233972273984,809,,,0.3535528596187175,0.3414869029275809,985c2d5e-64d6-42fd-87f1-ef8beb411280,COMPLETE
88,88,0.3535528596187175,2021-10-14 15:32:05.222444,2021-10-14 15:32:05.491442,0 days 00:00:00.268998,gbdt,0.008184097990319158,0.030540858416765484,641,,,0.3535528596187175,0.3414869029275809,81caecf2-84e8-4e3f-9d87-c2ae6f521180,COMPLETE
89,89,0.3535528596187175,2021-10-14 15:32:05.493445,2021-10-14 15:32:05.819442,0 days 00:00:00.325997,gbdt,0.2375968993153478,0.002788768362743265,848,,,0.3535528596187175,0.3414869029275809,f8a05ade-680f-4203-8074-ff549474e6ee,COMPLETE
90,90,0.3535528596187175,2021-10-14 15:32:05.821442,2021-10-14 15:32:06.241988,0 days 00:00:00.420546,gbdt,0.9691519209192982,0.0017012357127287364,662,,,0.3535528596187175,0.3414869029275809,766f3146-9b02-4b4b-b959-05a91a395bca,COMPLETE
91,91,0.3535528596187175,2021-10-14 15:32:06.244981,2021-10-14 15:32:06.743616,0 days 00:00:00.498635,gbdt,0.1875810845794586,0.0017082253444397357,873,,,0.3535528596187175,0.3414869029275809,6b9f757b-0abf-43d9-81b3-d5670ed1f32e,COMPLETE
92,92,0.3535528596187175,2021-10-14 15:32:06.746616,2021-10-14 15:32:07.101610,0 days 00:00:00.354994,gbdt,0.948830896232459,0.0011151348227335257,953,,,0.3535528596187175,0.3414869029275809,e6f1ab78-2fe3-472a-86dd-11dcb173f3e9,COMPLETE
93,93,0.3535528596187175,2021-10-14 15:32:07.103611,2021-10-14 15:32:07.624612,0 days 00:00:00.521001,gbdt,0.9924256877756602,0.00014218149983553634,916,,,0.3535528596187175,0.3414869029275809,5e78f359-ceef-427b-8d98-11675c072e6d,COMPLETE
94,94,0.3535528596187175,2021-10-14 15:32:07.626613,2021-10-14 15:32:08.049155,0 days 00:00:00.422542,gbdt,0.875341316783059,0.00017968997944965012,954,,,0.3535528596187175,0.3414869029275809,bf32de71-dc6b-4ca1-aa13-384d79c3c563,COMPLETE
95,95,0.3535528596187175,2021-10-14 15:32:08.056157,2021-10-14 15:32:08.522689,0 days 00:00:00.466532,gbdt,0.9006844237720042,0.0005281447175900433,805,,,0.3535528596187175,0.3414869029275809,4c4b29a8-84a5-4968-b8a4-a0d24c94fc2a,COMPLETE
96,96,0.3535528596187175,2021-10-14 15:32:08.524687,2021-10-14 15:32:09.150689,0 days 00:00:00.626002,gbdt,0.9639850325078774,0.0003993800665051763,511,,,0.3535528596187175,0.3414869029275809,386c905f-e6cc-4acc-94ce-bbe4a3ee86a4,COMPLETE
97,97,0.3535528596187175,2021-10-14 15:32:09.152689,2021-10-14 15:32:09.497224,0 days 00:00:00.344535,gbdt,0.9013077877678661,0.0005569648582599919,590,,,0.3535528596187175,0.3414869029275809,52682441-8194-4e8b-8ab4-f3e28012d961,COMPLETE
98,98,0.3535528596187175,2021-10-14 15:32:09.499243,2021-10-14 15:32:09.975366,0 days 00:00:00.476123,gbdt,0.8579122385530091,0.00018195559724006803,1000,,,0.3535528596187175,0.3414869029275809,7c1d8c5b-eb91-4672-b6a5-db3707772211,COMPLETE
99,99,0.3535528596187175,2021-10-14 15:32:09.977366,2021-10-14 15:32:10.378368,0 days 00:00:00.401002,goss,0.9212792571452029,0.0001854756701854474,505,0.5098474330565678,0.2639631316964128,0.3535528596187175,0.3414869029275809,e2019d47-1a12-424c-a2e0-2fce9fb7ac59,COMPLETE
100,100,0.3535528596187175,2021-10-14 15:32:10.381365,2021-10-14 15:32:10.841924,0 days 00:00:00.460559,goss,0.786190556483777,0.0007620683193167249,435,0.426442477756521,0.19585328449940964,0.3535528596187175,0.3414869029275809,b5f3189a-2f88-45c1-8ecd-ccbf7e48515f,COMPLETE
101,101,0.3535528596187175,2021-10-14 15:32:10.844925,2021-10-14 15:32:11.171915,0 days 00:00:00.326990,goss,0.8472483707216225,0.000397649953172948,519,0.5746652820153529,0.27474522007863245,0.3535528596187175,0.3414869029275809,e458f4c4-86ce-426a-8239-10f3429418e9,COMPLETE
102,102,0.3535528596187175,2021-10-14 15:32:11.173910,2021-10-14 15:32:11.565373,0 days 00:00:00.391463,goss,0.6688277232042407,0.0002820479764231261,963,0.4741587919449277,0.2165820086209475,0.3535528596187175,0.3414869029275809,ebdee157-0a07-4c66-88bb-fd4810dba117,COMPLETE
103,103,0.3535528596187175,2021-10-14 15:32:11.567372,2021-10-14 15:32:11.884917,0 days 00:00:00.317545,goss,0.7304588776285353,0.00021017962533568827,455,0.4038105066130963,0.2917430795828507,0.3535528596187175,0.3414869029275809,6c6f1be2-e084-40e3-b827-e66a46c59146,COMPLETE
104,104,0.3535528596187175,2021-10-14 15:32:11.886916,2021-10-14 15:32:12.181453,0 days 00:00:00.294537,goss,0.31944835245207415,0.17623485563662666,226,0.24171643308824078,0.36151349533231003,0.3535528596187175,0.3414869029275809,e6642fca-0393-418d-9835-76689975bb5d,COMPLETE
105,105,0.3535528596187175,2021-10-14 15:32:12.183451,2021-10-14 15:32:12.466459,0 days 00:00:00.283008,goss,0.5941951449719441,0.46147238320284467,313,0.44282901899356064,0.40785439259111284,0.3535528596187175,0.3414869029275809,cae63a58-aaa2-406c-83f0-41bc52e8da39,COMPLETE
106,106,0.3535528596187175,2021-10-14 15:32:12.468449,2021-10-14 15:32:12.734454,0 days 00:00:00.266005,goss,0.39261395821962375,0.13575153661011874,405,0.4003613662811186,0.3375603201125475,0.3535528596187175,0.3414869029275809,bf7deb3b-2afd-457b-bfab-1e6454a6da84,COMPLETE
107,107,0.3535528596187175,2021-10-14 15:32:12.737456,2021-10-14 15:32:13.022453,0 days 00:00:00.284997,goss,0.5438219762885351,0.4226776610929819,124,0.1189773843124583,0.3489661604102925,0.3535528596187175,0.3414869029275809,1e275b11-8170-4412-98b7-9bc3ce9ed0f9,COMPLETE
108,108,0.3535528596187175,2021-10-14 15:32:13.024457,2021-10-14 15:32:13.343455,0 days 00:00:00.318998,goss,0.399985060027213,0.23930695048489622,200,0.3061667897485679,0.38081506572566937,0.3535528596187175,0.3414869029275809,e21d8c5c-d926-42cb-8bd5-50900860b9fb,COMPLETE
109,109,0.3535528596187175,2021-10-14 15:32:13.346451,2021-10-14 15:32:13.682094,0 days 00:00:00.335643,goss,0.30438141219870657,0.29038661911500246,111,0.05331659119116768,0.30976525987009446,0.3535528596187175,0.3414869029275809,3fd5cda5-2d79-45cb-92b8-9302f9659782,COMPLETE
110,110,0.3535528596187175,2021-10-14 15:32:13.684093,2021-10-14 15:32:14.008103,0 days 00:00:00.324010,goss,0.3288023459637504,0.6646622314917858,272,0.1567359685208271,0.6356653224883314,0.3535528596187175,0.3414869029275809,2e00ce31-723e-4694-bfa3-c70d7f4d4861,COMPLETE
111,111,0.3535528596187175,2021-10-14 15:32:14.010095,2021-10-14 15:32:14.302100,0 days 00:00:00.292005,goss,0.49904605338318786,0.09929865801311383,33,0.3770126526889567,0.6104782762770194,0.3535528596187175,0.3414869029275809,5e2f2dd5-8f38-4eff-8c60-25d01ca8df9f,COMPLETE
112,112,0.3535528596187175,2021-10-14 15:32:14.304097,2021-10-14 15:32:14.576096,0 days 00:00:00.271999,goss,0.43549732564156024,0.07930310471401027,71,0.1484783855435402,0.5538535120201306,0.3535528596187175,0.3414869029275809,4ec61a96-8629-46e1-9105-6744ef02845e,COMPLETE
113,113,0.3535528596187175,2021-10-14 15:32:14.578093,2021-10-14 15:32:14.907098,0 days 00:00:00.329005,goss,0.41509904931385855,0.13555536152862696,103,0.23901314320280717,0.6844168048891627,0.3535528596187175,0.3414869029275809,1be99e58-ef5f-40df-acd3-ae637dc23150,COMPLETE
114,114,0.3535528596187175,2021-10-14 15:32:14.910100,2021-10-14 15:32:15.190102,0 days 00:00:00.280002,goss,0.3480198260967632,0.005899204245163291,134,0.05993984756577932,0.7284896307962897,0.3535528596187175,0.3414869029275809,1f45d4bf-8ddc-4f2e-846e-f4d9ae00088e,COMPLETE
115,115,0.3535528596187175,2021-10-14 15:32:15.193095,2021-10-14 15:32:15.488097,0 days 00:00:00.295002,goss,0.4552938041759826,0.10205634694553974,164,0.15097728002974384,0.5060040048753152,0.3535528596187175,0.3414869029275809,c103a911-3c6b-44de-9b22-71cae63b29fb,COMPLETE
116,116,0.3535528596187175,2021-10-14 15:32:15.492095,2021-10-14 15:32:15.727630,0 days 00:00:00.235535,gbdt,0.08346641468666337,0.014527584351230166,53,,,0.3535528596187175,0.3414869029275809,8b24ce23-a60f-492a-a07c-dc652adc5a5e,COMPLETE
117,117,0.3535528596187175,2021-10-14 15:32:15.729630,2021-10-14 15:32:15.956081,0 days 00:00:00.226451,gbdt,0.09126609338765755,0.6406739965373744,34,,,0.3535528596187175,0.3414869029275809,6cfce056-1b4e-4755-8c9f-bfacb672a066,COMPLETE
118,118,0.3535528596187175,2021-10-14 15:32:15.959085,2021-10-14 15:32:16.237144,0 days 00:00:00.278059,gbdt,0.03600781471912746,0.004514466490777698,732,,,0.3535528596187175,0.3414869029275809,ad24a4bb-bb22-44b6-9493-022700521955,COMPLETE
119,119,0.3535528596187175,2021-10-14 15:32:16.239146,2021-10-14 15:32:16.512149,0 days 00:00:00.273003,gbdt,0.04628132437833523,0.010517522923754949,682,,,0.3535528596187175,0.3414869029275809,1b5acaa1-c466-4710-8679-0d662a8fb397,COMPLETE
120,120,0.3535528596187175,2021-10-14 15:32:16.515146,2021-10-14 15:32:16.823148,0 days 00:00:00.308002,gbdt,0.10265297025913077,0.019274599573721733,727,,,0.3535528596187175,0.3414869029275809,e3ff67af-3d2e-4d7e-a1cb-50f27b7af121,COMPLETE
121,121,0.3535528596187175,2021-10-14 15:32:16.826143,2021-10-14 15:32:17.151145,0 days 00:00:00.325002,gbdt,0.1291594900283381,0.008795736238353793,745,,,0.3535528596187175,0.3414869029275809,00eb1ad8-ed09-4359-8e79-a892be6dc25b,COMPLETE
122,122,0.3535528596187175,2021-10-14 15:32:17.153148,2021-10-14 15:32:17.446147,0 days 00:00:00.292999,gbdt,0.01464084523508788,0.006228686720125664,689,,,0.3535528596187175,0.3414869029275809,bc3ef4b5-c941-420c-b5e2-c16fafade8d8,COMPLETE
123,123,0.3535528596187175,2021-10-14 15:32:17.448144,2021-10-14 15:32:17.746144,0 days 00:00:00.298000,gbdt,0.24247370761794532,0.003099389434239769,837,,,0.3535528596187175,0.3414869029275809,9382440e-1542-4d2d-8f79-e42f4037b81f,COMPLETE
124,124,0.3535528596187175,2021-10-14 15:32:17.748159,2021-10-14 15:32:18.011145,0 days 00:00:00.262986,gbdt,0.1469987400760969,0.02383930064123502,656,,,0.3535528596187175,0.3414869029275809,2e985402-b37c-428c-ad4c-eca4b4961d85,COMPLETE
125,125,0.3535528596187175,2021-10-14 15:32:18.013145,2021-10-14 15:32:18.326853,0 days 00:00:00.313708,gbdt,0.06048856722222888,0.002126988803426182,792,,,0.3535528596187175,0.3414869029275809,c116cd26-8c02-4c86-8f32-1b9ede386c8d,COMPLETE
126,126,0.3535528596187175,2021-10-14 15:32:18.329854,2021-10-14 15:32:18.649852,0 days 00:00:00.319998,gbdt,0.1743211030441205,0.003378879856694279,859,,,0.3535528596187175,0.3414869029275809,1ae1f1bc-0232-4e58-9c74-2e061ee9186a,COMPLETE
127,127,0.3535528596187175,2021-10-14 15:32:18.655863,2021-10-14 15:32:18.988865,0 days 00:00:00.333002,gbdt,0.006734719434079113,0.001538578023118019,885,,,0.3535528596187175,0.3414869029275809,3411592b-46ec-40c7-b663-5e615097f6ae,COMPLETE
128,128,0.3535528596187175,2021-10-14 15:32:18.990852,2021-10-14 15:32:19.303863,0 days 00:00:00.313011,gbdt,0.2511884149891588,0.0011410446068390253,923,,,0.3535528596187175,0.3414869029275809,c2e3c632-3d5f-4dc8-9e6d-994e3bc3c8e5,COMPLETE
129,129,0.3535528596187175,2021-10-14 15:32:19.315850,2021-10-14 15:32:19.632854,0 days 00:00:00.317004,gbdt,0.16388514282384298,0.0026720398115349297,835,,,0.3535528596187175,0.3414869029275809,f97897c7-9c47-4337-bf8b-9da53b690d3d,COMPLETE
130,130,0.3535528596187175,2021-10-14 15:32:19.635852,2021-10-14 15:32:19.960396,0 days 00:00:00.324544,gbdt,0.946681492520288,0.001401624454901294,909,,,0.3535528596187175,0.3414869029275809,5e9aa41d-58e4-4aee-aa8b-365a72868298,COMPLETE
131,131,0.3535528596187175,2021-10-14 15:32:19.963394,2021-10-14 15:32:20.317394,0 days 00:00:00.354000,gbdt,0.983922128766845,0.035603401518969575,809,,,0.3535528596187175,0.3414869029275809,331d1a8f-c29a-4f80-ab5d-b13873fef740,COMPLETE
132,132,0.3535528596187175,2021-10-14 15:32:20.320394,2021-10-14 15:32:20.853967,0 days 00:00:00.533573,gbdt,0.21759727500744713,0.00014444607681224366,868,,,0.3535528596187175,0.3414869029275809,6419a872-52fb-4aba-b2ee-b8fd27b45439,COMPLETE
133,133,0.3535528596187175,2021-10-14 15:32:20.855966,2021-10-14 15:32:21.154492,0 days 00:00:00.298526,gbdt,0.9375559236601734,0.0010408588859718224,569,,,0.3535528596187175,0.3414869029275809,b31b69f6-cf6d-495d-ac0f-68792813de49,COMPLETE
134,134,0.3535528596187175,2021-10-14 15:32:21.157497,2021-10-14 15:32:21.423500,0 days 00:00:00.266003,gbdt,0.8662024776387328,0.0008177983110947136,586,,,0.3535528596187175,0.3414869029275809,66a0353a-83ac-49fb-9a19-fb88f771633c,COMPLETE
135,135,0.3535528596187175,2021-10-14 15:32:21.426496,2021-10-14 15:32:21.744497,0 days 00:00:00.318001,gbdt,0.9648356521946113,0.0005707061960324438,989,,,0.3535528596187175,0.3414869029275809,e29c43f7-aa3d-4a08-bc0c-1cbbb5ca9b8b,COMPLETE
136,136,0.3535528596187175,2021-10-14 15:32:21.746497,2021-10-14 15:32:22.051506,0 days 00:00:00.305009,gbdt,0.9108716758470295,0.0001259888899624858,964,,,0.3535528596187175,0.3414869029275809,5ca96b72-8fc6-454d-8b24-43c8949fad52,COMPLETE
137,137,0.3535528596187175,2021-10-14 15:32:22.054504,2021-10-14 15:32:22.329498,0 days 00:00:00.274994,gbdt,0.9236425921557359,0.00017632285186955718,487,,,0.3535528596187175,0.3414869029275809,f3a79e7a-0e22-4456-a2ad-8b58f6e8e2d7,COMPLETE
138,138,0.3535528596187175,2021-10-14 15:32:22.332494,2021-10-14 15:32:22.694032,0 days 00:00:00.361538,gbdt,0.8827578094873314,0.0006424240686203539,971,,,0.3535528596187175,0.3414869029275809,580f24ce-6fae-4d0e-b8c6-7065990c1e94,COMPLETE
139,139,0.3535528596187175,2021-10-14 15:32:22.696028,2021-10-14 15:32:23.025575,0 days 00:00:00.329547,gbdt,0.8410516609260023,0.00040399251800376,537,,,0.3535528596187175,0.3414869029275809,2fd187a9-4b86-438b-a692-0dc57ff4669d,COMPLETE
140,140,0.3535528596187175,2021-10-14 15:32:23.039572,2021-10-14 15:32:23.326272,0 days 00:00:00.286700,gbdt,0.8478194166793519,0.00039488636033971613,515,,,0.3535528596187175,0.3414869029275809,68b866d8-ac58-41dd-bcda-016a71afa0ce,COMPLETE
141,141,0.3535528596187175,2021-10-14 15:32:23.328272,2021-10-14 15:32:23.638270,0 days 00:00:00.309998,gbdt,0.8655069720167043,0.00024261712007419954,998,,,0.3535528596187175,0.3414869029275809,14276bbe-146e-4111-a7c4-4b630a5d4c6b,COMPLETE
142,142,0.3535528596187175,2021-10-14 15:32:23.640271,2021-10-14 15:32:23.921813,0 days 00:00:00.281542,gbdt,0.7329635284786021,0.00019081357369807843,471,,,0.3535528596187175,0.3414869029275809,92ddef5e-e0b6-454d-88c7-2c418bad34b6,COMPLETE
143,143,0.3535528596187175,2021-10-14 15:32:23.924819,2021-10-14 15:32:24.242352,0 days 00:00:00.317533,goss,0.9499558895449606,0.0005127877351309541,496,0.5023774230041744,0.1760668988369391,0.3535528596187175,0.3414869029275809,3b2863f9-706d-491e-bec3-bde8dd384214,COMPLETE
144,144,0.3535528596187175,2021-10-14 15:32:24.244345,2021-10-14 15:32:24.581346,0 days 00:00:00.337001,goss,0.6959279630876543,0.0007216459839457863,942,0.464418837655514,0.28243202799647876,0.3535528596187175,0.3414869029275809,44c21bdb-fc25-4ced-847f-edd444e50c9b,COMPLETE
145,145,0.3535528596187175,2021-10-14 15:32:24.585345,2021-10-14 15:32:24.947345,0 days 00:00:00.362000,goss,0.799919016954249,0.00031433792903904717,967,0.44956127024020487,0.21796193991494978,0.3535528596187175,0.3414869029275809,b2abc92d-bb6e-44c1-ad1f-cfdce0e4632e,COMPLETE
146,146,0.3535528596187175,2021-10-14 15:32:24.949346,2021-10-14 15:32:25.233348,0 days 00:00:00.284002,goss,0.8979519092010971,0.0002108269482156563,464,0.5594069913184744,0.26975712699717586,0.3535528596187175,0.3414869029275809,270e6d17-1a5f-4153-a408-873d165e0723,COMPLETE
147,147,0.3535528596187175,2021-10-14 15:32:25.236344,2021-10-14 15:32:25.516344,0 days 00:00:00.280000,goss,0.6040782034405728,0.00010637604695320528,427,0.40473834586168916,0.34606809563441787,0.3535528596187175,0.3414869029275809,f2aa3ba3-88a5-4fff-b464-754d7ae9fe4c,COMPLETE
148,148,0.3535528596187175,2021-10-14 15:32:25.518343,2021-10-14 15:32:25.786344,0 days 00:00:00.268001,goss,0.7626627506509601,0.00041054522689201365,383,0.4377004271701067,0.33578730157526493,0.3535528596187175,0.3414869029275809,3ffc96ff-5425-4130-bb4e-571681f78f22,COMPLETE
149,149,0.3535528596187175,2021-10-14 15:32:25.789344,2021-10-14 15:32:26.085416,0 days 00:00:00.296072,goss,0.8136726863399696,0.00022410448685338056,451,0.40487694432254406,0.28257591219568295,0.3535528596187175,0.3414869029275809,f0dc8ea9-f986-4408-8a9a-21a60216b5b9,COMPLETE
150,150,0.3535528596187175,2021-10-14 15:32:26.087415,2021-10-14 15:32:26.399427,0 days 00:00:00.312012,goss,0.2739928074967161,0.27217107875921903,310,0.503177572891304,0.231087259876664,0.3535528596187175,0.3414869029275809,6c78700e-9029-4429-b87f-87f669cceb1d,COMPLETE
151,151,0.3535528596187175,2021-10-14 15:32:26.401424,2021-10-14 15:32:26.717419,0 days 00:00:00.315995,goss,0.3052555190908561,0.3256487484678209,266,0.47874770265517497,0.301251424878216,0.3535528596187175,0.3414869029275809,9ffdbf6d-eceb-4159-b313-6f25a1887c49,COMPLETE
152,152,0.3535528596187175,2021-10-14 15:32:26.720413,2021-10-14 15:32:27.011415,0 days 00:00:00.291002,goss,0.6688237943134792,0.15173660744564973,236,0.4823534063825241,0.19732998377879563,0.3535528596187175,0.3414869029275809,9f0082f7-0414-4aee-b80c-0915ad5c9513,COMPLETE
153,153,0.3535528596187175,2021-10-14 15:32:27.013415,2021-10-14 15:32:27.318416,0 days 00:00:00.305001,goss,0.31964809139382205,0.4373728952564636,351,0.3967389509813349,0.3462300926668333,0.3535528596187175,0.3414869029275809,28a6b862-3b3a-4c16-af79-e1f788c44e6f,COMPLETE
154,154,0.3535528596187175,2021-10-14 15:32:27.320414,2021-10-14 15:32:27.642489,0 days 00:00:00.322075,goss,0.4908621720278618,0.06672845163037945,292,0.39136481289737224,0.5497980989833372,0.3535528596187175,0.3414869029275809,987229bc-7809-40f6-96d3-c6d16c4d6bbe,COMPLETE
155,155,0.3535528596187175,2021-10-14 15:32:27.644489,2021-10-14 15:32:27.951307,0 days 00:00:00.306818,goss,0.3880957925401544,0.14184510906595812,376,0.21072954739082755,0.2495270475185101,0.3535528596187175,0.3414869029275809,4b5cba56-0f4c-475a-9259-74e0c3bc5f2a,COMPLETE
156,156,0.3535528596187175,2021-10-14 15:32:27.953306,2021-10-14 15:32:28.219306,0 days 00:00:00.266000,goss,0.35467900521899276,0.10300085983345184,129,0.26177872546256364,0.627572377430612,0.3535528596187175,0.3414869029275809,d582f0dd-06e6-4154-9d90-f3d99f1dd5ff,COMPLETE
157,157,0.3535528596187175,2021-10-14 15:32:28.221309,2021-10-14 15:32:28.533306,0 days 00:00:00.311997,goss,0.3329292387546697,0.08370772621978037,100,0.2699521618081398,0.7111471951101833,0.3535528596187175,0.3414869029275809,32b93335-7154-4ec4-857f-68ae0d8b8d63,COMPLETE
158,158,0.3535528596187175,2021-10-14 15:32:28.535305,2021-10-14 15:32:28.832304,0 days 00:00:00.296999,goss,0.4566254552887923,0.10570904752106008,160,0.21649520268616512,0.5539298703271027,0.3535528596187175,0.3414869029275809,2ce0555e-8ddf-4647-aea4-f72b4bcef34f,COMPLETE
159,159,0.3535528596187175,2021-10-14 15:32:28.835303,2021-10-14 15:32:29.155303,0 days 00:00:00.320000,goss,0.41170698286996865,0.24002424726652483,161,0.2083600698669095,0.47900617799830436,0.3535528596187175,0.3414869029275809,dd406410-6742-4ec7-8e44-53d0c030b923,COMPLETE
160,160,0.3535528596187175,2021-10-14 15:32:29.157306,2021-10-14 15:32:29.455303,0 days 00:00:00.297997,goss,0.4326439067787904,0.06821976901987709,187,0.0640752840730585,0.44981313892538116,0.3535528596187175,0.3414869029275809,7d0388fe-9ee5-434b-ad9a-bf2e15214e4a,COMPLETE
161,161,0.3535528596187175,2021-10-14 15:32:29.458308,2021-10-14 15:32:29.746307,0 days 00:00:00.287999,goss,0.5682832038603486,0.12447151917605345,36,0.04763904541595743,0.32112378441429723,0.3535528596187175,0.3414869029275809,780e4714-f02e-4e8d-a819-4cc7ecd999a8,COMPLETE
162,162,0.3535528596187175,2021-10-14 15:32:29.749308,2021-10-14 15:32:30.048393,0 days 00:00:00.299085,goss,0.38808265081994064,0.046334792303619796,73,0.08610427051681814,0.3616306434486014,0.3535528596187175,0.3414869029275809,665d78f7-daa7-4862-94e6-9e2985afcf5e,COMPLETE
163,163,0.3535528596187175,2021-10-14 15:32:30.050386,2021-10-14 15:32:30.374383,0 days 00:00:00.323997,goss,0.0707115916897797,0.5888890519213916,237,0.015503397710522615,0.40490667610413283,0.3535528596187175,0.3414869029275809,331e3082-88d1-481f-bde3-3857e128725d,COMPLETE
164,164,0.3535528596187175,2021-10-14 15:32:30.376386,2021-10-14 15:32:30.696385,0 days 00:00:00.319999,goss,0.091163750502109,0.011006475039937498,698,0.13778832823564932,0.5113872968225426,0.3535528596187175,0.3414869029275809,ea8aee7c-4fd1-4fc1-9267-690047f47d5f,COMPLETE
165,165,0.3535528596187175,2021-10-14 15:32:30.698383,2021-10-14 15:32:31.027387,0 days 00:00:00.329004,goss,0.05013088513980205,0.018678731827825673,266,0.4248164207737999,0.5699327006418572,0.3535528596187175,0.3414869029275809,1009e25a-3d66-4d32-ad88-107c610f6143,COMPLETE
