,number,value,datetime_start,datetime_complete,duration,params_boosting,params_feature_fraction,params_learning_rate,params_num_leaves,params_other_rate,params_top_rate,user_attrs_test_error,user_attrs_train_error,user_attrs_uuid,state
752,752,0.3535528596187175,2021-10-14 15:35:58.238491,2021-10-14 15:35:59.340730,0 days 00:00:01.102239,goss,0.433836719006923,0.03091063365462125,143,0.22663143683547288,0.4604823798698855,0.3535528596187175,0.3414869029275809,96bface3-033b-4e63-8929-609a4ef1d929,COMPLETE
753,753,0.3535528596187175,2021-10-14 15:35:59.344729,2021-10-14 15:35:59.783739,0 days 00:00:00.439010,goss,0.5455618243608105,0.043675921184602964,190,0.005829201604562732,0.5231352494988737,0.3535528596187175,0.3414869029275809,bc7a53d6-3fbf-4968-bd46-95a753d3d15a,COMPLETE
754,754,0.3535528596187175,2021-10-14 15:35:59.786733,2021-10-14 15:36:00.206733,0 days 00:00:00.420000,goss,0.5576094891267221,0.03941133767971126,162,0.04361595729376163,0.5052989520370922,0.3535528596187175,0.3414869029275809,5cf582a0-3d2f-4be3-965d-0404addf9781,COMPLETE
755,755,0.3535528596187175,2021-10-14 15:36:00.209730,2021-10-14 15:36:00.591732,0 days 00:00:00.382002,goss,0.4986085201077147,0.02838323534702527,124,0.02017625980986833,0.5455066610309882,0.3535528596187175,0.3414869029275809,f4195a84-972a-4277-9d8c-44db5595a534,COMPLETE
756,756,0.3535528596187175,2021-10-14 15:36:00.594728,2021-10-14 15:36:00.962731,0 days 00:00:00.368003,goss,0.5444977006110422,0.05975140525032866,111,0.4115980385197834,0.5388155027507383,0.3535528596187175,0.3414869029275809,1b8c265a-5032-41be-ade0-eead7a86e698,COMPLETE
757,757,0.3535528596187175,2021-10-14 15:36:00.965731,2021-10-14 15:36:01.327672,0 days 00:00:00.361941,goss,0.5193558104270123,0.04798931731914014,141,0.06914126083432669,0.5288424957435017,0.3535528596187175,0.3414869029275809,23781cc5-604e-4545-9cd3-df0d05082e86,COMPLETE
758,758,0.3535528596187175,2021-10-14 15:36:01.330669,2021-10-14 15:36:01.685286,0 days 00:00:00.354617,goss,0.44407696314677403,0.03601060384099522,161,0.2381355912117593,0.5278499739733737,0.3535528596187175,0.3414869029275809,f02bec3c-bc66-44ba-ae5c-3e3ff9b694b7,COMPLETE
759,759,0.3535528596187175,2021-10-14 15:36:01.688287,2021-10-14 15:36:02.040844,0 days 00:00:00.352557,goss,0.5753647508846741,0.06424942234695928,211,0.03473201921093881,0.5084945429087995,0.3535528596187175,0.3414869029275809,a8bde4db-e5d5-4044-a38a-1842e9f6e14e,COMPLETE
760,760,0.3535528596187175,2021-10-14 15:36:02.043840,2021-10-14 15:36:02.406840,0 days 00:00:00.363000,goss,0.4520521794750551,0.5758071024604775,242,0.028883141398464547,0.4843448902561607,0.3535528596187175,0.3414869029275809,b02989b4-0c16-48d7-9c94-01266fc15347,COMPLETE
761,761,0.3535528596187175,2021-10-14 15:36:02.409838,2021-10-14 15:36:02.786841,0 days 00:00:00.377003,goss,0.4267295343310301,0.026226806157443786,194,0.4345183240683391,0.5597323668559511,0.3535528596187175,0.3414869029275809,a06b57d9-a578-4bcc-a68e-890db74a0841,COMPLETE
762,762,0.3535528596187175,2021-10-14 15:36:02.789837,2021-10-14 15:36:03.172841,0 days 00:00:00.383004,goss,0.5220642149768512,0.039818727009020394,112,0.23841970127567982,0.5635311115617188,0.3535528596187175,0.3414869029275809,00588ca4-7911-427e-ae18-39c1414846d3,COMPLETE
763,763,0.3535528596187175,2021-10-14 15:36:03.177840,2021-10-14 15:36:03.545838,0 days 00:00:00.367998,goss,0.4906496627538173,0.807058072170239,222,0.18194205916762463,0.8176063391420559,0.3535528596187175,0.3414869029275809,f7ebd353-c163-4084-82c3-3dd32c669d88,COMPLETE
764,764,0.3535528596187175,2021-10-14 15:36:03.549837,2021-10-14 15:36:03.918389,0 days 00:00:00.368552,goss,0.5655768682867893,0.6174131991444508,97,0.44032223086003547,0.5027843851945724,0.3535528596187175,0.3414869029275809,621d93d1-224b-4c1b-a6a0-14933f963419,COMPLETE
765,765,0.3535528596187175,2021-10-14 15:36:03.920383,2021-10-14 15:36:04.288436,0 days 00:00:00.368053,goss,0.5494116271216303,0.03198578036985391,118,0.04308904472766267,0.46896583451371465,0.3535528596187175,0.3414869029275809,9a19aa67-e405-4cd5-b970-922ec6041800,COMPLETE
766,766,0.3535528596187175,2021-10-14 15:36:04.291432,2021-10-14 15:36:04.675438,0 days 00:00:00.384006,goss,0.45764670042267536,0.9286123308485075,29,0.38188409189917555,0.5817324723475945,0.3535528596187175,0.3414869029275809,f7e09b51-d230-4595-8524-cdd196ea9b57,COMPLETE
767,767,0.3535528596187175,2021-10-14 15:36:04.677436,2021-10-14 15:36:05.045903,0 days 00:00:00.368467,goss,0.5111242579458165,0.7765979102206332,65,0.06913520149950636,0.5749974248749491,0.3535528596187175,0.3414869029275809,93e28d21-d359-4525-88d9-a9f412962665,COMPLETE
768,768,0.3535528596187175,2021-10-14 15:36:05.048898,2021-10-14 15:36:05.410956,0 days 00:00:00.362058,goss,0.5396582449855893,0.6703345492001018,35,0.4059184643583994,0.5920711899153497,0.3535528596187175,0.3414869029275809,39059f1a-6d57-45a6-8b54-d2c2bd7ae892,COMPLETE
769,769,0.3535528596187175,2021-10-14 15:36:05.413948,2021-10-14 15:36:05.770952,0 days 00:00:00.357004,goss,0.4267917928856883,0.7925771184216699,84,0.09738472626409554,0.5856359027285636,0.3535528596187175,0.3414869029275809,73cadd6e-7e0c-4242-ad09-7c634fe3c1ea,COMPLETE
770,770,0.3535528596187175,2021-10-14 15:36:05.773948,2021-10-14 15:36:06.166528,0 days 00:00:00.392580,goss,0.5744114144525618,0.006234656534567019,71,0.4261871921877282,0.5536194923484816,0.3535528596187175,0.3414869029275809,ed2efd77-df2e-4cdc-add2-0c51dd5c5392,COMPLETE
771,771,0.3535528596187175,2021-10-14 15:36:06.169528,2021-10-14 15:36:06.561604,0 days 00:00:00.392076,goss,0.519914206460945,0.7618829490446551,92,0.38689153462321246,0.6081824025325555,0.3535528596187175,0.3414869029275809,d2390c40-c0ba-418c-abc5-8f9410c06c4e,COMPLETE
772,772,0.3535528596187175,2021-10-14 15:36:06.564598,2021-10-14 15:36:06.952597,0 days 00:00:00.387999,goss,0.5745345952169947,0.9873468373877385,57,0.38681838372298966,0.6065059236035569,0.3535528596187175,0.3414869029275809,7355b538-a382-4e43-9fa1-5f806558402f,COMPLETE
773,773,0.3535528596187175,2021-10-14 15:36:06.955599,2021-10-14 15:36:07.364601,0 days 00:00:00.409002,goss,0.5345612360222569,0.9811903228952991,74,0.24796077837309977,0.5929219244003932,0.3535528596187175,0.3414869029275809,98b5df86-0f5e-4c76-a87a-2ad43eefa0b3,COMPLETE
774,774,0.3535528596187175,2021-10-14 15:36:07.367598,2021-10-14 15:36:07.749602,0 days 00:00:00.382004,goss,0.0074767939254735795,0.6956929849035915,56,0.031291857583573376,0.5425622233666493,0.3535528596187175,0.3414869029275809,c4993ad2-db9f-47e1-9cab-280fbc34b239,COMPLETE
775,775,0.3535528596187175,2021-10-14 15:36:07.752597,2021-10-14 15:36:08.155599,0 days 00:00:00.403002,goss,0.48518381309901043,0.007497077171581466,43,0.2854859612966079,0.5750124079079728,0.3535528596187175,0.3414869029275809,4f7a5342-9edb-462c-8f4a-d591dedef89a,COMPLETE
776,776,0.3535528596187175,2021-10-14 15:36:08.158600,2021-10-14 15:36:08.587601,0 days 00:00:00.429001,goss,0.012449135981767823,0.008698988846990068,84,0.34349400992443524,0.6024590197992948,0.3535528596187175,0.3414869029275809,6a5f44b7-6bed-463a-ae78-fef71ba6f474,COMPLETE
777,777,0.3535528596187175,2021-10-14 15:36:08.590599,2021-10-14 15:36:08.990600,0 days 00:00:00.400001,goss,0.5638909750977988,0.006340431271698958,35,0.11256341531525417,0.5564663991096149,0.3535528596187175,0.3414869029275809,bc447f69-2066-43f7-a8ac-da4406aa837e,COMPLETE
778,778,0.3535528596187175,2021-10-14 15:36:08.992599,2021-10-14 15:36:09.443533,0 days 00:00:00.450934,goss,0.020157706531063854,0.006289785120795079,104,0.19524777022832063,0.803542261512385,0.3535528596187175,0.3414869029275809,310428a0-a8dc-4646-955f-c3ca9bdcb441,COMPLETE
779,779,0.3535528596187175,2021-10-14 15:36:09.446533,2021-10-14 15:36:09.984076,0 days 00:00:00.537543,goss,0.05301012112173742,0.009578928863991072,50,0.048863774994544945,0.6332750121355284,0.3535528596187175,0.3414869029275809,d63438aa-27a7-4b87-bfca-2079f21acc73,COMPLETE
780,780,0.3535528596187175,2021-10-14 15:36:09.988076,2021-10-14 15:36:10.503504,0 days 00:00:00.515428,goss,0.05982333391666641,0.0050258132837427685,726,0.16098267692030419,0.6409462691299515,0.3535528596187175,0.3414869029275809,d3032f4a-0e52-4435-a736-2d5d755c8783,COMPLETE
781,781,0.3535528596187175,2021-10-14 15:36:10.506497,2021-10-14 15:36:10.999587,0 days 00:00:00.493090,goss,0.02326289283246409,0.006790372369972812,749,0.07364288612527953,0.6257902561077562,0.3535528596187175,0.3414869029275809,47ba84aa-7448-4afd-a9de-177f97edeceb,COMPLETE
782,782,0.3535528596187175,2021-10-14 15:36:11.003588,2021-10-14 15:36:11.454591,0 days 00:00:00.451003,goss,0.06926830087422524,0.008542110506129385,736,0.10117930887700957,0.7895725879796062,0.3535528596187175,0.3414869029275809,b06664d4-c17e-4acc-b482-0d8759dd6fdf,COMPLETE
783,783,0.3535528596187175,2021-10-14 15:36:11.457587,2021-10-14 15:36:11.869586,0 days 00:00:00.411999,goss,0.03434786665637833,0.007360280938825141,22,0.16247599677810592,0.825887367540303,0.3535528596187175,0.3414869029275809,f3116084-15ba-45fb-aee6-8fe13e435b00,COMPLETE
784,784,0.3535528596187175,2021-10-14 15:36:11.873593,2021-10-14 15:36:12.322449,0 days 00:00:00.448856,goss,0.07190797019731615,0.003909571424332541,755,0.20970318730970186,0.6611013137546913,0.3535528596187175,0.3414869029275809,67cf9e2f-4ae3-4bb0-9cf3-474b9e67562a,COMPLETE
785,785,0.3535528596187175,2021-10-14 15:36:12.325447,2021-10-14 15:36:12.770142,0 days 00:00:00.444695,goss,0.04164096568509194,0.0043508131800745475,719,0.17855710484769927,0.6141825854255611,0.3535528596187175,0.3414869029275809,6ce82dba-792f-4de7-83bd-8b0eeff0e3b4,COMPLETE
786,786,0.3535528596187175,2021-10-14 15:36:12.773136,2021-10-14 15:36:13.220673,0 days 00:00:00.447537,goss,0.059099535224926975,0.009387122738933893,741,0.08813181325986755,0.691996912680663,0.3535528596187175,0.3414869029275809,291fcab8-7950-4edb-ba3f-68386c980b14,COMPLETE
787,787,0.3535528596187175,2021-10-14 15:36:13.223673,2021-10-14 15:36:13.636674,0 days 00:00:00.413001,goss,0.08408709120957583,0.01148976605570012,733,0.08301583774399347,0.6565940421313051,0.3535528596187175,0.3414869029275809,958de27b-ca57-40d8-acd2-aab8ccce20ed,COMPLETE
788,788,0.3535528596187175,2021-10-14 15:36:13.639672,2021-10-14 15:36:14.073673,0 days 00:00:00.434001,goss,0.081841970243615,0.00801836817135094,772,0.14554327030046282,0.7534556393358224,0.3535528596187175,0.3414869029275809,75ba1d86-e45a-4b76-a3b5-14c38cd8c313,COMPLETE
789,789,0.3535528596187175,2021-10-14 15:36:14.076677,2021-10-14 15:36:14.510677,0 days 00:00:00.434000,goss,0.05225413668796604,0.0053402753495581995,703,0.2660989258034869,0.7277590989097485,0.3535528596187175,0.3414869029275809,f329bf3d-dfa3-4ff9-bfe9-a3b84f22eb21,COMPLETE
790,790,0.3535528596187175,2021-10-14 15:36:14.517681,2021-10-14 15:36:14.943677,0 days 00:00:00.425996,goss,0.08757189861476614,0.004156048651129188,716,0.18920048565416694,0.7078757477311458,0.3535528596187175,0.3414869029275809,18ddb7cf-1096-42db-a2d5-ce1cbdb56414,COMPLETE
791,791,0.3535528596187175,2021-10-14 15:36:14.947674,2021-10-14 15:36:15.550672,0 days 00:00:00.602998,goss,0.07837131995286598,0.009931851442353291,694,0.2611310536802207,0.7120814333900525,0.3535528596187175,0.3414869029275809,8aaf5128-b24f-4406-9c5d-33de5270920c,COMPLETE
792,792,0.3535528596187175,2021-10-14 15:36:15.552668,2021-10-14 15:36:16.491307,0 days 00:00:00.938639,goss,0.060932745955518626,0.004668902760968411,741,0.3051357895822323,0.6873472919917709,0.3535528596187175,0.3414869029275809,c1badd94-2c4d-47f9-bcb0-eb5f94e4ab81,COMPLETE
793,793,0.3535528596187175,2021-10-14 15:36:16.495310,2021-10-14 15:36:17.032379,0 days 00:00:00.537069,goss,0.06398013332567415,0.005557373273632664,721,0.274095143429194,0.708859633500992,0.3535528596187175,0.3414869029275809,a5c6cce1-e801-4e13-b34e-503804df3a06,COMPLETE
794,794,0.3535528596187175,2021-10-14 15:36:17.035380,2021-10-14 15:36:17.457382,0 days 00:00:00.422002,goss,0.0489639479808347,0.011921116725323349,753,0.16437837812712353,0.790423718328759,0.3535528596187175,0.3414869029275809,10809cf2-1231-4bda-831b-8f22d4d082ff,COMPLETE
795,795,0.3535528596187175,2021-10-14 15:36:17.460380,2021-10-14 15:36:18.000380,0 days 00:00:00.540000,goss,0.09325766146450126,0.012750256428361128,775,0.23322542911295982,0.7587585668362907,0.3535528596187175,0.3414869029275809,2febb501-387e-40fa-84c7-c656eb53d1c1,COMPLETE
796,796,0.3535528596187175,2021-10-14 15:36:18.003379,2021-10-14 15:36:18.413376,0 days 00:00:00.409997,goss,0.09341378424494276,0.014810733597173747,773,0.14709162093199163,0.737306958731244,0.3535528596187175,0.3414869029275809,eeddd0e1-d2ff-43ed-bccf-54416b556546,COMPLETE
797,797,0.3535528596187175,2021-10-14 15:36:18.416377,2021-10-14 15:36:18.833376,0 days 00:00:00.416999,goss,0.09969663944803403,0.010438287390431584,760,0.29638285300015754,0.6696261675490109,0.3535528596187175,0.3414869029275809,105e4dc6-5bb1-45c6-ade4-7b3dbca2022b,COMPLETE
798,798,0.3535528596187175,2021-10-14 15:36:18.835380,2021-10-14 15:36:19.301377,0 days 00:00:00.465997,goss,0.10316003137903063,0.021409218757401087,682,0.2163961837858333,0.6545555460197392,0.3535528596187175,0.3414869029275809,cb6c0c8c-9a61-4de9-8241-a24f441d419b,COMPLETE
799,799,0.3535528596187175,2021-10-14 15:36:19.305378,2021-10-14 15:36:19.766375,0 days 00:00:00.460997,goss,0.11321213851942935,0.01885957514999755,684,0.10677439814882196,0.6808319330720906,0.3535528596187175,0.3414869029275809,edea78d1-edb6-4c21-acec-bd755ce32afc,COMPLETE
800,800,0.3535528596187175,2021-10-14 15:36:19.769375,2021-10-14 15:36:20.211379,0 days 00:00:00.442004,goss,0.07798250422572886,0.014082595894951937,707,0.22521233663064177,0.7660727124867511,0.3535528596187175,0.3414869029275809,8ec7c72d-c287-4e67-81d7-ef8ca02ed89e,COMPLETE
801,801,0.3535528596187175,2021-10-14 15:36:20.215376,2021-10-14 15:36:20.673382,0 days 00:00:00.458006,goss,0.10567966603589138,0.019737472158779468,780,0.21707419143590106,0.7251335098557685,0.3535528596187175,0.3414869029275809,f7cb2152-019d-4239-8617-2622fcee2bc9,COMPLETE
802,802,0.3535528596187175,2021-10-14 15:36:20.677377,2021-10-14 15:36:21.115379,0 days 00:00:00.438002,goss,0.0751260670579396,0.011809640514629438,788,0.1377179410992727,0.7760316267269259,0.3535528596187175,0.3414869029275809,61c5d3fe-1677-48a9-89b7-9ec1dd9fd6a8,COMPLETE
803,803,0.3535528596187175,2021-10-14 15:36:21.119377,2021-10-14 15:36:21.632377,0 days 00:00:00.513000,goss,0.1111489316257503,0.016004492519838695,788,0.20605856409143028,0.7505416117069731,0.3535528596187175,0.3414869029275809,03ae2fcb-3935-4490-bc46-d39bc2868942,COMPLETE
804,804,0.3535528596187175,2021-10-14 15:36:21.635378,2021-10-14 15:36:22.062380,0 days 00:00:00.427002,goss,0.09231781042575316,0.02127017866863673,675,0.2193736429773468,0.7085752561970786,0.3535528596187175,0.3414869029275809,850392e0-6965-4375-854e-d0c87922e30c,COMPLETE
805,805,0.3535528596187175,2021-10-14 15:36:22.065380,2021-10-14 15:36:22.653382,0 days 00:00:00.588002,goss,0.11703707384588002,0.013620367482110832,701,0.15637611474429422,0.7698648072084615,0.3535528596187175,0.3414869029275809,4bfed4ab-7246-4e42-b39a-ab197a9948b7,COMPLETE
806,806,0.3535528596187175,2021-10-14 15:36:22.657379,2021-10-14 15:36:23.122478,0 days 00:00:00.465099,goss,0.12363939039513745,0.01693057125941661,669,0.07807810372609353,0.7374441375053257,0.3535528596187175,0.3414869029275809,a885c151-1a16-4888-9fbe-9249b214fc49,COMPLETE
807,807,0.3535528596187175,2021-10-14 15:36:23.126481,2021-10-14 15:36:23.636883,0 days 00:00:00.510402,goss,0.09526185210961503,0.013245075690768028,692,0.12685759309408373,0.7427140549884664,0.3535528596187175,0.3414869029275809,90dfdb2c-aaa9-41a4-96b7-1492e08e75ed,COMPLETE
808,808,0.3535528596187175,2021-10-14 15:36:23.641885,2021-10-14 15:36:24.141877,0 days 00:00:00.499992,goss,0.11487428392827093,0.01803628454529772,703,0.07767204534258576,0.6825409007350313,0.3535528596187175,0.3414869029275809,ff31f808-1db7-47fe-937c-4a6632f52883,COMPLETE
809,809,0.3535528596187175,2021-10-14 15:36:24.144879,2021-10-14 15:36:24.694504,0 days 00:00:00.549625,goss,0.1190218115545514,0.022574042647207467,668,0.02453867006731994,0.6975425303287214,0.3535528596187175,0.3414869029275809,810f596e-ff1e-4c1e-bab5-4dec21a47f23,COMPLETE
810,810,0.3535528596187175,2021-10-14 15:36:24.697503,2021-10-14 15:36:25.116219,0 days 00:00:00.418716,goss,0.09406133426318423,0.018703934471083747,800,0.12288156225226479,0.7324066572356687,0.3535528596187175,0.3414869029275809,e7b4e3bd-612f-4e2c-850a-b0507e1e7187,COMPLETE
811,811,0.3535528596187175,2021-10-14 15:36:25.119211,2021-10-14 15:36:25.574210,0 days 00:00:00.454999,goss,0.13084222852225103,0.01616820463688279,795,0.2006661055804738,0.7676956990861715,0.3535528596187175,0.3414869029275809,b910475f-9127-4238-9b06-42e35029a556,COMPLETE
812,812,0.3535528596187175,2021-10-14 15:36:25.579209,2021-10-14 15:36:26.101664,0 days 00:00:00.522455,goss,0.11295104149584728,0.022705865638954416,796,0.2468014072720428,0.7209317383993185,0.3535528596187175,0.3414869029275809,d9c89679-d32f-445f-a37c-58fc5dd3dec6,COMPLETE
813,813,0.3535528596187175,2021-10-14 15:36:26.104672,2021-10-14 15:36:26.674619,0 days 00:00:00.569947,goss,0.12377697321925211,0.015504121616975564,812,0.13757139778928865,0.674878720312921,0.3535528596187175,0.3414869029275809,1e44bc84-5a84-4b23-98ee-59687e21d553,COMPLETE
814,814,0.3535528596187175,2021-10-14 15:36:26.677619,2021-10-14 15:36:27.219622,0 days 00:00:00.542003,goss,0.03990703577416067,0.018463834804174573,765,0.2889260622092429,0.7030360077374138,0.3535528596187175,0.3414869029275809,4b83a7e1-9751-4b88-bbfb-259110ff93bc,COMPLETE
815,815,0.3535528596187175,2021-10-14 15:36:27.222618,2021-10-14 15:36:27.679186,0 days 00:00:00.456568,goss,0.09721186278417182,0.013686956555545698,660,0.1120648752969177,0.8123315211893912,0.3535528596187175,0.3414869029275809,b7b966c6-07c0-4a37-87ff-14625ce747c0,COMPLETE
816,816,0.3535528596187175,2021-10-14 15:36:27.682185,2021-10-14 15:36:28.087185,0 days 00:00:00.405000,goss,0.1344344360386576,0.017172455615805948,667,0.14839727920389845,0.6755963874292333,0.3535528596187175,0.3414869029275809,788705ea-0ad4-43a9-a63c-707838e336ac,COMPLETE
817,817,0.3535528596187175,2021-10-14 15:36:28.091184,2021-10-14 15:36:28.522182,0 days 00:00:00.430998,goss,0.13514498393796615,0.02327823250559984,659,0.24305700256320265,0.7517765106712232,0.3535528596187175,0.3414869029275809,6a56bc8d-c8b9-42b3-b52d-772c5412d205,COMPLETE
818,818,0.3535528596187175,2021-10-14 15:36:28.526189,2021-10-14 15:36:29.067270,0 days 00:00:00.541081,goss,0.1260074541126139,0.01578244151104777,677,0.20176733234880245,0.6620202605133374,0.3535528596187175,0.3414869029275809,6d392a0b-3d01-4286-803c-6fdfbb36a9ed,COMPLETE
819,819,0.3535528596187175,2021-10-14 15:36:29.071279,2021-10-14 15:36:29.569605,0 days 00:00:00.498326,goss,0.022433287978063418,0.02003344974457377,653,0.15440653236932875,0.8366440958303809,0.3535528596187175,0.3414869029275809,ca4b4070-bf01-4081-ae5a-0de34dbb047c,COMPLETE
820,820,0.3535528596187175,2021-10-14 15:36:29.572606,2021-10-14 15:36:30.020603,0 days 00:00:00.447997,goss,0.14598971204427694,0.019663458595987206,813,0.20470315880820333,0.6892223526076278,0.3535528596187175,0.3414869029275809,d4ca674e-7a5f-47ae-b1cf-390fd0198628,COMPLETE
821,821,0.3535528596187175,2021-10-14 15:36:30.023603,2021-10-14 15:36:30.718824,0 days 00:00:00.695221,goss,0.14542459659117413,0.014878788447013994,655,0.2673406643920696,0.7166080396441913,0.3535528596187175,0.3414869029275809,a94f371f-c397-49f8-afcc-66277ca5830f,COMPLETE
822,822,0.3535528596187175,2021-10-14 15:36:30.722817,2021-10-14 15:36:31.205815,0 days 00:00:00.482998,goss,0.14033881937092904,0.003766061021430641,812,0.1524588718731001,0.7905888556067302,0.3535528596187175,0.3414869029275809,3332545a-61fe-4095-8c41-7d1a588bd123,COMPLETE
823,823,0.3535528596187175,2021-10-14 15:36:31.209824,2021-10-14 15:36:31.674355,0 days 00:00:00.464531,goss,0.12788018876539162,0.0032024386201275246,641,0.15217057811450405,0.7306781521815575,0.3535528596187175,0.3414869029275809,4d48cc14-b9dd-4926-913c-9d32434224cb,COMPLETE
824,824,0.3535528596187175,2021-10-14 15:36:31.677354,2021-10-14 15:36:32.100349,0 days 00:00:00.422995,goss,0.1492203760962987,0.003391340013002007,810,0.25912181947853136,0.6984470350873228,0.3535528596187175,0.3414869029275809,b5a3c011-4915-4136-96c8-9737d03dc147,COMPLETE
825,825,0.3535528596187175,2021-10-14 15:36:32.103350,2021-10-14 15:36:32.545352,0 days 00:00:00.442002,goss,0.036241495631222365,0.0031899109240501856,829,0.1276106623911563,0.847277702833197,0.3535528596187175,0.3414869029275809,53715777-62e3-479f-bd3e-f7f42f6cbd36,COMPLETE
826,826,0.3535528596187175,2021-10-14 15:36:32.548350,2021-10-14 15:36:32.969353,0 days 00:00:00.421003,goss,0.15979619397591488,0.0026487586143788336,842,0.18333536710656745,0.8097746777839187,0.3535528596187175,0.3414869029275809,2c2532e7-9ff5-413a-b17e-72f30d45221c,COMPLETE
827,827,0.3535528596187175,2021-10-14 15:36:32.973352,2021-10-14 15:36:33.393353,0 days 00:00:00.420001,goss,0.005836569643733418,0.023588296671183423,817,0.1015676547771775,0.6319169262554815,0.3535528596187175,0.3414869029275809,b93c0d11-b250-4f25-bc0d-f4fce1b7cb31,COMPLETE
828,828,0.3535528596187175,2021-10-14 15:36:33.397350,2021-10-14 15:36:33.814575,0 days 00:00:00.417225,goss,0.1606193943638228,0.002847907884553055,836,0.2212820847185412,0.6504159997165412,0.3535528596187175,0.3414869029275809,0deb5a69-ad66-4d7a-a38a-f96a433cdba4,COMPLETE
829,829,0.3535528596187175,2021-10-14 15:36:33.818576,2021-10-14 15:36:34.215576,0 days 00:00:00.397000,goss,0.14391001442279924,0.001986055879934474,838,0.15034630122984988,0.6485359109497831,0.3535528596187175,0.3414869029275809,846b8ef0-811b-4d66-93fa-165b70dace5b,COMPLETE
830,830,0.3535528596187175,2021-10-14 15:36:34.218578,2021-10-14 15:36:34.588574,0 days 00:00:00.369996,gbdt,0.1622237798817064,0.002881984995150861,845,,,0.3535528596187175,0.3414869029275809,facfeaa7-5c85-4641-928f-26deb9a94457,COMPLETE
